query_table,query_column,query_value,candidate_table,candidate_column,candidate_value,similarity_score
Election_left.csv,title,"manila local elections, 2010",Legislature_left,title,manila city council,0.74811190366745
Election_left.csv,title,"united states senate elections, 2008",Legislature_left,title,united states senate,0.7463300228118896
Election_left.csv,title,"nevada gubernatorial election, 2006",Legislature_left,title,nevada legislature,0.7454358339309692
Election_left.csv,title,"vermont gubernatorial election, 2006",Legislature_left,title,vermont senate,0.7454032301902771
Election_left.csv,title,"indian general election in tripura, 2009",Legislature_left,title,tripura legislative assembly,0.744731605052948
Election_left.csv,title,"dominican republic presidential election, 2012",Legislature_left,title,congress of the dominican republic,0.7437522411346436
Election_left.csv,title,"fijian general election, 2006",Legislature_left,title,parliament of fiji islands,0.7434341311454773
Election_left.csv,title,"puerto rico gubernatorial election, 2008",Legislature_left,title,legislative assembly of puerto rico,0.7425446510314941
Election_left.csv,title,"united states senate election in indiana, 1980",Legislature_left,title,indiana senate,0.7423839569091797
Election_left.csv,title,"united states house of representatives elections in virginia, 2014",Legislature_left,title,virginia house of delegates,0.7423720359802246
