query_table,query_column,query_index,candidate_table,candidate_column,similarity_score,query_sample_values,candidate_sample_values
FootballLeagueSeason_left.csv,title,1,NationalFootballLeagueSeason_left,title,0.5524775385856628,"2003 Norwegian Premier League, 2004 Norwegian Premier League, Montreal Machine, 2003 Major League Soccer season, 1996 Major League Soccer season","Montreal Machine, New York/New Jersey Knights, San Antonio Riders, Sacramento Surge, Steagles"
FootballLeagueSeason_left.csv,title,1,FootballLeagueSeason_right,title,0.5308634042739868,"2003 Norwegian Premier League, 2004 Norwegian Premier League, Montreal Machine, 2003 Major League Soccer season, 1996 Major League Soccer season","2003 Tippeligaen, 2004 Tippeligaen, 2005 Tippeligaen, 2002 Tippeligaen, 2001 Tippeligaen"
FootballLeagueSeason_left.csv,title,1,SoccerClubSeason_left,title,0.4972071647644043,"2003 Norwegian Premier League, 2004 Norwegian Premier League, Montreal Machine, 2003 Major League Soccer season, 1996 Major League Soccer season","2005 SK Brann season, 2006 Australia national football team season, 2007 Australia national football team season, 2007 Shelbourne F.C. season, 2006 Houston Dynamo season"
FootballLeagueSeason_left.csv,title,1,MotorsportSeason_left,title,0.4805506467819214,"2003 Norwegian Premier League, 2004 Norwegian Premier League, Montreal Machine, 2003 Major League Soccer season, 1996 Major League Soccer season","2005 NASCAR Nextel Cup Series, 2005 GP2 Series season, 2005 NASCAR Busch Series, 2005 NASCAR Craftsman Truck Series, 2006 NASCAR Nextel Cup Series"
FootballLeagueSeason_left.csv,title,1,NCAATeamSeason_left,title,0.4772951900959015,"2003 Norwegian Premier League, 2004 Norwegian Premier League, Montreal Machine, 2003 Major League Soccer season, 1996 Major League Soccer season","1899 Sewanee Tigers football team, 2005 Texas Longhorns football team, 1995 Nebraska Cornhuskers football team, 2006 Texas Longhorns football team, 2006 Colorado Buffaloes football team"
FootballLeagueSeason_left.csv,title,1,SoccerClubSeason_right,title,0.4674571752548218,"2003 Norwegian Premier League, 2004 Norwegian Premier League, Montreal Machine, 2003 Major League Soccer season, 1996 Major League Soccer season","2006 Australia national soccer team season, 2007 Australia national soccer team season, 2008 Australia national soccer team season, 2005 Australia national soccer team season, 2009 Australia national soccer team season"
FootballLeagueSeason_left.csv,title,1,SoccerTournament_right,title,0.46251699328422546,"2003 Norwegian Premier League, 2004 Norwegian Premier League, Montreal Machine, 2003 Major League Soccer season, 1996 Major League Soccer season","2004 AFF Championship, 2005 UEFA European Under-19 Championship, 2004–05 OFC Club Championship, 2000–01 Oceania Club Championship, 2006 UEFA European Under-19 Championship"
FootballLeagueSeason_left.csv,title,1,SoccerLeague_right,title,0.4622517228126526,"2003 Norwegian Premier League, 2004 Norwegian Premier League, Montreal Machine, 2003 Major League Soccer season, 1996 Major League Soccer season","National League (English football), USL W-League, J1 League, Gibraltar Premier Division, Persian Gulf Pro League"
FootballLeagueSeason_left.csv,title,1,FootballMatch_left,title,0.46214115619659424,"2003 Norwegian Premier League, 2004 Norwegian Premier League, Montreal Machine, 2003 Major League Soccer season, 1996 Major League Soccer season","1966 FIFA World Cup Final, Battle of Santiago, Battle of Berne, Battle of Bramall Lane, 1972 European Cup Winners' Cup Final"
FootballLeagueSeason_left.csv,title,1,SoccerLeague_left,title,0.46038246154785156,"2003 Norwegian Premier League, 2004 Norwegian Premier League, Montreal Machine, 2003 Major League Soccer season, 1996 Major League Soccer season","Premier League, Serie A, Schleswig-Holstein, La Liga, Mitropa Cup"
FootballLeagueSeason_left.csv,title,1,SoccerTournament_left,title,0.45852130651474,"2003 Norwegian Premier League, 2004 Norwegian Premier League, Montreal Machine, 2003 Major League Soccer season, 1996 Major League Soccer season","2002 FIFA World Cup, 1930 FIFA World Cup, 1934 FIFA World Cup, 1938 FIFA World Cup, 1950 FIFA World Cup"
FootballLeagueSeason_left.csv,title,1,SportsLeague_right,title,0.45172131061553955,"2003 Norwegian Premier League, 2004 Norwegian Premier League, Montreal Machine, 2003 Major League Soccer season, 1996 Major League Soccer season","World Rugby Sevens Series, Sevens World Series, FIVB Volleyball World Cup, National Basketball League (Australia), National League (English football)"
FootballLeagueSeason_left.csv,title,1,MotorsportSeason_right,title,0.4511045515537262,"2003 Norwegian Premier League, 2004 Norwegian Premier League, Montreal Machine, 2003 Major League Soccer season, 1996 Major League Soccer season","2005 GP2 Series, 1976 in NASCAR, 2004 World Rally Championship, 2005 World Rally Championship, 2003 World Rally Championship"
FootballLeagueSeason_left.csv,title,1,SportsLeague_left,title,0.450091689825058,"2003 Norwegian Premier League, 2004 Norwegian Premier League, Montreal Machine, 2003 Major League Soccer season, 1996 Major League Soccer season","American Football League, Devon, Premier League, Italian Football League, Serie A"
FootballLeagueSeason_left.csv,title,1,Tournament_right,title,0.446071594953537,"2003 Norwegian Premier League, 2004 Norwegian Premier League, Montreal Machine, 2003 Major League Soccer season, 1996 Major League Soccer season","Women's PGA Championship, AT&T Pebble Beach Pro-Am, 2004 AFF Championship, Senior Open Championship, ANA Inspiration"
FootballLeagueSeason_left.csv,title,1,TennisTournament_left,title,0.4457186460494995,"2003 Norwegian Premier League, 2004 Norwegian Premier League, Montreal Machine, 2003 Major League Soccer season, 1996 Major League Soccer season","2002 US Open (tennis), 2005 Australian Open, 1999 Australian Open, 1991 French Open, 2000 Tennis Masters Cup"
FootballLeagueSeason_left.csv,title,1,RugbyLeague_left,title,0.44314736127853394,"2003 Norwegian Premier League, 2004 Norwegian Premier League, Montreal Machine, 2003 Major League Soccer season, 1996 Major League Soccer season","Devon, Rugby World Cup, Six Nations Championship, Cumbria, The Rugby Championship"
FootballLeagueSeason_left.csv,title,1,Tournament_left,title,0.4408523440361023,"2003 Norwegian Premier League, 2004 Norwegian Premier League, Montreal Machine, 2003 Major League Soccer season, 1996 Major League Soccer season","2002 FIFA World Cup, 1930 FIFA World Cup, 1934 FIFA World Cup, 1938 FIFA World Cup, 1950 FIFA World Cup"
FootballLeagueSeason_left.csv,title,1,Award_left,title,0.4384484589099884,"2003 Norwegian Premier League, 2004 Norwegian Premier League, Montreal Machine, 2003 Major League Soccer season, 1996 Major League Soccer season","Academy Award, Academy Award for Best Production Design, Major League Baseball Most Valuable Player Award, Major League Baseball Rookie of the Year Award, Man Booker Prize"
FootballLeagueSeason_left.csv,title,1,BasketballTeam_right,title,0.42577236890792847,"2003 Norwegian Premier League, 2004 Norwegian Premier League, Montreal Machine, 2003 Major League Soccer season, 1996 Major League Soccer season","New Orleans Pelicans, Charlotte Hornets, Polonia Warszawa (basketball), Asseco Gdynia, Melbourne United"
FootballLeagueSeason_left.csv,title,1,FootballMatch_right,title,0.4240435063838959,"2003 Norwegian Premier League, 2004 Norwegian Premier League, Montreal Machine, 2003 Major League Soccer season, 1996 Major League Soccer season","Battle of Santiago (1962 FIFA World Cup), Battle of Berne (1954 FIFA World Cup), 2005 international rules series, Austria v Switzerland (1954 FIFA World Cup), 2001 Germany v England football match"
FootballLeagueSeason_left.csv,title,1,BasketballTeam_left,title,0.4236540198326111,"2003 Norwegian Premier League, 2004 Norwegian Premier League, Montreal Machine, 2003 Major League Soccer season, 1996 Major League Soccer season","Boston Celtics, Brooklyn Nets, New York Knicks, Orlando Magic, Miami Heat"
FootballLeagueSeason_left.csv,title,1,NCAATeamSeason_right,title,0.42069166898727417,"2003 Norwegian Premier League, 2004 Norwegian Premier League, Montreal Machine, 2003 Major League Soccer season, 1996 Major League Soccer season","1893 LSU football team, 1894 LSU football team, 1895 LSU football team, 1892 Alabama Cadets football team, 1894 Alabama Crimson White football team"
FootballLeagueSeason_left.csv,title,1,Election_left,title,0.4187702238559723,"2003 Norwegian Premier League, 2004 Norwegian Premier League, Montreal Machine, 2003 Major League Soccer season, 1996 Major League Soccer season","United Kingdom general election, 2001, United States presidential election, 2000, United States presidential election, 1996, United Kingdom general election, 1997, United States presidential election, 1988"
FootballLeagueSeason_left.csv,title,1,Election_right,title,0.4171156883239746,"2003 Norwegian Premier League, 2004 Norwegian Premier League, Montreal Machine, 2003 Major League Soccer season, 1996 Major League Soccer season","Scottish Parliament election, 2003, California gubernatorial recall election, 2003, Scottish Parliament election, 1999, Belgian general election, 2003, Danish general election, 2001"
FootballLeagueSeason_left.csv,title,1,Race_right,title,0.41453009843826294,"2003 Norwegian Premier League, 2004 Norwegian Premier League, Montreal Machine, 2003 Major League Soccer season, 1996 Major League Soccer season","2000 Guineas Stakes, St Leger Stakes, W.S. Cox Plate, 1000 Guineas Stakes, Duchess of Cambridge Stakes"
FootballLeagueSeason_left.csv,title,1,TennisTournament_right,title,0.4122081398963928,"2003 Norwegian Premier League, 2004 Norwegian Premier League, Montreal Machine, 2003 Major League Soccer season, 1996 Major League Soccer season","2000 Tennis Masters Cup and ATP Tour World Championships, 2008 Challenge Bell, 2010 Aegon Championships, 2009 Challenge Bell, 1996 Challenge Bell"
FootballLeagueSeason_left.csv,title,1,Wrestler_right,title,0.41111207008361816,"2003 Norwegian Premier League, 2004 Norwegian Premier League, Montreal Machine, 2003 Major League Soccer season, 1996 Major League Soccer season","Amy Dumas, Chavo Guerrero Sr., Chavo Guerrero Jr., Val Venis, Rhino (wrestler)"
FootballLeagueSeason_left.csv,title,1,TelevisionStation_right,title,0.40977606177330017,"2003 Norwegian Premier League, 2004 Norwegian Premier League, Montreal Machine, 2003 Major League Soccer season, 1996 Major League Soccer season","ITV, Fox Sports Net, Showtime (TV network), ITV1, TLC (TV network)"
FootballLeagueSeason_left.csv,title,1,RailwayLine_left,title,0.40896105766296387,"2003 Norwegian Premier League, 2004 Norwegian Premier League, Montreal Machine, 2003 Major League Soccer season, 1996 Major League Soccer season","London Post Office Railway, Waterloo & City line, Tandy Center Subway, Central line, Metropolitan line"
FootballLeagueSeason_left.csv,title,1,RugbyLeague_right,title,0.40865904092788696,"2003 Norwegian Premier League, 2004 Norwegian Premier League, Montreal Machine, 2003 Major League Soccer season, 1996 Major League Soccer season","World Rugby Sevens Series, World Club Series, Mitre 10 Cup, Pro12, League Cup (rugby league)"
FootballLeagueSeason_left.csv,title,1,SportFacility_right,title,0.40855199098587036,"2003 Norwegian Premier League, 2004 Norwegian Premier League, Montreal Machine, 2003 Major League Soccer season, 1996 Major League Soccer season","Centre Bell, Talking Stick Resort Arena, Moda Center, Astrodome, NRG Stadium"
FootballLeagueSeason_left.csv,title,1,Stadium_right,title,0.4073205292224884,"2003 Norwegian Premier League, 2004 Norwegian Premier League, Montreal Machine, 2003 Major League Soccer season, 1996 Major League Soccer season","Centre Bell, Talking Stick Resort Arena, Moda Center, Astrodome, NRG Stadium"
FootballLeagueSeason_left.csv,title,1,Venue_left,title,0.4070912003517151,"2003 Norwegian Premier League, 2004 Norwegian Premier League, Montreal Machine, 2003 Major League Soccer season, 1996 Major League Soccer season","Fenway Park, La Scala, Moulin Rouge, Savoy Theatre, Abbey Road Studios"
FootballLeagueSeason_left.csv,title,1,Race_left,title,0.40564045310020447,"2003 Norwegian Premier League, 2004 Norwegian Premier League, Montreal Machine, 2003 Major League Soccer season, 1996 Major League Soccer season","Kentucky Derby, Melbourne Cup, Tour de France, Preakness Stakes, Kentucky Oaks"
FootballLeagueSeason_left.csv,title,1,Magazine_right,title,0.4028395712375641,"2003 Norwegian Premier League, 2004 Norwegian Premier League, Montreal Machine, 2003 Major League Soccer season, 1996 Major League Soccer season","The Raven: Anarchist Quarterly, Next Magazine (Chinese magazine), Men's Health, Seventeen (American magazine), Liberty (libertarian magazine)"
FootballLeagueSeason_left.csv,title,1,Wrestler_left,title,0.4027281403541565,"2003 Norwegian Premier League, 2004 Norwegian Premier League, Montreal Machine, 2003 Major League Soccer season, 1996 Major League Soccer season","Sean Waltman, Pedro Morales, Bruiser Brody, Shirley Crabtree, Lita (wrestler)"
FootballLeagueSeason_left.csv,title,1,TelevisionStation_left,title,0.40176650881767273,"2003 Norwegian Premier League, 2004 Norwegian Premier League, Montreal Machine, 2003 Major League Soccer season, 1996 Major League Soccer season","BBC Red Button, BBC News (TV channel), Channel 4, MTV, BBC World News"
FootballLeagueSeason_left.csv,title,1,Venue_right,title,0.40131986141204834,"2003 Norwegian Premier League, 2004 Norwegian Premier League, Montreal Machine, 2003 Major League Soccer season, 1996 Major League Soccer season","Epstein Theatre, Orchestra Hall (Detroit), Barclaycard Arena, La Monnaie/De Munt, Orchestra Hall (Minneapolis, Minnesota)"
FootballLeagueSeason_left.csv,title,1,NationalFootballLeagueSeason_right,title,0.3991461396217346,"2003 Norwegian Premier League, 2004 Norwegian Premier League, Montreal Machine, 2003 Major League Soccer season, 1996 Major League Soccer season","1900 Homestead Library & Athletic Club football season, 2003 FC Barcelona Dragons season, 1905 Canton Athletic Club season, 1911 Canton Professionals season, 1912 Canton Professionals season"
FootballLeagueSeason_left.csv,title,1,RailwayLine_right,title,0.3982889950275421,"2003 Norwegian Premier League, 2004 Norwegian Premier League, Montreal Machine, 2003 Major League Soccer season, 1996 Major League Soccer season","Central line (London Underground), Line 3 Scarborough, Jungfraubahn, Wengernalpbahn, Hankyū Kyōto Main Line"
FootballLeagueSeason_left.csv,title,1,Device_right,title,0.39626631140708923,"2003 Norwegian Premier League, 2004 Norwegian Premier League, Montreal Machine, 2003 Major League Soccer season, 1996 Major League Soccer season","Game com, Crossbow bolt, 32X, Sega CD, Tsurugi (sword)"
FootballLeagueSeason_left.csv,title,1,Song_left,title,0.39605581760406494,"2003 Norwegian Premier League, 2004 Norwegian Premier League, Montreal Machine, 2003 Major League Soccer season, 1996 Major League Soccer season","America the Beautiful, Go Down Moses, Take Me Out to the Ball Game, Twinkle Twinkle Little Star, Flower of Scotland"
FootballLeagueSeason_left.csv,title,1,ChristianBishop_right,title,0.39589840173721313,"2003 Norwegian Premier League, 2004 Norwegian Premier League, Montreal Machine, 2003 Major League Soccer season, 1996 Major League Soccer season","Ealdred (archbishop of York), Saint Matthew, Bartholomew I of Constantinople, Pandulf Verraccio, William Courtenay"
FootballLeagueSeason_left.csv,title,1,Device_left,title,0.39566487073898315,"2003 Norwegian Premier League, 2004 Norwegian Premier League, Montreal Machine, 2003 Major League Soccer season, 1996 Major League Soccer season","MessagePad, Apple I, AK-47, Amiga, Acorn Electron"
FootballLeagueSeason_left.csv,title,1,GovernmentAgency_left,title,0.39531466364860535,"2003 Norwegian Premier League, 2004 Norwegian Premier League, Montreal Machine, 2003 Major League Soccer season, 1996 Major League Soccer season","Canadian Radio-television and Telecommunications Commission, Cheka, Centers for Disease Control and Prevention, California Department of Transportation, DARPA"
FootballLeagueSeason_left.csv,title,1,Stadium_left,title,0.3946554362773895,"2003 Norwegian Premier League, 2004 Norwegian Premier League, Montreal Machine, 2003 Major League Soccer season, 1996 Major League Soccer season","Craven Cottage, Cardiff Arms Park, Melbourne Cricket Ground, Shea Stadium, Yankee Stadium (1923)"
FootballLeagueSeason_left.csv,title,1,Artwork_left,title,0.39449793100357056,"2003 Norwegian Premier League, 2004 Norwegian Premier League, Montreal Machine, 2003 Major League Soccer season, 1996 Major League Soccer season","David (Michelangelo), Venus de Milo, Manneken Pis, Mona Lisa, The Last Supper (Leonardo da Vinci)"
FootballLeagueSeason_left.csv,title,1,SportFacility_left,title,0.39188334345817566,"2003 Norwegian Premier League, 2004 Norwegian Premier League, Montreal Machine, 2003 Major League Soccer season, 1996 Major League Soccer season","Craven Cottage, Cardiff Arms Park, Melbourne Cricket Ground, Shea Stadium, Yankee Stadium (1923)"
FootballLeagueSeason_left.csv,title,1,MemberOfParliament_right,title,0.3912452459335327,"2003 Norwegian Premier League, 2004 Norwegian Premier League, Montreal Machine, 2003 Major League Soccer season, 1996 Major League Soccer season","George Stevenson (MP), Edward Jerningham Wakefield, Greville Janner, Joshua Benjamin Jeyaretnam, Roger Williams (UK politician)"
UnitOfWork_left.csv,title,2,UnitOfWork_right,title,0.5305963754653931,"Marbury v. Madison, Eldred v. Ashcroft, Edwards v. Aguillard, Brown v. Board of Education, Roe v. Wade","Heart of Atlanta Motel, Inc. v. United States, NAACP v. Alabama, Santa Clara County v. Southern Pacific Railroad Co., Connecticut General Life Insurance Co. v. Johnson, Brushaber v. Union Pacific Railroad Co."
UnitOfWork_left.csv,title,2,Case_right,title,0.5305963754653931,"Marbury v. Madison, Eldred v. Ashcroft, Edwards v. Aguillard, Brown v. Board of Education, Roe v. Wade","Heart of Atlanta Motel, Inc. v. United States, NAACP v. Alabama, Santa Clara County v. Southern Pacific Railroad Co., Connecticut General Life Insurance Co. v. Johnson, Brushaber v. Union Pacific Railroad Co."
UnitOfWork_left.csv,title,2,Case_left,title,0.5222650170326233,"Marbury v. Madison, Eldred v. Ashcroft, Edwards v. Aguillard, Brown v. Board of Education, Roe v. Wade","Marbury v. Madison, Eldred v. Ashcroft, Edwards v. Aguillard, Brown v. Board of Education, Roe v. Wade"
UnitOfWork_left.csv,title,2,ChristianBishop_left,title,0.4419255554676056,"Marbury v. Madison, Eldred v. Ashcroft, Edwards v. Aguillard, Brown v. Board of Education, Roe v. Wade","Ambrose, Ealdred (bishop), Absalon, Augustine of Hippo, Antipope John XXIII"
UnitOfWork_left.csv,title,2,GovernmentAgency_left,title,0.4319244623184204,"Marbury v. Madison, Eldred v. Ashcroft, Edwards v. Aguillard, Brown v. Board of Education, Roe v. Wade","Canadian Radio-television and Telecommunications Commission, Cheka, Centers for Disease Control and Prevention, California Department of Transportation, DARPA"
UnitOfWork_left.csv,title,2,GovernmentAgency_right,title,0.4293842315673828,"Marbury v. Madison, Eldred v. Ashcroft, Edwards v. Aguillard, Brown v. Board of Education, Roe v. Wade","Australian Signals Directorate, Executive Office of the President, Communications Security Establishment, Global Affairs Canada, Department of Foreign Affairs, Trade and Development"
UnitOfWork_left.csv,title,2,Legislature_left,title,0.42214569449424744,"Marbury v. Madison, Eldred v. Ashcroft, Edwards v. Aguillard, Brown v. Board of Education, Roe v. Wade","Bundestag, Council of the European Union, European Parliament, House of Lords, House of Commons of the United Kingdom"
UnitOfWork_left.csv,title,2,Election_right,title,0.4181089699268341,"Marbury v. Madison, Eldred v. Ashcroft, Edwards v. Aguillard, Brown v. Board of Education, Roe v. Wade","Scottish Parliament election, 2003, California gubernatorial recall election, 2003, Scottish Parliament election, 1999, Belgian general election, 2003, Danish general election, 2001"
UnitOfWork_left.csv,title,2,Artwork_left,title,0.4157409369945526,"Marbury v. Madison, Eldred v. Ashcroft, Edwards v. Aguillard, Brown v. Board of Education, Roe v. Wade","David (Michelangelo), Venus de Milo, Manneken Pis, Mona Lisa, The Last Supper (Leonardo da Vinci)"
UnitOfWork_left.csv,title,2,ChristianBishop_right,title,0.41512489318847656,"Marbury v. Madison, Eldred v. Ashcroft, Edwards v. Aguillard, Brown v. Board of Education, Roe v. Wade","Ealdred (archbishop of York), Saint Matthew, Bartholomew I of Constantinople, Pandulf Verraccio, William Courtenay"
UnitOfWork_left.csv,title,2,Election_left,title,0.4136793911457062,"Marbury v. Madison, Eldred v. Ashcroft, Edwards v. Aguillard, Brown v. Board of Education, Roe v. Wade","United Kingdom general election, 2001, United States presidential election, 2000, United States presidential election, 1996, United Kingdom general election, 1997, United States presidential election, 1988"
UnitOfWork_left.csv,title,2,MemberOfParliament_left,title,0.40314146876335144,"Marbury v. Madison, Eldred v. Ashcroft, Edwards v. Aguillard, Brown v. Board of Education, Roe v. Wade","Horace Walpole, Louis Riel, Oswald Mosley, Tam Dalyell, Neil Turner (British politician)"
UnitOfWork_left.csv,title,2,Wrestler_right,title,0.40265583992004395,"Marbury v. Madison, Eldred v. Ashcroft, Edwards v. Aguillard, Brown v. Board of Education, Roe v. Wade","Amy Dumas, Chavo Guerrero Sr., Chavo Guerrero Jr., Val Venis, Rhino (wrestler)"
UnitOfWork_left.csv,title,2,MemberOfParliament_right,title,0.4021867513656616,"Marbury v. Madison, Eldred v. Ashcroft, Edwards v. Aguillard, Brown v. Board of Education, Roe v. Wade","George Stevenson (MP), Edward Jerningham Wakefield, Greville Janner, Joshua Benjamin Jeyaretnam, Roger Williams (UK politician)"
UnitOfWork_left.csv,title,2,PoliticalParty_left,title,0.40108662843704224,"Marbury v. Madison, Eldred v. Ashcroft, Edwards v. Aguillard, Brown v. Board of Education, Roe v. Wade","Australian Labor Party, Australian Democrats, African National Congress, National Alliance (Italy), British National Party"
UnitOfWork_left.csv,title,2,Wrestler_left,title,0.40027284622192383,"Marbury v. Madison, Eldred v. Ashcroft, Edwards v. Aguillard, Brown v. Board of Education, Roe v. Wade","Sean Waltman, Pedro Morales, Bruiser Brody, Shirley Crabtree, Lita (wrestler)"
UnitOfWork_left.csv,title,2,Magazine_left,title,0.39896589517593384,"Marbury v. Madison, Eldred v. Ashcroft, Edwards v. Aguillard, Brown v. Board of Education, Roe v. Wade","Mad (magazine), National Lampoon (magazine), Punch (magazine), Playboy, Rolling Stone"
UnitOfWork_left.csv,title,2,Song_left,title,0.398547500371933,"Marbury v. Madison, Eldred v. Ashcroft, Edwards v. Aguillard, Brown v. Board of Education, Roe v. Wade","America the Beautiful, Go Down Moses, Take Me Out to the Ball Game, Twinkle Twinkle Little Star, Flower of Scotland"
UnitOfWork_left.csv,title,2,PoliticalParty_right,title,0.39682796597480774,"Marbury v. Madison, Eldred v. Ashcroft, Edwards v. Aguillard, Brown v. Board of Education, Roe v. Wade","Christian Social Union of Bavaria, Movimiento Libertario, Labour United, Labour Union (Poland), Whig (British political party)"
UnitOfWork_left.csv,title,2,TelevisionStation_left,title,0.3951011598110199,"Marbury v. Madison, Eldred v. Ashcroft, Edwards v. Aguillard, Brown v. Board of Education, Roe v. Wade","BBC Red Button, BBC News (TV channel), Channel 4, MTV, BBC World News"
UnitOfWork_left.csv,title,2,Monarch_right,title,0.39489611983299255,"Marbury v. Madison, Eldred v. Ashcroft, Edwards v. Aguillard, Brown v. Board of Education, Roe v. Wade","Emperor Kinmei, Emperor Tenmu, Emperor Monmu, Anastasius I Dicorus, Theodoric the Great"
UnitOfWork_left.csv,title,2,Race_left,title,0.39394521713256836,"Marbury v. Madison, Eldred v. Ashcroft, Edwards v. Aguillard, Brown v. Board of Education, Roe v. Wade","Kentucky Derby, Melbourne Cup, Tour de France, Preakness Stakes, Kentucky Oaks"
UnitOfWork_left.csv,title,2,Race_right,title,0.3937549293041229,"Marbury v. Madison, Eldred v. Ashcroft, Edwards v. Aguillard, Brown v. Board of Education, Roe v. Wade","2000 Guineas Stakes, St Leger Stakes, W.S. Cox Plate, 1000 Guineas Stakes, Duchess of Cambridge Stakes"
UnitOfWork_left.csv,title,2,GivenName_left,title,0.3937279284000397,"Marbury v. Madison, Eldred v. Ashcroft, Edwards v. Aguillard, Brown v. Board of Education, Roe v. Wade","Adrian, Alexander, Anastasius, Alexius, Alexandra"
UnitOfWork_left.csv,title,2,Award_left,title,0.3931392729282379,"Marbury v. Madison, Eldred v. Ashcroft, Edwards v. Aguillard, Brown v. Board of Education, Roe v. Wade","Academy Award, Academy Award for Best Production Design, Major League Baseball Most Valuable Player Award, Major League Baseball Rookie of the Year Award, Man Booker Prize"
UnitOfWork_left.csv,title,2,Museum_left,title,0.39308688044548035,"Marbury v. Madison, Eldred v. Ashcroft, Edwards v. Aguillard, Brown v. Board of Education, Roe v. Wade","Bletchley Park, National Baseball Hall of Fame and Museum, British Museum, The Louvre, Rijksmuseum"
UnitOfWork_left.csv,title,2,SportFacility_left,title,0.39275702834129333,"Marbury v. Madison, Eldred v. Ashcroft, Edwards v. Aguillard, Brown v. Board of Education, Roe v. Wade","Craven Cottage, Cardiff Arms Park, Melbourne Cricket Ground, Shea Stadium, Yankee Stadium (1923)"
UnitOfWork_left.csv,title,2,Country_left,title,0.3921058773994446,"Marbury v. Madison, Eldred v. Ashcroft, Edwards v. Aguillard, Brown v. Board of Education, Roe v. Wade","Algeria, Andorra, Aruba, Angola, Albania"
