id,title
0,"Immature pinnule, close up of underside, showing sori"
1,"Potted plant, showing habit"
2,"Colony, showing crowded habit"
3,"Whole plant, showing fronds, habit"
4,"Habit, showing fronds, forest floor"
5,"Immature pinnule, close up of underside, showing sori"
6,"Under surface of pinnae, showing sori with reflexed indusial flaps"
7,"Potted plant, showing habit"
8,"Underside of frond, sporangia visible along pinnule margins"
9,"Young frond, uncurling"
10,"Plant on forest margin, showing habit"
11,"Immature pinnule, close up of underside, showing sori"
12,"Mature pinnule, close up of underside, showing sori"
13,"Tip of frond, upper surface"
14,"Mature frond, lower surface of pinna, showing sori"
15,"Climbing epiphytic habit, on trunk of tree"
16,"Potted plant, showing fronds and habit"
17,"Plants on tree, showing epiphytic birdsnest habit, and habitat"
18,"Whole plant, showing bird's nest habit"
19,"Potted plant, showing habit"
20,"Tip of frond, showing proliferating bulbils"
21,"Part of sterile from in foreground, fertile in background"
22,"Habit, showing fronds"
23,"Colony, showing habit, habitat on moist rocks"
24,"Undersurface of fronds, showing sori along veins, scaly rachis"
25,"Whole plant, showing habit"
26,"Rachis and underside of pinnae, showing sori along veins"
27,"Tips of developing fronds, showing sori along veins"
28,"Underside of frond, close up showing sori along veins"
29,"Habit, in rock crevice"
30,"Whole plants, floating on water surface"
31,"Whole plants, floating on water surface"
32,"Potted plant, showing habit"
33,"Underside of fertile frion tip, showing spores"
34,"Habit, whole plant showing new red-tipped growth"
35,"Under surface of fertile frond, showing sori, sterile frond in background"
36,"Tip of young uncurling frond, scattered dark scales"
37,"Whole plant, showing habit"
38,"Habit, habitat in open area"
39,"Colony, showing habit"
40,Young fronds
41,"Colony, showing habit"
42,"Whole plant, showing habitat, habitat"
43,"Habit, on moist shady bank"
44,"Sterile fronds, and fertile fronds showing sporangia"
45,"Colony, showing whole plants, habit"
46,"Colony beside stream, showing whole plants, habit, habitat"
47,Uncurling tip of young frond
48,"Habit, showing mature fronds"
49,"Whole plants, showing habit, habitat at base of rock"
50,"Whole plant, showing habit"
51,"Underside of mature pinnae, showing sori"
52,"Habit, showing fronds"
53,"Rachis and underside of pinnae, showing sori"
54,"Whole plant, showing habit, habitat"
55,"Crown, showing uncurling crozier"
56,"Habit, habitat"
57,Habit
58,"Crozier, showing dense covering of flat scales"
59,"Whole plant, showing habit"
60,"Colony showing whole plants, habit, habitat"
61,"Colony showing whole plants, habit, habitat"
62,"Potted plant, showing habit"
63,"Whole plant, showing habit and habitat"
64,"Whole plant, showing habit and rainforest habitat"
65,"New growth, uncurling frond tip"
66,"Colony, showing whole plants, habit, habitat"
67,"Rachis and underside of mature pinnae, showing sori"
68,"Habit, pinkish new fronds at Centre, fertile fronds top and bottom"
69,"Underside of pinnae, showing sori and protruding sporangia"
70,"Colony, showing habit, fronds"
71,"Underside of tips of pinnae, showing sori"
72,"Small colony, showing whole plants, habit, habitat"
73,"Large colony, showing crowns, habitat"
74,"Close up of underside of pinnules, showing sori"
75,"Crown, showing uncurling croziers"
76,Prothallus on moist soil.
77,"Prothallus on soil, close up"
78,"Underside of pinna, showing sori along veins"
79,"Under surface of frond, showing sori along veins"
80,"Whole plant, showing habit, on forest floor"
81,"Colony, showing habit and habitat, note new red growth"
82,"Under side of frond, showing sori, indusia"
83,"Developing fronds, showing reddish new growth"
84,"Habit, whole plant showing mature fronds"
85,"Habit, whole plant on forest floor, showing new red growth"
86,"Habit, showing mature fronds"
87,"Under side of frond, showing sori"
88,"Habitat in rock crevice, habit showing foliage fronds"
89,"Habit, note dimorphic bracket fronds at base"
90,"Habit, showing mature fronds"
91,Upper surface of ultimate frond branches
92,"Colony, showing scrambling habit"
93,Upper surface of ultimate frond branches
94,"Under surface of rachis and pinnae, showing sori"
95,"Small colony, showing habit, habitat among moss"
96,"Erect branches of mature plant, showing bulbils"
97,"Ultimate branches, showing leaves and compact strobili"
98,"Ultimate branches, showing yellow sporangia in leaf axils"
99,"Plant in hanging basket, showing habit"
100,"Whole plant, showing erect habit, habitat, yellow sporangia in leaf axils"
101,Whole frond showing pendulous epiphytic habit
102,"Colony, showing habit and habitat on base of tree trunk"
103,"Plants, showing fronds and tangling habit"
104,"Habit, showing a mature frond"
105,"Hand-held dissected plant, showing dark sporangia in leaf bases"
106,"Hand-held whole plant, showing leaves and roots"
107,Upper surface of tip of frond
108,"Lower surface of rachis and pinnae, showing immature sori, indusia"
109,Lower surface of rachis and pinna showing sori
110,"Colony, showing erect habit"
111,"Whole plant, sterile"
112,"Tips of plant, showing sterile and fertile branches"
113,"Whole plant, in rock crevice"
114,"Potted plant, showing habit on young plant"
115,"Upper surface of ultimate frond branches, showing sterile and fertile pinnules"
116,"Upper surface of ultimate frond branches, showing sterile pinnules"
117,"Part of plant, showing climbing habit at base of tree"
118,"Lower surface of pinnules, showing synangia along pinnule margins"
119,"Lower surface of pinnules, showing synangia and pulvinus at base of pinnule"
120,"Habitat, plants browned off beside watercourse"
121,"Habitat, colony beside watercourse"
122,"Habit, showing leaves and sporocarps when dry"
123,"Habit, showing leaves floating on water surface"
124,"Habit, showing leaves floating on water surface"
125,"Colony at water's edge, showing submerged, emergent and dry plants"
126,"Aerial photograph, brown and green patches in foreground"
127,"Habit, when dry, showing sporocarps"
128,"Pinnae, showing sori on under surface, deeply immersed and protruding on upper surface"
129,"Under surface of frond, showing scattered sori"
130,"Habit, showing fertile fronds with sori"
131,"Under surface of fertile pinna, showing sori"
132,"Tip of fertile frond, showing sori immersed and protruding on upper surface"
133,Habitat on mossy branch
134,"Habit, habitat in rock crevice"
135,"Under surface of pinnae, showing sori, indusia"
136,"Habit, whole plant, showing mature fronds"
137,"Under surface of frond, showing sori, indusia"
138,"Under surface of frond, showing sori"
139,"Under surface of frond showing sori, indusia"
140,"Whole plant, showing habit, single basal frond, sporangia, habitat"
141,"Potted plant, showing pendulous habit"
142,"Upper surface of pinnae, showing pale flat scales"
143,"Lower surface of fertile pinnae, showing sori and pale flat scales"
144,"Small colony, showing habit"
145,"Under surface of frond, showing sori and scaly rachis"
146,"Close up of two whole plants, showing basial leaves, strobili"
147,"Colony, showing epiphytic habit, bracket and foliage fronds"
148,"Colony on tree trunk, showing habit, habitat"
149,"Tips of foliage fronds, showing fertile soral patches"
150,"Plants on Camphor Laurel, showing habit, bracket and foliage fronds"
151,"Two colonies, showing habit, habitat, bracket and foliage fronds"
152,Prothallus on agar
153,"Mature plant, showing habit, habitat, bracket and foliage fronds"
154,"Habit, showing bracket fronds, foliage fronds with large soral patches"
155,"Habit, sowing bracket and foliage fronds"
156,"Bifurcating foliage fronds, showing soral patches at tips"
157,"Colony, showing erect habit and exposed habitat"
158,Uncurling tips of young frond
159,"Whole plant, showing habit, and habitat in rock crevice"
160,"Whole plant, showing habit and mature fronds"
161,"Habit, growing from rock crevices"
162,"Tips of fronds, upper surface and lower surface, showing sori"
163,"Habit, leaf letter at base of tree trunk"
164,"Branches, showing yellowish, 3-locular synangia"
165,"Whole plant, showing habit"
166,Tip of mataure frond
167,"Colony, showing habit in rock crevice"
168,"Habitat, colony completely covering branches of trees"
169,"Under surface of frond, showing sori with peltate indusia"
170,Branching frond and fertile frond with sporangial branches at tips
171,"Small colony, showing habit, habitat, sterile and fertile fronds"
172,"Colony in paperbark swamp, showing habitat and scrambling habit"
173,Ultimate branches of mature fronds
174,"Under surface of frond, showing sori"
175,"Habit, synangia visible"
176,"Sterile plants, showing pendulous habit"
177,"Colony, showing habit, habitat by water"
178,"Potted plant, showing plant form"
