id,title
0,"Abondance Northern Alps, FR Last Updated: 4/ 3"
1,"Abriès Southern Alps, FR Last Updated: 3/30"
2,"Aiguilles Southern Alps, FR Last Updated: 3/30"
3,"Aillons Margeriaz Northern Alps, FR Last Updated: 5/ 1"
4,"Albiez Montrond Northern Alps, FR Last Updated: 4/ 7"
5,"Alpe d'Huez Northern Alps, FR Last Updated: 5/ 1"
6,"Alpe du Grand Serre Northern Alps, FR Last Updated: 4/ 3"
7,"Ancelle Southern Alps, FR Last Updated: 3/31"
8,"Areches Beaufort Northern Alps, FR Last Updated: 4/ 7"
9,"Artouste - Fabrèges Pyrenees, FR Last Updated: 3/19"
10,"Arvieux Southern Alps, FR Last Updated: 3/30"
11,"Ascou Pailhères Pyrenees, FR Last Updated: 3/30"
12,"Auris en oisans Alpe d'Huez grand domaine Ski, FR Last Updated: 4/20"
13,"Auron Southern Alps, FR Last Updated: 4/20"
14,"Aussois Northern Alps, FR Last Updated: 4/18"
15,"Autrans Northern Alps, FR Last Updated: 3/30"
16,"Avoriaz Les Portes du Soleil (FR), FR Last Updated: 5/ 1"
17,"Ax les Thermes Pyrenees, FR Last Updated: 4/ 7"
18,"Ballon d'Alsace Vosges, FR Last Updated: 3/23"
19,"Beille Pyrenees, FR Last Updated: 4/20"
20,"Bellevaux - Hirmentaz Northern Alps, FR Last Updated: 3/30"
21,"Bernex Northern Alps, FR Last Updated: 4/ 7"
22,"Bessans Northern Alps, FR Last Updated: 4/20"
23,"Besse Super Besse Massif central, FR Last Updated: 4/20"
24,"Beuil les Launes Southern Alps, FR Last Updated: 4/ 3"
25,"Bolquère - Pyrénées 2000 Pyrenees, FR Last Updated: 4/ 7"
26,"Bonneval sur Arc Northern Alps, FR Last Updated: 5/ 1"
27,"Bramans Northern Alps, FR Last Updated: 4/ 7"
28,"Brameloup Massif central, FR Last Updated: 3/19"
29,"Brides les Bains Northern Alps, FR Last Updated: 4/20"
30,"Bussang - Larcenaire Vosges, FR Last Updated: 3/19"
31,"Campan Payolle Pyrenees, FR Last Updated: 3/23"
32,"Camurac Pyrenees, FR Last Updated: 3/23"
33,"Cauterets Pyrenees, FR Last Updated: 5/ 1"
34,"Ceillac Southern Alps, FR Last Updated: 3/30"
35,"Céüze Southern Alps, FR Last Updated: 3/19"
36,"Chabanon Southern Alps, FR Last Updated: 3/30"
37,"Chaillol Southern Alps, FR Last Updated: 3/30"
38,"Chalmazel Massif central, FR Last Updated: 3/23"
39,"Chamonix Mont-Blanc Northern Alps, FR Last Updated: 5/11"
40,"Champagny en Vanoise Paradiski, FR Last Updated: 5/ 1"
41,"Chamrousse Northern Alps, FR Last Updated: 4/20"
42,"Chastreix Sancy Massif central, FR Last Updated: 4/ 6"
43,"Chatel Northern Alps, FR Last Updated: 5/ 1"
44,"Col de l'Arzelier Northern Alps, FR Last Updated: 3/19"
45,"Col de Marcieu Northern Alps, FR Last Updated: 3/19"
46,"Col de Porte Northern Alps, FR Last Updated: 3/19"
47,"Col de Rousset Northern Alps, FR Last Updated: 3/23"
48,"Combloux Evasion Mont Blanc, FR Last Updated: 4/ 7"
49,"Cordon Northern Alps, FR Last Updated: 3/30"
50,"Corrençon en Vercors Northern Alps, FR Last Updated: 4/ 7"
51,"Courchevel Les 3 Vallées, FR Last Updated: 4/25"
52,"Crest Voland Cohennoz Northern Alps, FR Last Updated: 5/ 1"
53,"Crévoux Southern Alps, FR Last Updated: 4/22"
54,"Doucy Le Grand Domaine, FR Last Updated: 5/ 1"
55,"Espace Cambre D'Aze - Eyne Pyrenees, FR Last Updated: 3/23"
56,"Etang de Lers Pyrenees, FR Last Updated: 3/23"
57,"Flaine Le Grand Massif, FR Last Updated: 4/20"
58,"Flumet - St Nicolas la Chapelle Northern Alps, FR Last Updated: 4/ 7"
59,"Font d'Urle Northern Alps, FR Last Updated: 3/23"
60,"Font-Romeu - Pyrenees 2000 Pyrenees, FR Last Updated: 4/ 7"
61,"Formiguères Pyrenees, FR Last Updated: 4/10"
62,"Gavarnie Gèdre Pyrenees, FR Last Updated: 3/19"
63,"Gérardmer Vosges, FR Last Updated: 3/30"
64,"Ghisoni Corse, FR Last Updated: 3/25"
65,"Goulier Pyrenees, FR Last Updated: 3/19"
66,"Gourette Pyrenees, FR Last Updated: 4/ 7"
67,"Gréolières les Neiges Southern Alps, FR Last Updated: 4/ 3"
68,"Gresse en Vercors Northern Alps, FR Last Updated: 3/19"
69,"Guzet Pyrenees, FR Last Updated: 3/23"
70,"Hautacam Pyrenees, FR Last Updated: 3/19"
71,"Isola 2000 Southern Alps, FR Last Updated: 4/20"
72,"La Bresse Brabant Vosges, FR Last Updated: 3/30"
73,"La Bresse - Hohneck Vosges, FR Last Updated: 4/ 7"
74,"La Bresse Lispach Vosges, FR Last Updated: 3/30"
75,"La Chapelle d'Abondance Northern Alps, FR Last Updated: 4/ 3"
76,"La Clusaz Les Aravis, FR Last Updated: 5/ 1"
77,"La Colmiane Southern Alps, FR Last Updated: 3/23"
78,"La Croix de Bauzon Massif central, FR Last Updated: 3/23"
79,"La Giettaz Northern Alps, FR Last Updated: 4/ 7"
80,"La Grave la Meije Southern Alps, FR Last Updated: 5/ 1"
81,"Laguiole Massif central, FR Last Updated: 3/19"
82,"La Loge des Gardes Massif central, FR Last Updated: 3/19"
83,"La Mongie / Barèges Pyrenees, FR Last Updated: 4/ 7"
84,"La Norma Northern Alps, FR Last Updated: 4/13"
85,"Lans en Vercors Northern Alps, FR Last Updated: 3/30"
86,"La Pierre St Martin Pyrenees, FR Last Updated: 5/ 1"
87,"La Plagne Paradiski, FR Last Updated: 5/ 1"
88,"La Rosière 1850 Espace San Bernardo, FR Last Updated: 4/25"
89,"La Sambuy Northern Alps, FR Last Updated: 3/30"
90,"La Tania Les 3 Vallées, FR Last Updated: 4/25"
91,"La Toussuire Les Sybelles, FR Last Updated: 4/18"
92,"L'Audibergue - La Moulière Southern Alps, FR Last Updated: 3/23"
93,"Laye en Champsaur Southern Alps, FR Last Updated: 3/28"
94,"Le Bleymard - Mont Lozère Lozere, FR Last Updated: 3/19"
95,"Le Champ du Feu Vosges, FR Last Updated: 4/ 3"
96,"Le Chioula Pyrenees, FR Last Updated: 4/20"
97,"Le Collet d'Allevard Northern Alps, FR Last Updated: 4/ 7"
98,"Le Corbier Les Sybelles, FR Last Updated: 4/18"
99,"Le Désert d'Entremont Northern Alps, FR Last Updated: 3/23"
100,"Le Gaschney Vosges, FR Last Updated: 3/19"
101,"Le Grand Bornand Les Aravis, FR Last Updated: 4/25"
102,"Le Grand Puy Southern Alps, FR Last Updated: 3/19"
103,"Le Grand Valtin Vosges, FR Last Updated: 3/19"
104,"Le Granier Northern Alps, FR Last Updated: 3/23"
105,"Le Lac Blanc Vosges, FR Last Updated: 3/30"
106,"Le Lioran Massif central, FR Last Updated: 4/ 7"
107,"Le Markstein Vosges, FR Last Updated: 3/23"
108,"Le Mont Dore Massif central, FR Last Updated: 4/ 7"
109,"Le Mourtis Pyrenees, FR Last Updated: 3/23"
110,"Le Reposoir Northern Alps, FR Last Updated: 3/25"
111,"Les 2 Alpes Northern Alps, FR Last Updated: 7/23"
112,"Les 7 Laux Northern Alps, FR Last Updated: 4/13"
113,"Les Angles Pyrenees, FR Last Updated: 4/20"
114,"Le Sappey en Chartreuse Northern Alps, FR Last Updated: 3/19"
115,"Les Arcs Paradiski, FR Last Updated: 5/ 1"
116,"Les Bottières Northern Alps, FR Last Updated: 3/25"
117,"Les Brasses Northern Alps, FR Last Updated: 3/30"
118,"Les Carroz Le Grand Massif, FR Last Updated: 4/20"
119,"Les Contamines Montjoie Evasion Mont Blanc, FR Last Updated: 4/25"
120,"Les Coulmes Northern Alps, FR Last Updated: 3/25"
121,"Le Semnoz Northern Alps, FR Last Updated: 4/ 7"
122,"Les Fourgs Jura, FR Last Updated: 3/30"
123,"Les Gets Northern Alps, FR Last Updated: 4/14"
124,"Les Habères Northern Alps, FR Last Updated: 3/25"
125,"Les Houches Northern Alps, FR Last Updated: 4/20"
126,"Les Karellis Northern Alps, FR Last Updated: 4/20"
127,"Les Menuires Les 3 Vallées, FR Last Updated: 4/25"
128,"Les Monts d'Olmes Pyrenees, FR Last Updated: 3/30"
129,"Les Orres Southern Alps, FR Last Updated: 6/ 1"
130,"Les Plans d'Hotonnes - Plateau de Retord Jura, FR Last Updated: 3/23"
131,"Les Rousses Jura, FR Last Updated: 4/14"
132,"Les Saisies Espace Diamant, FR Last Updated: 4/25"
133,"Luchon Superbagnères Pyrenees, FR Last Updated: 4/ 7"
134,"Lus la Jarjatte Northern Alps, FR Last Updated: 3/19"
135,"Luz Ardiden Pyrenees, FR Last Updated: 4/ 7"
136,"Manigod Les Aravis, FR Last Updated: 4/18"
137,"Méaudre Northern Alps, FR Last Updated: 3/30"
138,"Megeve Evasion Mont Blanc, FR Last Updated: 4/20"
139,"Meribel Les 3 Vallées, FR Last Updated: 5/ 1"
140,"Métabief Mont d'Or Jura, FR Last Updated: 3/30"
141,"Mijanès - Donezan Pyrenees, FR Last Updated: 3/19"
142,"Molines en Queyras Southern Alps, FR Last Updated: 4/ 7"
143,"Montchavin - Les Coches Paradiski, FR Last Updated: 5/ 1"
144,"Montgenèvre Southern Alps, FR Last Updated: 5/ 1"
145,"Montmin - Col de la Forclaz Northern Alps, FR Last Updated: 3/19"
146,"Montriond Northern Alps, FR Last Updated: 4/20"
147,"Mont Saxonnex Northern Alps, FR Last Updated: 3/19"
148,"Monts Jura Jura, FR Last Updated: 3/30"
149,"Morillon Le Grand Massif, FR Last Updated: 4/20"
150,"Morzine Les Portes du Soleil (FR), FR Last Updated: 5/ 1"
151,"Nistos Pyrenees, FR Last Updated: 4/ 8"
152,"Notre Dame de Bellecombe Espace Diamant, FR Last Updated: 4/ 7"
153,"Orcières Merlette Southern Alps, FR Last Updated: 4/20"
154,"Orelle Northern Alps, FR Last Updated: 5/11"
155,"Oz en oisans Alpe d'Huez grand domaine Ski, FR Last Updated: 5/ 1"
156,"Passy Northern Alps, FR Last Updated: 3/25"
157,"Peisey Vallandry Paradiski, FR Last Updated: 5/ 1"
158,"Pelvoux-Vallouise Southern Alps, FR Last Updated: 3/30"
159,"Peyragudes Pyrenees, FR Last Updated: 4/ 7"
160,"Piau Engaly Pyrenees, FR Last Updated: 4/20"
161,"Porte Puymorens Pyrenees, FR Last Updated: 4/ 7"
162,"Prabouré Massif central, FR Last Updated: 3/19"
163,"Pralognan la Vanoise Northern Alps, FR Last Updated: 4/13"
164,"Praloup Southern Alps, FR Last Updated: 4/ 7"
165,"Praz de Lys Sommand Northern Alps, FR Last Updated: 4/13"
166,"Praz sur Arly Espace Diamant, FR Last Updated: 4/ 7"
167,"Puigmal Pyrenees, FR Last Updated: 3/19"
168,"Puy Saint Vincent Southern Alps, FR Last Updated: 4/20"
169,"Puyvalador Pyrenees, FR Last Updated: 3/23"
170,"Réallon Southern Alps, FR Last Updated: 3/25"
171,"Risoul Southern Alps, FR Last Updated: 4/20"
172,"Ristolas Southern Alps, FR Last Updated: 3/19"
173,"Romme Northern Alps, FR Last Updated: 3/19"
174,"Roubion - Les Buisses Southern Alps, FR Last Updated: 3/23"
175,"Sainte-Anne la Condamine Southern Alps, FR Last Updated: 3/30"
176,"Sainte Foy Tarentaise Northern Alps, FR Last Updated: 4/13"
177,"Saint François Longchamp Northern Alps, FR Last Updated: 4/20"
178,"Saint Gervais Mont-Blanc Evasion Mont Blanc, FR Last Updated: 4/13"
179,"Saint Hilaire du Touvet Northern Alps, FR Last Updated: 3/19"
180,"Saint Jean d'Arves Les Sybelles, FR Last Updated: 4/18"
181,"Saint Jean de Sixt Northern Alps, FR Last Updated: 3/19"
182,"Saint Jean Montclar Southern Alps, FR Last Updated: 3/30"
183,"Saint Lary Soulan Pyrenees, FR Last Updated: 4/ 7"
184,"Saint Léger les Mélèzes Southern Alps, FR Last Updated: 3/30"
185,"Saint Martin de Belleville Les 3 Vallées, FR Last Updated: 4/25"
186,"Saint Maurice sur Moselle Vosges, FR Last Updated: 3/25"
187,"Saint Pierre de Chartreuse Northern Alps, FR Last Updated: 3/23"
188,"Saint Sorlin d'Arves Les Sybelles, FR Last Updated: 4/18"
189,"Samoëns Le Grand Massif, FR Last Updated: 4/20"
190,"Sauze Super Sauze Southern Alps, FR Last Updated: 4/ 7"
191,"Savoie Grand Revard Northern Alps, FR Last Updated: 4/13"
192,"Serre Chevalier Southern Alps, FR Last Updated: 4/20"
193,"Serre Eyraud Southern Alps, FR Last Updated: 3/30"
194,"Sixt Fer à Cheval Northern Alps, FR Last Updated: 3/19"
195,"St Colomban des Villards Northern Alps, FR Last Updated: 3/30"
196,"St Jean d'Aulps Northern Alps, FR Last Updated: 4/ 7"
197,"St Véran Southern Alps, FR Last Updated: 4/ 7"
198,"Superdevoluy / La Joue du Loup Southern Alps, FR Last Updated: 4/18"
199,"Thollon les Memises Northern Alps, FR Last Updated: 4/ 7"
200,"Tignes Espace Killy, FR Last Updated: 7/29"
201,"Turini Camp d'Argent Southern Alps, FR Last Updated: 4/ 1"
202,"Valberg Southern Alps, FR Last Updated: 4/ 3"
203,"Val Cenis Vanoise Northern Alps, FR Last Updated: 4/20"
204,"Val d'Allos - La Foux Southern Alps, FR Last Updated: 4/ 7"
205,"Val d'Allos - Le Seignus Southern Alps, FR Last Updated: 4/ 7"
206,"Val d'Azun Pyrenees, FR Last Updated: 3/30"
207,"Val d'Isère Northern Alps, FR Last Updated: 5/ 4"
208,"Valdrôme Northern Alps, FR Last Updated: 3/19"
209,"Valfréjus Northern Alps, FR Last Updated: 4/13"
210,"Valloire Galibier - Thabor, FR Last Updated: 4/18"
211,"Val Louron Pyrenees, FR Last Updated: 4/ 3"
212,"Valmeinier Galibier - Thabor, FR Last Updated: 4/18"
213,"Valmorel Le Grand Domaine, FR Last Updated: 4/20"
214,"Val Pelens Southern Alps, FR Last Updated: 3/22"
215,"Val Thorens Les 3 Vallées, FR Last Updated: 5/11"
216,"Vars Southern Alps, FR Last Updated: 4/20"
217,"Vaujany Alpe d'Huez grand domaine Ski, FR Last Updated: 5/ 1"
218,"Ventoux - Mont Serein Southern Alps, FR Last Updated: 4/ 4"
219,"Ventron Vosges, FR Last Updated: 3/23"
220,"Villard de Lans Northern Alps, FR Last Updated: 4/ 7"
221,"Villard Reculas Northern Alps, FR Last Updated: 4/20"
222,"Xonrupt - Le Poli Vosges, FR Last Updated: 3/19"
