id,title
0,pedometer
1,What Emoticon Are You Today?
2,Hello
3,April 2014 Miles Challenge
4,curse broken!
5,March 2014 Miles Challenge
6,What are your 'bad choice' triggers?
7,What are you (re)watching?
8,Hello All
9,Crsuher & Troi exercise together
10,ROAD RUNNERS 2014
11,5k Runner going for 10!
12,How Many Miles did you Run/Walk today?
13,Race Reports
14,Increasing my long runs: time or distance?
15,Are you trying to conserve water?
16,Carb loading and Gels= fewer postrun migraines
17,Did you overeat yesterday?
18,What do you have planned for this month?
19,New to the team
20,GUESS WHAT I SAW ON MY WALK/RUN TODAY
21,"Did you ""Huddle"" with your favorite teams today?"
22,Trivia Questions...How Did You Do?
23,Trail Runner
24,Did you eat breakfast? If so what?
25,Runkeeper Cheering Squad
26,What's Your Last Fruit or Veggie That You Ate...
27,Star Trek TV franchise on Streaming Netflix
28,did you exercise today??...if yes..WHAT did you do
29,Back on Spark People --still running
30,New? Introduce yourself here!
31,Did you track your food today?
32,What is your exercise plan for today?
33,What are you reading?
34,"Welcome Forum ~ For New Team Members,,,,,,"
35,How many login points today?
36,Maintenance is NOT the same thing as losing foreve
37,Big Sur Half Marathon November 20
38,I Reached a New Level Today
39,Calorie ranges...
40,Howdy all!
41,Calories- Help!
42,Feeling Positive or Negative?
43,Hi
44,What did you do or buy local this week?
45,Looking for your favorite maintenance tips
46,Let's celebrate our maintenance anniversaries!
47,Use an EMOTICON to say how you are feeling today!
48,Did you walk today?
49,Hi
50,Are You At Goal and Maintaining in July 2011?
51,I celebrate today seven years of maintenance
52,Maintaining or Backsliding? How can we help you?
53,I just joined this team.
54,Did anyone go to GA?
55,Hi there!
56,How I paid the price today
57,Favorite items from your farmers market right now?
58,SparkTrivia Points!
59,I'm happy today because......
60,Advice on how to get back on track!!!!
61,How far did you run today?
62,Austin Girl
63,JUNE POUNDS or INCHES Challenge!
64,STOP... Thread INACTIVATED... STOP
65,How long have you been.......?
66,What is up for summer?
67,Is UUism declining?
68,Just hit goal
69,Use an emoticon to describe your weather today.
70,Running From Oz
71,Hope you didn't miss this article
72,Share your favorite: Quick snack or mini-meal
73,June 8th birthdays
74,My train just pulled in to Maintenance Station
