id,title
0,"Moods Hair Salon We only have Senior Stylists on our team, with extensive experience and regular advanced training at Vidal Sassoon academy or an internationally recognized equal Vancouver Beauty Salons"
1,Aqua Fraser Salon Vancouver Beauty Salons
2,Aqua Fraser Center Vancouver Beauty Salons
3,Artel Salon Vancouver Beauty Salons
4,Mei Hair Studio Vancouver Beauty Salons
5,Misako Hair Studio Vancouver Beauty Salons
6,Misako Hair Studio Vancouver Beauty Salons
7,Echo Hair Studio Vancouver Beauty Salons
8,Heartbreaker Salon Ltd Vancouver Beauty Salons
9,Nae Do Illusion Makeup & Hair Artistry Vancouver Beauty Salons
10,Esthetico Salon & Spa Vancouver Beauty Salons
11,Melonhead Childrens Haircare Vancouver Beauty Salons
12,Long Tou Beauty Salon Vancouver Beauty Salons
13,Lid Hair Studio Vancouver Beauty Salons
14,Clear Hair Studio Vancouver Beauty Salons
15,Le Sante Spa Ltd Vancouver Beauty Salons
16,Altum Spa and Wellness Vancouver Beauty Salons
17,Altum Spa & Wellness We are a downtown Vancouver day spa providing professional body and beauty treatments. We are eco-friendly and use all natural and organic beauty products. Vancouver Beauty Salons
18,Salon Haze Vancouver Beauty Salons
19,Curve Vancouver Beauty Salons
20,Neverland Tea Salon Vancouver Beauty Salons
21,Style Lab Salon Vancouver Beauty Salons
22,Senhora Hair Design Vancouver Beauty Salons
23,Cosmetology Industry Assn Of BC Vancouver Beauty Salons
24,Rumours Hair Design Ltd Vancouver Beauty Salons
25,Moca Beauty Salon Vancouver Beauty Salons
26,Headspace Hair Salon Vancouver Beauty Salons
27,Salon Boulanger Vancouver Beauty Salons
28,Tam Hair Salon Vancouver Beauty Salons
29,House of Jade Coiffures Ltd Vancouver Beauty Salons
30,The Hairdresser Studio Vancouver Beauty Salons
31,Julianos Hair Salon Ltd Vancouver Beauty Salons
32,Sebastian 1 Salon Vancouver Beauty Salons
33,Glamour Hair Design Vancouver Beauty Salons
34,A Salon Hairdresser Vancouver Beauty Salons
35,Zooon 4th Hair Salon Vancouver Beauty Salons
36,Salon Gliss Vancouver Beauty Salons
37,Red Room Hair World Ltd Vancouver Beauty Salons
38,Meenu's Hair & Skin Care Vancouver Beauty Salons
39,Hair Fantasy Studio Vancouver Beauty Salons
40,Evropa Esthetics & Spa Inc Vancouver Beauty Salons
41,Studio 16 Hair Design 2005 Vancouver Beauty Salons
42,Sassy Hair Fashion Vancouver Beauty Salons
43,Volume Studio Ltd Vancouver Beauty Salons
44,Illusion Studio & Spa Vancouver Beauty Salons
45,Air Hair Salon Vancouver Beauty Salons
46,Fantasy Cuts Vancouver Beauty Salons
47,Magicuts - Vancouver Vancouver Beauty Salons
48,Zeal Hair Salon Vancouver Beauty Salons
49,Zeal Hair Vancouver Beauty Salons
50,Maximus Hair Salon Vancouver Beauty Salons
