id,title
0,Kania Lawyers We exist to provide Superior & Affordable family law services. Mississauga Lawyers
1,Yeoman Kathleen M Legal Professional Corporation Mississauga Lawyers
2,Yeoman Kathleen M Legal Professional Corp Mississauga Lawyers
3,Andal Ramon Mississauga Lawyers
4,Babits Wappel & Toome Mississauga Lawyers
5,Wildman L Kurt Mississauga Lawyers
6,Nickle Marie B Mississauga Lawyers
7,Garvey & Garvey LLP Mississauga Lawyers
8,Purdon David Mississauga Lawyers
9,E-Home Canada Mississauga Lawyers
10,Richard Patterson Professional Corporation Richard Patterson Professional Corporation in Mississauga is a boutique law firm operating in the Clarkson Village neighbourhood. Mississauga Lawyers
11,Hoyt Legal Services Mississauga Lawyers
12,Wells & Associates Mississauga Lawyers
13,Law Office of Imran Akram Mississauga Lawyers
14,Cameron Pallett Partnership Mississauga Lawyers
15,Nrs Legal Services Mississauga Lawyers
16,Daley Mississauga Lawyers
17,Mustafa Law Mississauga Lawyers
18,Barrett Richard Mississauga Lawyers
19,Ball David A Mississauga Lawyers
20,Shulman A & Associates Mississauga Lawyers
21,Richardson Terry Mississauga Lawyers
22,Greer & Bush Barristers & Solicitors Oakville Lawyers
23,Laidlaw Heather L L B Oakville Lawyers
24,Mesinschi Law Offices Oakville Lawyers
25,Hartley Law Firm Mississauga Lawyers
26,William Jones Law Oakville Lawyers
27,Feltmate Delibato Heagle Oakville Lawyers
28,Byrne L Karen Oakville Lawyers
29,Joanna J Ringrose Oakville Lawyers
30,Bello Law Mississauga Lawyers
31,Wilson David S Mississauga Lawyers
32,Wheeler & Associates Mississauga Lawyers
33,Somersall Jean R Mississauga Lawyers
34,Klein Law Office Mississauga Lawyers
35,Kovac & Tobin Oakville Lawyers
36,Parhar Law Office Oakville Lawyers
37,Law Office of Vanessa Routley Oakville Lawyers
38,Follett Law Oakville Lawyers
39,NC Law Oakville Lawyers
40,Business Lawgix LLP (Telephone & Fax) Oakville Lawyers
41,McLean Hugh G Mississauga Lawyers
42,Forth Bruce J Mississauga Lawyers
43,Kerr Waid Professional Corporation Servicing the Mississauga and the Greater Toronto Area Mississauga Lawyers
44,Waid Elizabeth A Mississauga Lawyers
45,H Grant Kerr Mississauga Lawyers
46,Loucks Douglas G Mississauga Lawyers
47,William G Jeffery Mississauga Lawyers
48,Law Offices Of Sheldon Benjamin Mississauga Lawyers
49,Hammond David W R Mississauga Lawyers
50,Varcoe Bernard Mississauga Lawyers
