id,title
0,Sacramento Valley Dog Fanciers Assoc. Inc.
1,"Marion Kennel Club, Inc."
2,"Mississippi Coast Kennel Club, Inc."
3,"Mt. Baker Kennel Club, Inc."
4,"Fayetteville Kennel Club, Inc."
5,Newnan Kennel Club
6,Stephenville Kennel Club Of Texas
7,D'arbonne Kennel Club
8,Ramapo Kennel Club
9,"Illinois Valley Kennel Club Of Peoria, Inc."
10,Greater Fort Myers Dog Club
11,Greater Shelby Kennel Club
12,"Ladies' Dog Club, Inc."
13,Columbiana County Kennel Club
14,"New Brunswick Kennel Club, Inc."
15,"Steel City Kennel Club, Inc."
16,"Tri-state Kennel Club, Inc."
17,Council Bluffs Kennel Club
18,Vancouver Kennel Club
19,"Agathon Kennel Club, Inc."
20,"Nita Nee Kennel Club, Inc."
21,Hendersonville Kennel Club
22,"Cedar Rapids Kennel Association, Inc."
23,"Manitowoc County Kennel Club, Inc."
24,"Suffolk County Kennel Club, Inc."
25,"Mid-del-tinker Kennel Club, Inc."
26,"Fort Bend Kennel Club, Inc."
27,"Jupiter-tequesta Dog Club, Inc."
28,Tacoma Kennel Club
29,Clearwater Kennel Club
30,Plum Creek Kennel Club Of Colorado
31,Tullahoma Kennel Club Of Tennessee
32,Scottsbluff Kennel Club
33,"Wichita Kennel Club, Inc."
34,Chesapeake Virginia Dog Fanciers Association
35,"Mid-kentucky Kennel Club, Inc."
36,"Kennel Club Of Texarkana, Inc."
37,"Burlington County Kennel Club, Inc."
38,"Crab Orchard Kennel Club, Inc."
39,"Mississippi State Kennel Club, Inc."
40,"Blackhawk Kennel Club, Inc."
41,"Riverhead Kennel Club, Inc."
42,"Wachusett Kennel Club, Inc."
43,"Vicksburg Kennel Club Of Mississippi, Inc."
44,"Greater Murfreesboro Kennel Club, Inc."
45,"Tri-state Kennel Club, Inc."
46,"Inland Empire Kennel Association, Inc."
47,"Medina Kennel Club, Inc."
48,"Greater Orange Park Dog Club, Inc."
49,"International Kennel Club Of Chicago, Inc."
50,"Sun Maid Kennel Club Of Fresno, Inc."
51,"Alamance Kennel Club, Inc."
52,Timberland Valley Dog Fanciers Association
53,Coyote Hills Kennel Club
54,Greater Muskegon Kennel Club
55,"Cedar Rapids Kennel Association, Inc."
56,Redwood Empire Kennel Club
57,"Land O' Lakes Kennel Club, Inc."
58,Conyers Kennel Club Of Georgia
59,Silver Bay Kennel Club Of San Diego
60,Garden City Kansas Kennel Club
61,"Atlanta Kennel Club, Inc."
62,D'arbonne Kennel Club
63,St. Clairsville Ohio Kennel Club
64,"Louisiana Kennel Club, Inc."
65,"Asheville Kennel Club, Inc."
66,Duluth Kennel Club
67,"Cheshire Kennel Club, Inc."
68,"Kenosha Kennel Club, Inc."
69,"Greater Clarksburg Wv Kennel Club, Inc."
70,Hot Springs National Park Kennel Club
71,"Lizard Butte Kennel Club, Inc."
72,"Illinois Capitol Kennel Club, Inc."
73,San Gabriel Valley Kennel Club
74,Eastern Dog Club
75,"Northeastern Indiana Kennel Club, Inc."
76,"Yakima Valley Kennel Club, Inc."
77,Five Valley Kennel Club
78,"Dayton Kennel Club, Inc."
79,"Evansville Kennel Club, Inc."
80,Huntsville Kennel Club
81,"Golden Valley Kennel Club, Inc."
82,"Clovis Portales Kennel Club, Inc."
83,Columbiana County Kennel Club
84,"Oshkosh Kennel Club, Inc."
85,Skyline Dog Fanciers Of San Mateo County
86,Clinton Iowa Kennel Club
87,"Greater Emporia Kennel Club, Inc."
88,Spokane Kennel Club
89,South Hills Kennel Club
90,"Battle Creek Kennel Club, Inc."
91,"Coulee Kennel Club, Inc."
92,Evergreen Colorado Kennel Club
93,"Lawrence Jayhawk Kennel Club, Inc."
94,Sacramento Valley Dog Fanciers Assoc. Inc.
95,Council Bluffs Kennel Club
96,Delaware Water Gap Kennel Club
97,Sahuaro State Kennel Club
98,"Blackhawk Kennel Club, Inc."
99,Hawaiian Kennel Club
100,Tullahoma Kennel Club Of Tennessee
101,"Del Sur Kennel Club, Inc."
102,Indianhead Kennel Club
103,Gavilan Kennel Club
104,Crawford County Kennel Club
105,"Fargo-moorhead Kennel Club, Inc."
106,Yellowstone Valley Kennel Club
107,"Riverhead Kennel Club, Inc."
108,Hendersonville Kennel Club
109,"Mahoning-shenango Kennel Club, Inc."
110,Del Valle Dog Club Of Livermore
111,"Land O' Lakes Kennel Club, Inc."
112,Alaska Kennel Club
113,"Central Indiana Kennel Club, Inc."
114,"Central Indiana Kennel Club, Inc."
115,"Fort Lauderdale Dog Club, Inc."
116,"New Brunswick Kennel Club, Inc."
117,Seward County Kennel Club
118,Macon Kennel Club
119,Ladies' Kennel Association Of America
120,Kennel Club Of The California Sierra
121,Gateway Sporting Dog Association
122,Duluth Kennel Club
123,"Nita Nee Kennel Club, Inc."
124,"Roanoke Kennel Club, Inc."
125,Vicksburg Kennel Club Of Mississippi
126,Durham Kennel Club Inc
127,Spirit Of The Heartland Kennel Club
128,"Cornhusker Kennel Club Of Lincoln, Nebraska, Inc."
129,"Northeastern Indiana Kennel Club, Inc."
130,"Town And Country Kennel Club, Inc."
131,"Puyallup Valley Dog Fanciers, Inc."
132,South Arkansas Kennel Club
133,"Valdosta Kennel Club, Inc."
134,Echo Hills Kennel Club Of Ohio
135,"Santa Maria Kennel Club, Inc."
136,"Kishwaukee Kennel Club, Inc."
137,"Mensona Kennel Club, Inc."
138,"Old Dominion Kennel Club Of Northern Virginia, Inc."
139,"Illinois Capitol Kennel Club, Inc."
140,Bartlesville Kennel Club
141,Council Bluffs Kennel Club
142,Long Beach Kennel Club
143,Greater Clark County Kennel Club Inc
144,"Salina Kennel Club, Inc."
145,Heart Of Iowa Kennel Club
146,Oconee River Kennel Club
147,"Kennel Club Of Texarkana, Inc."
148,"Hurricane Ridge Kennel Club Of Washington, Inc."
149,"Louisiana Kennel Club, Inc."
150,"Memphis Kennel Club, Inc."
151,Cheyenne Kennel Club
152,Spirit Of The Heartland Kennel Club
153,Mason City Kennel Club
154,"Ozarks Kennel Club, Inc."
155,Livonia Kennel Club
156,"Santa Clara Valley Kennel Club, Inc."
157,Greater Panama City Dog Fanciers Association
