id,title
0,Love Your Body Challenge
1,Did you overeat yesterday?
2,What made you smile today?
3,Feeling Positive or Negative?
4,What do you drink most frequently during the day?
5,Did you walk today?
6,name one non weight related goal for today
7,Have you lost your belly fat? Tell me how.
8,Hello! Excited to be a Co-Leader
9,Music to motivate
10,Pre-workout energy booster?
11,Protein powder?
12,What book are you reading?
13,40 and Fluffy but going for Fabulous!!!!
14,CLICK if you love Spark!
15,Tips for eating more fruit and veggies
16,I want to start running
17,Spin points? What did you get today?
18,Healthy Habits
19,How many points on the Wheel today?
20,Already signed up for an 8k and just beginning!
21,Did you take your Fish Oil (Omega 3) today?
22,Did you take your Vitamin(s) today?
23,What I Love About My Body
24,What Exercise Did You Do Today?
25,What went well today?
26,Drink your 8 Glasses of Water & earn a STAR!!!
27,Workout in the AM or PM?
28,What have you done today to make you feel proud?
29,Bring it on 2012!
30,slim fast diet
31,Welcome to the Weekend Challenge!!!
32,What happened to challenges?
33,Week 1 Support & Miles log
34,"1,000 Mile Challenge"
35,Did you track your food today?
36,What is your actual calorie range for losing?
37,Lose 10 Pounds in October!!!
38,DID YOU WALK TODAY??????
39,How far did you run today?
40,Exercise Inside or Outside Today?
41,August Fitness Minutes Challenge
42,How many days 'til your children return to school?
43,Going Back to School
44,Teachers' Question of the Week
45,Did you take your vitamins today?
46,Show how you're feeling with Icons each day....
47,Post Something That You Did Right Today....
48,Use emoticon to show how you feel today
49,did you drink water today?
50,How many log-in points did you get today?
51,Arizona Main Forum #2
52,Weighted hand gloves
53,wheel points today
54,Did you eat breakfast? If so what?
55,How many minutes exercise have you done today?
56,40 Something's Group Forum
57,When is your last day of school this year?
58,Weigh-in
59,WHAT WAS YOUR FIRST DRINK TODAY?
60,How or DID you Sleep last night?
61,WHEN IS YOUR BIRTHDAY!?!
62,Where do you like to walk?
63,Shake
64,Let's Talk About Carbs!
65,QOTD Thurs August 5
66,QOTD Wed August 4
67,QOTD Tuesday August 3
68,Food Journal
69,QOTD Friday July 30
70,Go Heavy or Go Home
71,QOTD Thurs July 29
72,QOTD Wed July 28
73,Burn 3500 Calories in a Week
74,QOTD Tuesday July 27
