id,title
0,sharon stone leg crossover video youtube Saturday Jun 1
1,was sharon stone ever on law and order Saturday Jun 1
2,sharon stone uncrossing her legs in basic instinct (1992) Saturday Jun 1
3,sharon stone casino images Saturday Jun 1
4,sharon stone movie death row Saturday Jun 1
5,sharon stone movie with baldwin Saturday Jun 1
6,sharon stone casino wedding Saturday Jun 1
7,sharon stone law and order svu cast Saturday Jun 1
8,sharon stone movie with kid Saturday Jun 1
9,did sharon stone play in law and order Saturday Jun 1
10,the last dance sharon stone\u0027s movie Sunday Jun 2
11,sharon stone law and order svu cast Sunday Jun 2
12,video sharon stone cannes Monday Jun 3
13,sharon stone casino death scene Monday Jun 3
14,sharon stone cannot have children Tuesday Jun 4
15,law and order special victims sharon stone Tuesday Jun 4
16,sharon stone children ages Wednesday Jun 5
17,sharon stone movie collection Wednesday Jun 5
18,sharon stone age basic instinct Wednesday Jun 5
19,sharon stone movies part 1 Thursday Jun 6
20,sharon stone casino pictures Thursday Jun 6
21,sharon stone movies list all Thursday Jun 6
22,sharon stone law and order svu imdb Friday Jun 7
23,casino with sharon stone Friday Jun 7
24,sharon stone movies titles Friday Jun 7
25,sharon stone a cannes 2012 Saturday Jun 8
26,law and order criminal intent sharon stone Saturday Jun 8
27,sharon stone movies wikipedia Saturday Jun 8
28,sharon stone kids adopted Sunday Jun 9
29,sharon stone in casino wardrobe Sunday Jun 9
30,sharon stone is crazy Sunday Jun 9
31,sharon stone in cannes Sunday Jun 9
32,casino avec sharon stone Monday Jun 10
33,does sharon stone die in last dance Monday Jun 10
34,sharon stone child custody battle Tuesday Jun 11
35,pelicula casino sharon stone Tuesday Jun 11
36,sharon stone law and order ace Wednesday Jun 12
37,sharon stone movie quotes Wednesday Jun 12
38,did sharon stone lose custody Thursday Jun 13
39,sharon stone cancer coffee Thursday Jun 13
40,feet of sharon stone Friday Jun 14
41,pelicula con sharon stone y richard gere Friday Jun 14
42,why did sharon stone loses custody Friday Jun 14
43,law and order svu sharon stone and cast Friday Jun 14
44,law and order unit� vittime speciali sharon stone Friday Jun 14
45,the casino sharon stone Saturday Jun 15
46,sharon stone hair in catwoman Saturday Jun 15
47,sharon stone movie quotes Saturday Jun 15
48,sharon stone death casino Saturday Jun 15
49,sharon stone festival de cannes 2009 Sunday Jun 16
50,sharon stone movie list imdb Sunday Jun 16
51,law and order criminal intent sharon stone Monday Jun 17
52,casino sharon stone robert de niro Tuesday Jun 18
53,was sharon stone on law and order Wednesday Jun 19
54,sharon stone going commando Thursday Jun 20
55,law and order new york sharon stone Thursday Jun 20
56,why did sharon stone loses custody of son Friday Jun 21
57,sharon stone uncrossing her legs in basic instinct (1992) Friday Jun 21
58,sharon stone movie filmed pittsburgh Friday Jun 21
59,did sharon stone adopt her children Friday Jun 21
60,sharon stone allegheny college Saturday Jun 22
61,casino avec sharon stone Saturday Jun 22
62,sharon stone movie megavideo Saturday Jun 22
63,sharon stone the last dance Saturday Jun 22
64,sharon stone going commando Sunday Jun 23
65,sharon stone movie diabolique Sunday Jun 23
66,has sharon stone been on law and order Sunday Jun 23
67,did sharon stone appear in law and order Monday Jun 24
68,sharon stone loses custody of son Tuesday Jun 25
69,sharon stone new movie attachment Wednesday Jun 26
70,sharon stone eye makeup Thursday Jun 27
71,law and order svu episode guide sharon stone Friday Jun 28
72,sharon stone law and order shattered Friday Jun 28
73,sharon stone in casino costume Saturday Jun 29
74,sharon stone casino trailer Saturday Jun 29
75,sharon stone movie the quick and the dead Saturday Jun 29
76,sharon stone and joe pesci casino Sunday Jun 30
77,Dates TBD
78,Dates TBD
79,Dates TBD
80,Dates TBD
81,Dates TBD
82,Dates TBD
83,Dates TBD
84,Dates TBD
