id,title
0,STATE FARM MUTUAL AUTOMOBILE INSURANCE COMPANY
1,AMERICAN FAMILY MUTUAL INSURANCE COMPANY
2,AUTOMOBILE CLUB INTER-INSURANCE EXCHANGE
3,FARMERS INSURANCE COMPANY INC
4,SAFECO INSURANCE COMPANY OF ILLINOIS
5,SHELTER MUTUAL INSURANCE COMPANY
6,GEICO CASUALTY COMPANY
7,PROGRESSIVE CASUALTY INSURANCE COMPANY
8,FARM BUREAU TOWN & COUNTRY INS CO OF MO
9,UNITED SERVICES AUTOMOBILE ASSOCIATION
10,ALLSTATE FIRE AND CASUALTY INSURANCE COMPANY
11,STATE FARM FIRE AND CASUALTY COMPANY
12,PROGRESSIVE ADVANCED INSURANCE COMPANY
13,GEICO GENERAL INS CO
14,ALLIED PROPERTY & CASUALTY INSURANCE COMPANY
15,TRAVELERS HOME AND MARINE INSURANCE COMPANY THE
16,USAA CASUALTY INSURANCE COMPANY
17,AMERICAN STANDARD INSURANCE COMPANY OF WISCONSIN
18,LIBERTY MUTUAL FIRE INSURANCE COMPANY
19,ALLSTATE INSURANCE COMPANY
20,LM GENERAL INSURANCE COMPANY
21,PROGRESSIVE PREFERRED INSURANCE COMPANY
22,USAA GENERAL INDEMNITY COMPANY
23,PROGRESSIVE NORTHWESTERN INSURANCE COMPANY
24,ALLSTATE PROPERTY & CASUALTY INSURANCE COMPANY
25,TWIN CITY FIRE INSURANCE COMPANY
26,PROGRESSIVE DIRECT INSURANCE COMPANY
27,GOVERNMENT EMPLOYEES INSURANCE CO
28,GEICO INDEMNITY COMPANY
29,COUNTRY PREFERRED INSURANCE COMPANY
30,SAFE AUTO INSURANCE COMPANY
31,ESURANCE PROPERTY & CASUALTY INSURANCE COMPANY
32,PROGRESSIVE MAX INSURANCE COMPANY
33,CORNERSTONE NATIONAL INSURANCE COMPANY
34,ELECTRIC INSURANCE COMPANY
35,MERIDIAN SECURITY INSURANCE COMPANY
36,NATIONWIDE AFFINITY INSURANCE COMPANY OF AMERICA
37,AMERICAN NATIONAL PROPERTY & CASUALTY COMPANY
38,COLUMBIA MUTUAL INSURANCE COMPANY
39,TRUMBULL INSURANCE COMPANY
40,HARTFORD UNDERWRITERS INSURANCE COMPANY
41,GARRISON PROPERTY AND CASUALTY INSURANCE COMPANY
42,NATIONWIDE INSURANCE COMPANY OF AMERICA
43,21ST CENTURY CENTENNIAL INSURANCE COMPANY
44,OWNERS INSURANCE COMPANY
45,CAMERON MUTUAL INSURANCE COMPANY
46,BRISTOL WEST INSURANCE COMPANY
47,PROPERTY & CASUALTY INSURANCE COMPANY OF HARTFORD
48,CAMERON NATIONAL INSURANCE COMPANY
49,CINCINNATI INSURANCE COMPANY THE
50,IDS PROPERTY CASUALTY INSURANCE COMPANY
51,GRINNELL SELECT INSURANCE COMPANY
52,COUNTRY MUTUAL INSURANCE COMPANY
53,AMCO INSURANCE COMPANY
54,METROPOLITAN GROUP PROPERTY & CASUALTY INSURANCE COMPANY
55,ACUITY A MUTUAL INSURANCE COMPANY
56,AUTO OWNERS INSURANCE COMPANY
57,DIRECT GENERAL INSURANCE COMPANY
58,ALFA VISION INSURANCE CORPORATION
59,ALFA SPECIALTY INSURANCE CORPORATION
60,UNITED HOME INSURANCE COMPANY
61,FIREMANS FUND INSURANCE COMPANY
62,VIKING INSURANCE COMPANY OF WISCONSIN
63,FOREMOST INSURANCE COMPANY GRAND RAPIDS MICHIGAN
64,AMICA MUTUAL INSURANCE COMPANY
65,PERMANENT GENERAL ASSURANCE CORPORATION
66,CALIFORNIA CASUALTY GENERAL INSURANCE COMPANY OF OREGON
67,ESURANCE INSURANCE COMPANY
68,NATIONAL GENERAL INSURANCE COMPANY
69,ESSENTIA INSURANCE COMPANY
70,METROPOLITAN PROPERTY & CASUALTY INSURANCE COMPANY
71,HAULERS INSURANCE COMPANY INC
72,NATIONAL GENERAL INSURANCE ONLINE INC
73,FIRST ACCEPTANCE INSURANCE COMPANY INC
74,GUIDEONE MUTUAL INSURANCE COMPANY
75,GRINNELL MUTUAL REINSURANCE COMPANY
76,ALLSTATE INDEMNITY COMPANY
77,SENTRY INSURANCE A MUTUAL COMPANY
78,TRADERS INSURANCE COMPANY
79,TRAVELERS PROPERTY CASUALTY INSURANCE COMPANY
80,ENCOMPASS INDEMNITY COMPANY
81,1ST AUTO & CASUALTY INSURANCE COMPANY
82,ASSURANCEAMERICA INSURANCE COMPANY
83,ALPHA PROPERTY & CASUALTY INSURANCE CO
84,UNITRIN PREFERRED INSURANCE COMPANY
85,STATE AUTO PROPERTY & CASUALTY INSURANCE COMPANY
86,AIG PROPERTY CASUALTY COMPANY
87,AFFIRMATIVE INSURANCE COMPANY
88,DAIRYLAND INSURANCE COMPANY
89,STANDARD FIRE INSURANCE COMPANY
90,BANKERS STANDARD INSURANCE COMPANY
91,EQUITY INSURANCE COMPANY
92,YOUNG AMERICA INSURANCE COMPANY
93,21ST CENTURY NORTH AMERICA INSURANCE COMPANY
94,LM INSURANCE CORPORATION
95,FIRST LIBERTY INSURANCE CORP THE
96,CONSUMERS INSURANCE USA INC
97,EMCASCO INSURANCE COMPANY
98,ECONOMY PREMIER ASSURANCE COMPANY
99,UNITED FIRE AND CASUALTY COMPANY
100,CHUBB NATIONAL INSURANCE COMPANY
101,SECURA SUPREME INSURANCE COMPANY
102,NATIONAL SURETY CORPORATION
103,PHILADELPHIA INDEMNITY INSURANCE COMPANY
104,HARTFORD INSURANCE COMPANY OF MIDWEST THE
105,SHELTER GENERAL INSURANCE COMPANY
106,GREAT NORTHERN INSURANCE COMPANY
107,STILLWATER INSURANCE COMPANY
108,AMERICAN MODERN HOME INSURANCE CO
109,UNITRIN DIRECT PROPERTY & CASUALTY COMPANY
110,PHARMACISTS MUTUAL INSURANCE COMPANY
111,YOSEMITE INSURANCE COMPANY
112,IRONSHORE INDEMNITY INC
113,FEDERAL INSURANCE COMPANY
114,VIGILANT INSURANCE COMPANY
115,WARNER INSURANCE COMPANY
116,NEW SOUTH INSURANCE COMPANY
117,METROPOLITAN DIRECT PROPERTY AND CASUALTY INSURANCE COMPANY
118,SAGAMORE INSURANCE COMPANY
119,BENCHMARK INSURANCE COMPANY
120,MENDOTA INSURANCE COMPANY
121,HARTFORD FIRE INSURANCE COMPANY
122,WORKMENS AUTO INSURANCE COMPANY
123,ENCOMPASS INSURANCE COMPANY OF AMERICA
124,AMERICAN BANKERS INSURANCE COMPANY OF FLORIDA
125,PACIFIC INDEMNITY COMPANY
126,RLI INSURANCE COMPANY
127,INSUREMAX INSURANCE COMPANY
128,MADISON MUTUAL INSURANCE COMPANY
129,VICTORIA AUTOMOBILE INSURANCE COMPANY
130,SENTINEL INSURANCE COMPANY LTD
131,FOREMOST PROPERTY AND CASUALTY INSURANCE COMPANY
132,FARMERS MUTUAL HAIL INSURANCE COMPANY OF IOWA
133,KEMPER INDEPENDENCE INSURANCE COMPANY
134,FINANCIAL INDEMNITY COMPANY
135,COUNTRY CASUALTY INSURANCE COMPANY
136,INFINITY INSURANCE COMPANY
137,MIC GENERAL INSURANCE CORPORATION
138,AUTO CLUB FAMILY INSURANCE COMPANY
139,METROPOLITAN CASUALTY INSURANCE COMPANY
140,MID CENTURY INSURANCE COMPANY
141,MARKEL AMERICAN INSURANCE COMPANY
142,NATIONAL GENERAL ASSURANCE COMPANY
143,WEST AMERICAN INSURANCE COMPANY
144,AMERICAN NATIONAL GENERAL INSURANCE COMPANY
145,HARTFORD CASUALTY INSURANCE CO
146,AMERICAN MODERN SELECT INSURANCE COMPANY
147,TRAVELERS PERSONAL INSURANCE COMPANY
148,MILLERS CLASSIFIED INSURANCE COMPANY
149,NATIONWIDE PROPERTY & CASUALTY INSURANCE COMPANY
150,PACIFIC SPECIALTY INSURANCE COMPANY
151,CHARTER INDEMNITY COMPANY
152,MERASTAR INSURANCE COMPANY
153,AMTRUST INSURANCE COMPANY OF KANSAS INC
154,NATIONAL INTERSTATE INSURANCE COMPANY
155,PROGRESSIVE SPECIALTY INSURANCE COMPANY
156,HALLMARK INSURANCE COMPANY
157,AIG ASSURANCE COMPANY
158,GUIDEONE SPECIALTY MUTUAL INSURANCE COMPANY
159,LYNDON PROPERTY INSURANCE COMPANY
160,TRAVELERS COMMERCIAL INSURANCE COMPANY
161,INFINITY ASSURANCE INSURANCE COMPANY
162,21ST CENTURY INSURANCE COMPANY
163,AMERICAN HALLMARK INSURANCE COMPANY OF TEXAS
164,RESPONSE INSURANCE COMPANY
165,AMERICAN SERVICE INSURANCE COMPANY
166,VICTORIA FIRE & CASUALTY COMPANY
167,GULF UNDERWRITERS INSURANCE COMPANY
168,GUIDEONE ELITE INSURANCE COMPANY
169,DEPOSITORS INSURANCE COMPANY
170,METROPOLITAN GENERAL INSURANCE COMPANY
171,LIBERTY INSURANCE CORPORATION
172,GUIDEONE AMERICA INSURANCE COMPANY
173,ALLMERICA FINANCIAL BENEFIT INSURANCE COMPANY
174,FOREMOST SIGNATURE INSURANCE COMPANY
175,TRIUMPHE CASUALTY COMPANY
176,INFINITY AUTO INSURANCE COMPANY
177,TRUSTGARD INSURANCE COMPANY
178,PROGRESSIVE CLASSIC INSURANCE COMPANY
179,SUSSEX INSURANCE COMPANY
180,NORTHERN INSURANCE COMPANY OF NEW YORK
181,INTEGON NATIONAL INSURANCE COMPANY
182,MIDDLESEX INSURANCE COMPANY
183,MIDWESTERN INDEMNITY COMPANY THE
184,NATIONWIDE MUTUAL FIRE INSURANCE COMPANY
185,NATIONWIDE MUTUAL INSURANCE COMPANY
186,NEW HAMPSHIRE INSURANCE COMPANY
187,AMERICAN FIRE & CASUALTY COMPANY
188,CALIFORNIA CASUALTY INDEMNITY EXCHANGE
189,SECURITY NATIONAL INSURANCE COMPANY
190,LIBERTY MUTUAL INSURANCE COMPANY
191,INTEGON GENERAL INSURANCE CORPORATION
192,HANOVER INSURANCE COMPANY THE
193,MASSACHUSETTS BAY INSURANCE COMPANY
194,AMERICAN AUTOMOBILE INSURANCE COMPANY
195,HARTFORD ACCIDENT & INDEMNITY CO
196,EMPLOYERS MUTUAL CASUALTY COMPANY
197,SECURA INSURANCE A MUTUAL COMPANY
198,ACE AMERICAN INSURANCE COMPANY
199,INTEGON INDEMNITY CORPORATION
200,OHIO CASUALTY INSURANCE COMPANY
201,AMERICAN ECONOMY INSURANCE COMPANY
202,AUTOMOBILE INS CO OF HARTFORD CT
203,RESPONSE WORLDWIDE INSURANCE COMPANY
204,GENERAL CASUALTY INSURANCE COMPANY
205,AMEX ASSURANCE COMPANY
206,TRAVCO INSURANCE COMPANY
207,GATEWAY INSURANCE COMPANY
208,TRAVELERS PROPERTY CASUALTY COMPANY OF AMERICA
209,ZURICH AMERICAN INSURANCE COMPANY
210,TRAVELERS INDEMNITY COMPANY OF AMERICA
211,TRAVELERS INDEMNITY COMPANY
212,FIRST NATIONAL INSURANCE COMPANY OF AMERICA
213,SAFECO INSURANCE COMPANY OF AMERICA
214,NATIONAL UNION FIRE INSURANCE COMPANY OF PITTSBURG PA
215,HALLMARK NATIONAL INSURANCE COMPANY
216,SAFECO NATIONAL INSURANCE COMPANY
217,MERITPLAN INSURANCE COMPANY
218,21ST CENTURY ADVANTAGE INSURANCE COMPANY
219,PHOENIX INSURANCE COMPANY THE
220,GREAT AMERICAN ASSURANCE COMPANY
221,________
