id,title
0,Three Rvrs Kc Of Mo
1,Mt. Ogden Kc
2,Grand River Kc
3,Columbine State Poodl
4,Raleigh Kc
5,Atlanta Kc
6,Windham Co Kc
7,Central Ny Kc
8,Tampa Bay Poodl
9,Saginaw Vly Kc
10,Columbia Missouri Kennel Club
11,Oakland Kennel Club
12,"Genesee County Kennel Club, Inc."
13,"Wampanoag Kennel Club, Inc."
14,Ventura County Dog Fanciers Association
15,"Southern Maryland Kennel Club, Inc."
16,"Greater Lowell Kennel Club, Inc."
17,Ravenna Kennel Club
18,"Tonawanda Valley Kennel Club, Inc."
19,"Piedmont Kennel Club, Inc."
20,Southeast Alabama Kennel Club
21,Heartland Dog Club Of Florida
22,Coyote Hills Kennel Club
23,Longview Kennel Club
24,Salisbury North Carolina Kennel Club
25,Slidell Dog Fanciers Association
26,"Beaufort Kennel Club, Inc."
27,"Twin Brooks Kennel Club, Inc."
28,Canadian Valley Kennel Club
29,Grand Rapids Kennel Club
30,Southern Indiana Kennel Club
31,"Furniture City Kennel Club, Inc."
32,"Lehigh Valley Kennel Club, Inc."
33,"Forsyth Kennel Club, Inc."
34,Mobile Kennel Club
35,Tullahoma Kennel Club Of Tennessee
36,"Kennel Club Of Yorkville, Illinois"
37,Greater Fort Myers Dog Club
38,"Skyline Kennel Club, Inc."
39,"Central Maine Kennel Club, Inc."
40,Wright County Minnesota Kennel Club
41,"Shawnee Kennel Club, Inc."
42,"Louisiana Kennel Club, Inc."
43,"Westbury Kennel Association, Inc."
44,Griffin Georgia Kennel Club
45,Worcester County Kennel Club
46,Hobbs New Mexico Kennel Club
47,Garden City Kansas Kennel Club
48,"Vacationland Dog Club, Inc."
49,Colorado Springs Kennel Club
50,Valparaiso Kennel Club
51,"Lakes Region Kennel Club, Inc."
52,Macon Kennel Club
53,Greater Freeport Illinois Kennel Club
54,Kachina Kennel Club
55,"Greater Ocala Dog Club, Inc."
56,Suwannee Valley Kennel Club Of Florida
57,Greater Wichita Poodle Club
58,"Mensona Kennel Club, Inc."
59,Mid-michigan Poodle Club
60,"Genesee Valley Kennel Club, Inc."
61,"Cheshire Kennel Club, Inc."
62,"Sugarbush Kennel Club, Inc."
63,"Battle Creek Kennel Club, Inc."
64,"Fort Bend Kennel Club, Inc."
65,Livingston Kennel Club
66,Three Rivers Kennel Club Of Missouri
67,Saginaw Valley Kennel Club
68,Fort St. Clair Kennel Club
69,Jefferson County Kennel Club Of Missouri
70,Mattaponi Kennel Club
71,Oak Ridge Kennel Club
72,Conewango Valley Kennel Club
73,Warren County Kennel Club Of Ohio
74,Champaign Illinois Kennel Club
75,"Green Mountain Dog Club, Inc."
76,"Greater Hickory Kennel Club, Inc."
77,Livonia Kennel Club
78,Whidbey Island Kennel Club Inc
79,"Ochlockonee River Kennel Club Of Florida, Inc."
80,"Santa Cruz Kennel Club, Inc."
81,Douglasville Kennel Club Of Georgia
82,York County Kennel Club Of Maine
83,"Shenandoah Valley Kennel Club, Inc."
84,"Greeley Kennel Club, Inc."
85,Missouri Rhineland Kennel Club
86,"Gloucester County Kennel Club, Inc."
87,Edwardsville Illinois Kennel Club
88,Starved Rock Kennel Club
89,Greater Gainesville Dog Fanciers Association
90,Plum Creek Kennel Club Of Colorado
91,Greater Panama City Dog Fanciers Association
92,Durango Kennel Club
93,"Asheville Kennel Club, Inc."
94,"Battle Creek Kennel Club, Inc."
95,"Putnam Kennel Club, Inc."
96,Marshfield Area Kennel Club
97,"Vicksburg Kennel Club Of Mississippi, Inc."
98,Windward Hawaiian Dog Fanciers Association
99,"Town And Country Kennel Club, Inc."
100,"Belle-city Kennel Club, Inc."
101,"Blennerhassett Kennel Club, Inc."
102,"Scott County Kennel Club, Inc."
103,Hawkeye Kennel Club
104,Cudahy Kennel Club
105,Cheyenne Kennel Club
106,"Augusta Kennel Club, Inc."
107,Sara Bay Kennel Club
108,Silver State Kennel Club
109,Myrtle Beach Kennel Club
110,"Mt. Baker Kennel Club, Inc."
111,Alaska Kennel Club
112,"Paper Cities Kennel Club, Inc."
113,"Columbine State Poodle Club, Inc."
114,"Carroll County Kennel Club, Inc."
115,Helena Montana Kennel Club
116,Greater Humble Area Kennel Club
117,"Agathon Kennel Club, Inc."
118,"Oakland County Kennel Club, Inc."
119,"Abilene Kennel Club, Inc."
120,Greater Orange Park Dog Club
121,North Arkansas Kennel Club
122,Rio Grande Kennel Club
123,"Calcasieu Kennel Club, Inc."
124,Tupelo Kennel Club
125,Hot Springs National Park Kennel Club
126,Mason City Kennel Club
127,"Illinois Capitol Kennel Club, Inc."
128,Travis County Kennel Club
129,"Talbot Kennel Club, Inc."
130,Central Carolina Poodle Club
131,"Greater Lowell Kennel Club, Inc."
132,Plum Creek Kennel Club Of Colorado
133,"Ochlockonee River Kennel Club Of Florida, Inc."
134,"Wisconsin Kennel Club, Inc."
135,Janesville-beloit Kennel Club
136,"Mount Ogden Kennel Club, Inc."
137,Langley Kennel Club
138,"Yakima Valley Kennel Club, Inc."
139,"Olean Kennel Club, Inc. (BREED AND OBED 1)"
140,Sturgis Kennel Club
141,Mid-coast Kennel Club Of Maine
142,Rockford-freeport Illinois Kennel Club
143,"Augusta Kennel Club, Inc."
144,Greater Naples Dog Club
145,"Sioux Empire Kennel Club, Inc."
146,"Marion Kennel Club, Inc."
147,"Medina Kennel Club, Inc."
148,Clemson Kennel Club
149,"Manatee Kennel Club, Inc."
150,"Sun Maid Kennel Club Of Fresno, Inc."
151,"Okaloosa Kennel Club, Inc."
152,"Waterloo Kennel Club, Inc."
153,Seward County Kennel Club
154,Berrien Kennel Club
155,"Lackawanna Kennel Club, Inc."
156,"Northern Kentucky Kennel Club, Inc."
157,Kennel Club Of Niagara Falls (BREED/OBED 1)
158,Windward Hawaiian Dog Fanciers Association
159,Bell County Kennel Club
160,"Kennel Club Of Greater Victoria, Inc."
161,Grand Island Kennel Club
162,"Kalamazoo Kennel Club, Inc."
163,"Pocatello Kennel Club, Inc."
164,Duluth Kennel Club
165,"Burlington Kennel Club, Inc."
166,Nisqually Kennel Club
167,"Greater Emporia Kennel Club, Inc."
168,"South Shore Kennel Club, Inc."
169,Gallatin Dog Club
170,"Old Dominion Kennel Club Of Northern Virginia, Inc."
171,"Augusta Kennel Club, Inc."
172,Saline County Kennel Club Of Arkansas
173,Brandon Florida Kennel Club
174,Clemson Kennel Club
175,Kachina Kennel Club
176,Hobbs New Mexico Kennel Club
177,"Birmingham Kennel Club, Inc."
178,"Lewis-clark Kennel Club, Inc."
179,Virginia Beach Kennel Club
180,Alaska Kennel Club
181,"Jupiter-tequesta Dog Club, Inc."
182,"Waukesha Kennel Club, Inc."
183,"Sioux Empire Kennel Club, Inc."
184,"Ozarks Kennel Club, Inc."
185,"Beaufort Kennel Club, Inc."
186,Saginaw Valley Kennel Club
187,Heartland Dog Club Of Florida
188,"Sunflower Kennel Club Of Olathe, Kansas"
189,Greater Kingsport Kennel Club
190,Warren County Kennel Club Of Ohio
191,"Brookhaven Kennel Club, Inc. (Show #1)"
