id,title
0,Good Luck to our Australian friends
1,"Hey Ozzies, what's life like in Sydney?"
2,Hey to all!
3,PM Gillard advocates Australian republic in interview pre-royal wedding
4,Doctor told to get out because of son with Down syndrome [View All]
5,How big is the American expat population in Oz?
6,Another nail in the coffin of the ABC
7,Will little Johnnie to come home via Iraq?
8,Colbert Report now on Aussie TV
9,how about The Chaser stunt!!
10,Today or not?
11,Predictions for outcome of election
12,one week to go
13,Acting Prime Minister
14,Does anyone know what New Zealand is like as a place to live? [View All]
15,Woohoo!!!
16,I can't vote!
17,Rudd names his cabinet
18,"""Government preparing case against Iran"" - Your thoughts?"
19,Chaser back next year? - ABC set to shell out $6m for the thrill of the Chaser
20,Why did the Howard government choose Sydney for Cheney's visit.
21,What a master stroke to vindicate Bush and Howard
22,Howard wants to give Indonesia $200 million to help with
23,Maxine McKew is the preferred member for Bennalong
24,Has anybody dared to venture over to the wild side lately?
25,I think after the State Conference for the Labor Party
26,Do we need any more confirmation
27,Two trapped Tasmanian miners found alive
28,Australian Jews worry they could be next...
29,What is the best time of year to visit Australia?
30,I know there's a YESFAN here...come out wherever you are!
31,Gillard now 'most unpopular Australian leader in past 40 years'
32,heard a dittie...
33,I have a question about your mandatory voting law
34,"Riot police arrest 19, seize rifle"
35,(QLD Flood) Socially irresponsible use of twitter during an emergency
36,QLD Floods -- Essential Link Bundle
37,Brisbane flood to be worst in 118 years
38,ABC broadcasts QLD flood via web
39,Victoria fires
40,Hey Aussie DUers: A relative of mine to study in Newcastle Australia
41,"Well now, he's learned his first Australian drinking song!"
42,Boycott America and all things American
43,Religion link to stabbing
44,Australian taken hostage in Iraq/update/Response team to Iraq
45,Australia's Seven Network Launches $775 Million Lawsuit
46,Ditch the US alliance'
47,Hicks hopes for British help
48,Downer knew of Hicks's UK citizenship bid
49,UK urged to speed up Hicks citizenship application
50,Beazley doubts Government on flu
51,PM urges early daylight saving
52,Howard implicated in election rort
53,Beazley steps up his attack
54,Opposition opposes US 'two-tier' higher education model
55,Tax cut talk 'when there's trouble'
56,Torture ban 'hinders terror war'
57,Bush/Cheney sticker on Downer's car
58,New Aussie activism site
59,Head's Up. Al Gore
60,Starting to look at compulsory voting in a different light
61,Kev's budget reply
62,Heads up. Sounds of Aus
63,Kev feeds the homeless
64,How are you spending the Oz day weekend?
65,Up yer clacker!
66,"75,000 to watch a Pollie?"
67,30 Years Ago - Frederick Valentich Disappears
68,Invitation to Melbourne DUers
69,First the bad news....
70,Sending our convicts back
71,Love that Keating
72,Young Lib's Obama 'monkey' gibe
73,Sam Stosur into French open finals
74,Hi-res pix of Brisbane floods available Sun. 15 Jan
75,Ads using 'sexy' children rapped
76,The Sydney race riots. What happened? [View All]
77,To our Australian friends:
78,Man ignores teen's rape in flowerbed [View All]
79,Australia pushes further Web censorship
