id,title
0,"Adeane, His Honour Judge AJ"
1,"Aitken, Her Honour Judge EM"
2,"Andrée Wiltens, His Honour Judge GA"
3,"Atkins, His Honour Judge LH, QC"
4,"Barry, His Honour Judge DRW"
5,"Bergseng, His Honour Judge J"
6,"Bidois, His Honour Judge LM"
7,"Binns, Her Honour Judge JA"
8,"Blackie, His Honour Judge CS"
9,"Borthwick, Her Honour Judge JE"
10,"Brown, His Honour Judge DR"
11,"Burnett, Her Honour Judge MLSF"
12,"Burns, His Honour Judge DA"
13,"Butler, His Honour Judge PJ"
14,"Callaghan, His Honour Judge BP"
15,"Callinicos, His Honour Judge PJ"
16,"Cameron, His Honour Judge D"
17,"Clark, Her Honour Judge DC"
18,"Cocurullo, His Honour Judge ND"
19,"Collins, His Honour Judge R"
20,"Connell, His Honour Judge PR"
21,"Cook, Her Honour Judge C"
22,"Cooper, His Honour Judge PW"
23,"Couch, His Honour Judge AA"
24,"Courtney, His Honour Judge MA"
25,"Coyle, His Honour Judge SJ"
26,"Crosbie, His Honour Judge MA"
27,"Cunningham, Her Honour Judge PA"
28,"Davidson, His Honour Judge B"
29,"Davis, His Honour G"
30,"Dawson, His Honour Judge NR"
31,"de Jong, His Honour Judge L"
32,"de Ridder, His Honour Judge KB"
33,"Doherty, His Honour Judge CJ"
34,"Down, His Honour Judge J"
35,"Druce, His Honour Judge TH"
36,"Dwyer, His Honour Judge BP"
37,"Edwards, Her Honour Judge S"
38,"Eivers, Her Honour Judge FJ"
39,"Farish, Her Honour Judge JA"
40,"Field, His Honour Judge CJ"
41,"Fitzgerald, His Honour Judge AJ"
42,"Flatley, His Honour Judge D"
43,"Fleming, Her Honour Judge SJ"
44,"Fraser, His Honour Judge GA"
45,"Garland, His Honour Judge AD"
46,"Geoghegan, His Honour Judge JP"
47,"Gibson, His Honour Judge BA"
48,"Glubb, His Honour Judge K"
49,"Grace, His Honour Judge PR"
50,"Harding, His Honour Judge CJ"
51,"Harland, Her Honour Judge M"
52,"Harrison, His Honour Judge GM"
53,"Harrop, His Honour Judge SM"
54,"Harvey, His Honour Judge DG"
55,"Harvey, His Honour Judge DJ"
56,"Hassan, His Honour Judge JJM"
57,"Hastings, His Honour Judge WK"
58,"Henare, Her Honour Judge D"
59,"Hikaka, His Honour Judge GF"
60,"Hinton, His Honour Judge LI"
61,"Hobbs, His Honour Judge PAH"
62,"Hunt, His Honour Judge M"
63,"Ingram, His Honour Judge TR"
64,"Jackson, His Honour Judge JR"
65,"Johns, Her Honour Judge AJ"
66,"Johnston, Her Honour Judge J"
67,"Kellar, His Honour Judge PR"
68,"Kelly, Her Honour Judge JM"
69,"Kiernan, Her Honour Judge AE"
70,"Kirkpatrick, His Honour DA"
71,"Lendrum, His Honour Judge T"
72,"Lindsay, Her Honour Judge SMR"
73,"Lovell-Smith, Her Honour Judge JH"
74,"Lynch, His Honour Judge GM"
75,"MacAskill, His Honour Judge GS"
76,"MacKenzie, Her Honour Judge MA"
77,"Mackintosh, Her Honour Judge BM"
78,"Malosi, Her Honour Judge IM"
79,"Marshall, His Honour Judge RG"
80,"Marshall, Her Honour Judge D"
81,"Mather, His Honour Judge DG"
82,"Mathers, Her Honour Judge NJ"
83,"Matheson, His Honour Judge DG"
84,"Maude, His Honour Judge SJ Maze, Her Honour Judge JE"
85,"McAuslan, Her Honour Judge SEC"
86,"McDonald, His Honour Judge DJ"
87,"McGuire, His Honour Judge CJ"
88,"McHardy, His Honour Judge IA"
89,"McMeeken, Her Honour Judge JA"
90,"McNaughton, His Honour Judge DJ"
91,"Menzies, His Honour Judge AS"
92,"Mill, His Honour Judge IG"
93,"Moran, Her Honour Judge JJ"
94,"Morris, Her Honour Judge BA"
95,"Moses, His Honour Judge JC"
96,"Moss, Her Honour Judge JF"
97,"Munro, Her Honour Judge J"
98,"Murfitt, His Honour Judge RJ"
99,"Neave, His Honour Judge RE"
100,"Newhook, His Honour Judge LJ"
101,"O’Driscoll, His Honour Judge SJ"
102,"O’Dwyer, Her Honour Judge MNE"
103,"Paul, His Honour Judge EP"
104,"Phillips, His Honour Judge KJ"
105,"Pidwell, Her Honour Judge BR"
106,"Powell, His Honour LG"
107,"Rea, His Honour Judge GA"
108,"Recordon, His Honour Judge PJ"
109,"Riddell, Her Honour Judge RH"
110,"Roberts, His Honour Judge AC"
111,"Rogers, Her Honour Judge ML"
112,"Rollo, His Honour Judge PS"
113,"Ronayne, His Honour Judge R"
114,"Ross, His Honour Judge GM"
115,"Russell, His Honour Judge RJ"
116,"Ruth, His Honour Judge D"
117,"Ryan, Her Honour Judge C"
118,"Saunders, His Honour Judge DJL"
119,"Sharp, Her Honour Judge ME"
120,"Sharp, His Honour Judge D"
121,"Sinclair, Her Honour Judge Allison"
122,"Sinclair, Her Honour Judge Pippa"
123,"Singh, His Honour Judge AS"
124,"Skellern, Her Honour Judge A"
125,"Smith, His Honour Judge D"
126,"Smith, Her Honour Judge E"
127,"Smith, His Honour Judge JA"
128,"Somerville, Her Honour Judge AE"
129,"Somerville, His Honour Judge CP"
130,"Southwick, Her Honour Judge M, QC"
131,"Spear, His Honour Judge RLB"
132,"Spiller, His Honour Judge PR"
133,"Sygrove, His Honour Judge C"
134,"Taumaunu, His Honour Judge HM"
135,"Thomas, His Honour Judge E"
136,"Thompson, His Honour Judge CJ"
137,"Tompkins, His Honour Judge AIM"
138,"Tremewan, Her Honour Judge L"
139,"Tuohy, His Honour Judge CN"
140,"Turner, His Honour Judge M"
141,"Wainwright, Her Honour Judge CM"
142,"Walker, His Honour Judge JA"
143,"Walker, Her Honour Judge JH"
144,"Walsh, His Honour Judge NA"
145,"Walsh, His Honour Judge AP"
146,"Weir, His Honour Judge JJ"
147,"Wills, Her Honour Judge A"
148,"Wilson, His Honour Judge D, QC"
149,"Winter, His Honour Judge G"
150,"Wolff, His Honour Judge RP"
151,"Zohrab, His Honour Judge AA"
