id,title
0,"Lieberman gets nod, but Lamont wins spot on primary ballot"
1,New Ned Lamont Video Pounds Lieberbush! WOW. See this!
2,Anybody else petitioning for Lamont....
3,New ads from Ned Lamont's US Senate Campaign
4,Enough Of The War - And Enough Of Lieberman
5,Rell Makes Her Choice: Fedele
6,Ned Lamont's Willimantic office opening
7,"WSJ: Ned Lamont, Kos Celeb"
8,One Year Anniversary of Michael Ross Death
9,Lawmakers launch Rell fundraiser hearings
10,Windsor Democrats want Lieberman out
11,Windsor DTC Endorses Lamont
12,CT-SEN: Ned Lamont to be on CNN this afternoon
13,I think Lieberman just sunk himself. Did ya see the new ad?
14,Senate Passes Nearly $16.1 Billion Budget Plan
15,Lieberman challenger Lamont
16,"Quinnipiac Poll: Anti-Bush, Anti-War Feeling Does Not Hurt Lieberman"
17,ATTN CT Peace Activists
18,CT Republicans up to more shenanigans
19,Bush sinks to 24% approval in CT
20,Council left to wonder why Joe is a no show (Lieberman and voting machines
21,Lieberman/Lamont
22,"Manchester Democrats favor Malloy, Lieberman"
23,Delegate Count for Ned?
24,Anybody know why Rell is blowing off Hu Jintao of China?
25,Does anybody know if Jim Dean supports Lamont?
26,"Ex-Mayor, Legislator From Derby To Announce Run For U.S. Senate"
27,I just received another phone call
28,Orchulli (Republican) rips Lieberman in LTTE for losing his way
29,"Out of CT's three Repukes, which one would you like to see get the boot? (Poll)"
30,"Lamont, Lieberman coming to Windsor"
31,Anyone seeing the Nancy Johnson Moveon ad
32,Attack Ad Riles Johnson & Murphy (MoveOn Ad & Ct's 5th Dist. Race)
33,"Well, been here 2 months and I like it. [View All]"
34,Challenger to Lieberman Steps Over [View All]
35,Lieberman refuses to rule out run as independent
36,"FOX supported by UCONN---saw this ""sponsored by"" message 4/2 on Fox"
37,Anybody protesting Bush in Bridgeport?
38,"AP Interview: Dodd says he has ""itch"" for 2008 presidential bid"
39,Ned Lamont in New Haven April 17
40,Email from Ned Lamont
41,Bush Coming to CT Wed. 4/5/06
42,Have anybody heard of Streitz??? (Repuke seeking nomination for Senate)
43,Ned is gaining delegates
44,Weicker was on with Colin today. He is very glad
45,Morning Edition - Democrat Lieberman Challenged Over Support for Iraq War
46,JJB Dinner
47,Email from Ned Lamont today...
48,Mayor secures local support
49,I just donated $75 to Ned Lamont.
50,Need to email WTIC about how Right wing their station is!!
51,Joes getting scared
52,Lieberman to be on with Colin McEnroe 3/22/06
53,"Ned Lamont to speak at DFA-New Haven Meeting, Apr 5, 7pm"
54,my letter re: Chris Murphy v. Nancy Johnson in 5th Cong. District
55,I met Chris Murphy for 5th Congress'l Dist.: www.murphyforcongress.org
56,Jodi Rell is Best Rated Governor in U.S.
57,Congresswoman Nancy Johnson Requests Meeting with Litchfield Land Trust
58,"A-G Richard Blumenthal, why can't HE replace Joe Lieberman?"
59,Join John for the Official Begining - DeStefano Announcement for Governor
60,Ned Lamont to be on WTIC on Thursday
61,why does Lieberman have no one answering phones in DC at 4:45?
62,Take Action on Environmental Legislation -News Conf in Hartford 3/16
63,Sat. March 18th Anti-Iraq Wars Protest Marches
64,Connecticut Coalition for Universal Health Care
65,"Democratic Gubernatorial Debate - 3/25 - Oxford, CT"
66,What does everybody think of the car tax situation?
67,Last night's Meet & Greet with Ned in Killingly
68,Joe Lieberman's MySpace
69,"Man fires at car, accidentally shoots self in leg [View All]"
70,CT United for Peace Protest March 3/18/06
71,Invitation from Ned Lamont
72,My LTTE in the Norwich Bulletin: Lieberman faces simple job review
73,Any ideas on campaign security measures....??
74,Can you guys post some LTTE sources so we can have a Ned
75,What happened to Same Sex Marriage????
76,"Ned Lamont supporters! His first ""campaign meeting"" is this Saturday"
77,Help New Haven DUers! The proposed Yale Cancer Center
78,"Ned Lamont opens Norwalk HQ, Thursday March 2nd, 7pm"
79,Lamont could help re-establish Dems' hold
