id,title
0,Non-motorized transport (NMT)
1,Fuels-Coal Air pollution Energy and industry emissions
2,Methane (CH4) Alternative fuels
3,Greenhouse gases (GHGs)
4,Air quality monitoring Air pollution
5,Air quality monitoring Air quality management (AQM) Air pollution
6,Air quality monitoring Fuels-Coal Air pollution
7,Air quality management (AQM) Air pollution
8,Sustainable transport
9,Sustainable transport
10,Sustainable transport
11,Co-benefits Sustainable transport
12,Climate change and global warming
13,Climate change and global warming
14,Impacts-Health Non-motorized transport (NMT)
15,Impacts-Health NMT-Walking Non-motorized transport (NMT)
16,NMT-Walking
17,Fuel economy Energy and industry emissions
18,Energy and industry emissions
19,Co-benefits Fuel economy
20,Public transport
21,Sustainable transport
22,Sustainable transport Electric vehicles
23,Air quality management (AQM)
24,Air quality monitoring
25,Bus rapid transit (BRT) Sustainable transport
26,Air quality management (AQM)
27,Freight and logistics Sustainable transport
28,NMT-Walking Sustainable transport Transport demand management (TDM)
29,NMT-Walking NMT-Cycling
30,NMT-Walking Non-motorized transport (NMT)
31,NMT-Walking Non-motorized transport (NMT) Transport demand management (TDM)
32,NMT-Cycling Sustainable transport
33,Impacts-Economic Bus rapid transit (BRT) Sustainable transport
34,Air pollution
35,Air pollution
36,Air pollution
37,Air pollution
38,Air pollution
39,Climate change and global warming
40,Climate change and global warming
41,Climate change and global warming
42,Climate change and global warming
43,Air pollution Climate change and global warming
44,Fuels-Coal Alternative fuels Air pollution
45,Fuels-Coal Energy and industry emissions
46,Alternative fuels Energy and industry emissions
47,Alternative fuels Energy and industry emissions
48,Emissions inventory/source apportionment Energy and industry emissions Financing and economic instruments
49,Alternative fuels Financing and economic instruments
