id,title
0,"Javid Ahmadi “Appfy Inc. is Toronto’s leading interactive brand agency. We offer an interdisciplinary approach by blending the practices of design, technology and corporate identity to create innovative branding.” Richmond Hill Graphic Designers"
1,Prinova Software Inc Toronto Graphic Designers
2,Prinova Technologies Inc Toronto Graphic Designers
3,Bluefish Interactive Toronto Graphic Designers
4,G J P Advertising Toronto Graphic Designers
5,Calibre Design and Marketing Group Toronto Graphic Designers
6,Chris Parsons Design Toronto Graphic Designers
7,Creative House Toronto Graphic Designers
8,Thrive Design And Communications Toronto Graphic Designers
9,Stanford Communications Toronto Graphic Designers
10,Premise Design Communications Inc Toronto Graphic Designers
11,Amoeba Corp Toronto Graphic Designers
12,Agency Three Toronto Graphic Designers
13,REDWORKS Toronto Graphic Designers
14,Design Direct Toronto Graphic Designers
15,1 Shop Marketing Toronto Graphic Designers
16,Dave Donald Image Design Toronto Graphic Designers
17,Lisa Kiss Design Toronto Graphic Designers
18,CôteDèsign Toronto Graphic Designers
19,Studio Bello Toronto Graphic Designers
20,Oxygen Design Agency Toronto Graphic Designers
21,Beehive Design Toronto Graphic Designers
22,Studio Bello Toronto Graphic Designers
23,Circle Media Inc Toronto Graphic Designers
24,Scott Thornley & Company Inc Toronto Graphic Designers
25,Crop Marks Communications Inc Toronto Graphic Designers
26,Craib Design & Communications Toronto Graphic Designers
27,Doublenaut Toronto Graphic Designers
28,The Assoc Rgd Ont Toronto Graphic Designers
29,Monnet Design Inc Toronto Graphic Designers
30,Evoke Solutions Toronto Graphic Designers
31,Mgt Communications Inc Toronto Graphic Designers
32,MGT Communications Inc Toronto Graphic Designers
33,Brushfire Design Toronto Graphic Designers
34,Derooted Creative Agency Toronto Graphic Designers
35,Slingshot Communication Toronto Graphic Designers
36,Stokely Design Associates Inc Toronto Graphic Designers
37,Thoughtbubble Toronto Graphic Designers
38,Regenerate Toronto Graphic Designers
39,Robinson & Design Inc Toronto Graphic Designers
40,Studio Deluxe Toronto Graphic Designers
41,Duo Creative Toronto Graphic Designers
42,Bruce Mau Design Inc Toronto Graphic Designers
43,Fraiman Design Inc Toronto Graphic Designers
44,Jump Communications Inc Graphic Designers
45,SBL Communications Toronto Graphic Designers
46,Styles Design Toronto Graphic Designers
47,NP Consultants Graphic Designers
48,Intelligent Creatures Toronto Graphic Designers
49,Bold Graphic Communication Ltd Toronto Graphic Designers
50,Dapper & Design Toronto Graphic Designers
