id,title
0,"Cisco Systems Washington, DC"
1,"Laborers Union Washington, DC"
2,"Lincy Foundation Beverly Hills, CA"
3,"National Education Assn Washington, DC"
4,"Xcel Energy Denver, CO"
5,"Intl Brotherhood of Electrical Workers Washington, DC"
6,"Forest City Stapleton Denver, CO"
7,"Agvar Chemicals Little Falls, NJ"
8,"American Federation of Teachers Washington, DC"
9,"Union Pacific Corp Cheyenne, WY"
10,"UnitedHealthcare Services Minneapolis, MN"
11,"Monster Worldwide New York, NY"
12,"Qwest Services Denver, CO"
13,"American International Group New York, NY"
14,"SEIU PEA International Washington, DC"
15,"Microsoft Corp Redmond, WA"
16,"AT&T Inc Washington, DC"
17,"Hensel Phelps Construction Greeley, CO"
18,"Newmont USA Denver, CO"
19,"American Fedn of St/Cnty/Munic Employees Washington, DC"
20,"AstraZeneca Pharmaceuticals Washington, DC"
21,"Freeport-McMoran Copper & Gold Phoenix, AZ"
22,"MacAndrews & Forbes New York, NY"
23,"Prudential Financial Newark, NJ"
24,"Travelers Companies Hartford, CT"
25,"United Food & Commercial Workers Union Washington, DC"
26,"Vail Resorts Broomfield, CO"
27,"Wasserman Foundation Beverly Hills, CA"
28,"Watts Law Firm Austin, TX"
29,"BNSF Railway Fort Worth, TX"
30,"Molson Coors Brewing Golden, CO"
31,"Coors Brewing Golden, CO"
32,"Cervantes Capital Denver, CO"
33,"Target Corp Washington, MN"
34,"ConocoPhillips Houston, TX"
35,"Swanee Hunt Family Foundation Cambridge, MA"
36,"Merck & Co Washington, DC"
37,"US Bancorp Denver, CO"
38,"American Resort Development Assn Washington, DC"
39,"Best Buy Purchasing Richfield, MN"
40,"Comcast Corp Philadelphia, PA"
41,"Level 3 Communications Broomfield, CO"
42,"Allstate Insurance Northbrook, IL"
43,"Cobank Greenwood Village, CO"
44,"Eli Lilly & Co Washington, DC"
45,"United Airlines Denver, CO"
46,"Amgen Inc Thousand Oaks, CA"
47,"Dale Carnegie Greenwood Village, CO"
48,"Denver Newspaper Agency Denver, CO"
49,"ProLogis Denver, CO"
50,"Wells Fargo Minneapolis, MN"
51,"CH2M HILL Englewood, CO"
52,"1199SEIU New York State New York, NY"
53,"Ball Corp Broomfield, CO"
54,"Chesapeake Operating Oklahoma City, OK"
55,"Citigroup Inc Tampa, FL"
56,"Denver Metro Chamber of Commerce Denver, CO"
57,"Dish Network Englewood, CO"
58,"Dow Chemical Washington, DC"
59,"FedEx Corp Washington, DC"
60,"Freddie Mac Washington, DC"
61,"Goldman Sachs New York, NY"
62,"Johnson & Johnson Washington, DC"
63,"Lennox International Dallas, TX"
64,"Medtronic Inc Minneapolis, MN"
65,"National Air Traffic Controllers Assn Washington, DC"
66,"National Assn of Home Builders Washington, DC"
67,"Novartis Corp Washington, DC"
68,"Operating Engineers Union Livonia, MI"
69,"Paragon Ranch Greenwood Village, CO"
70,"Peabody Investments Saint Louis, MO"
71,"Pfizer Inc New York, NY"
72,"Pharmaceutical Rsrch & Mfrs of America Washington, DC"
73,"Pritzker Group Evanston, IL"
74,"Pritzker Traubert Family Foundation Chicago, IL"
75,"Rockefeller Foundation New York, NY"
76,"Sacks Family Foundation Highland Park, IL"
77,"SEIU General Fund Washington, DC"
78,"Teamsters Union Washington, DC"
79,"Teletech Holdings Englewood, CO"
80,"UBS Stamford, CT"
81,"Verizon Communications New York, NY"
82,"Visa USA Washington, DC"
83,"Xerox Corp Washington, DC"
84,"Staples Inc Framingham, MA"
85,"Boeing Co Arlington, VA"
86,"AFLAC Inc Columbus, GA"
87,"American Health Care Assn Washington, DC"
88,"Bernard & Irene Schwartz Foundation New York, NY"
89,"GNYHA Services New York, NY"
90,"Lockheed Martin Lakeland, VA"
91,"Sheet Metal Workers Union Washington, DC"
92,"Coca-Cola Co Washington, DC"
93,"Aspen Skiing Co Chicago, IL"
94,"Morgan Stanley New York, NY"
95,"Mylan Laboratories Canonsburg, PA"
96,"United Therapeutics Silver Spring, MD"
97,"Apple Computer Cupertino, CA"
98,"FirstBank Holding Co Lakewood, CO"
99,"3M Co Saint Paul, MN"
100,"KKR & Co Greenwood Village, CO"
101,"Liberty Media Englewood, CO"
102,"Pepsi-Cola Bottlers Assn Somers, NY"
103,"PepsiCo Inc Purchase, NY"
104,"Starz Entertainment Englewood, CO"
105,"Waste Management Inc Houston, TX"
106,"Colorado Rockies Denver, CO"
107,"MDC Holdings Denver, CO"
108,"PCL Construction Enterprises Denver, CO"
109,"AARP Washington, DC"
110,"AFL-CIO Washington, DC"
111,"American Wind Energy Assn Washington, DC"
112,"Anadarko Petroleum Houston, TX"
113,"Anheuser-Busch Washington, DC"
114,"ArcelorMittal USA Chicago, IL"
115,"Arch Coal St Louis, MO"
116,"Archer Daniels Midland Washington, DC"
117,"Astellas Pharma USA Washington, DC"
118,"Bank of America Wilmington, DE"
119,"Blue Cross/Blue Shield of California San Francisco, CA"
120,"BP America Washington, DC"
121,"Chicago Mercantile Exchange Chicago, IL"
122,"CLFS Equities Denver, CO"
123,"David Berger Foundation Philadelphia, PA"
124,"Diageo North America Washington, DC"
125,"First Data Corp Greenwood Village, CO"
126,"Ford Motor Co Washington, DC"
127,"Foundation for Maryland's Future Chevy Chase, MD"
128,"General Electric Atlanta, GA"
129,"Google Inc Mountain View, CA"
130,"Hewlett-Packard Colorado Springs, CO"
131,"Howard L Gottlieb Living Trust Evanston, IL"
132,"Hugo Neu Corp New York, NY"
133,"Janus Capital Management Denver, CO"
134,"JPMorgan Chase & Co New York, NY"
135,"Kroger Co Denver, CO"
136,"Laborers Union/New Jersey Monroe Township, NJ"
137,"Lehman Brothers Jersey City, NJ"
138,"Liberty Global Englewood, CO"
139,"Marc Haas Foundation New York, NY"
140,"McKay Foundation San Francisco, CA"
141,"Motorola Inc Tempe, AZ"
142,"National Assn of REITs Washington, DC"
143,"North Cypress Medical Center Cypress, TX"
144,"Oracle USA Washington, DC"
145,"Public Policy Fund Washington, DC"
146,"Safeway Inc Washington, DC"
147,"SEIU Illinois State Council Chicago, IL"
148,"Solar Energy Industries Assn Washington, DC"
149,"State Farm Mutual Automobile Insurance Bloomington, IL"
150,"Teva Pharmaceuticals USA North Wales, PA"
151,"Thomson West Eagan, MN"
152,"Time Warner Telecom Washington, DC"
153,"Unite Here Washington, DC"
154,"United Launch Alliance Littleton, CO"
155,"Universal American Financial Rye Brook, NY"
156,"Walgreen Co Washington, DC"
157,"Wallace Global Fund Washington, DC"
158,"Western Union Greenwood Village, CO"
159,"White Flowers Foundation New York, NY"
160,"Working for Working Americans Washington, DC"
161,"Pitney Bowes Inc Stamford, CT"
162,"Equity Office Denver, CO"
163,"Dominion Resources Richmond, VA"
164,"Dewey Digital Washington, DC"
165,"CA State Council of Service Employment Sacramento, CA"
166,"Durst Organization New York, NY"
167,"Gates Corp Denver, CO"
168,"Southern Co Services Washington, DC"
169,"Morsports & Events Englewood, CO"
170,"Keybank National Assn Denver, CO"
171,"Brownstein, Hyatt et al Denver, CO"
172,"Anthem Blue Cross/Blue Shield Cincinnati, OH"
173,"Abbott Laboratories Washington, DC"
174,"Alliance of Automobile Manufacturers Washington, DC"
175,"Alliant Techsystems Arlington, VA"
176,"Battelle Corp Columbus, OH"
177,"CCP/MS SSIII Denver Chicago, IL"
178,"Communications Workers of America Washington, DC"
179,"Democratic Lieutenant Governors Assn Washington, DC"
180,"EDS Corp Del Mar, CA"
181,"Jerry Gart Family Foundation Denver, CO"
182,"Kraft Foods Global Northfield, IL"
183,"MegaStar Financial Denver, CO"
184,"Neo@Ogilvy New York, NY"
185,"Property Casualty Insurers Assn/America Washington, IL"
186,"Taubman Cherry Creek Shopping Center Denver, CO"
187,"Wells Fargo Foundation San Francisco, CA"
188,"Boilermakers Union Kansas City, KS"
189,"Camco International Group Aspen, CO"
190,"Carsey Living Trust Studio City, CA"
191,"Colorado Ski Country Denver, CO"
192,"Information Handling Services Englewood, CO"
193,"MWH Global Broomfield, CO"
194,"New York Life Insurance New York, NY"
195,"Painters & Allied Trades Union Washington, DC"
196,"Real Estate Roundtable Washington, DC"
197,"Tri-State Generation & Transmission Westminster, CO"
198,"UA Political Education Cmte Washington, DC"
199,"Venoco Inc Denver, CO"
200,"Magna Liquidating Trust Denver, CO"
201,"Colorado Municipal Bond Dealers Assn Denver, CO"
202,"Turner Construction Greenwood Village, CO"
203,"NYPROCOA Inc New York, NY"
204,"Vangaurd Group Boston, MA"
205,"Concessions-Panda Atlanta, GA"
206,"CPI Card Group Littleton, CO"
207,"Goodwill Industries of Denver Denver, CO"
208,"AECOM Tech Denver, CO"
209,"AgriBank FCB Saint Paul, MN"
210,"American Federation of Govt Employees Washington, DC"
211,"Barry L & Jan R Zubrow Foundation Far Hills, NJ"
212,"Continuum Partners Denver, CO"
213,"Covidien Mansfield, MA"
214,"Development Specialists Inc Chicago, IL"
215,"DMJM & Harris New York, NY"
216,"Ecolab Foundation Saint Paul, MN"
217,"Edison Electric Institute Washington, DC"
218,"Greenberg Traurig LLP Denver, CO"
219,"IAHFIAW Lanham, MD"
220,"Johnson Family Fund Washington, DC"
221,"Kiewit Companies Foundation Omaha, NE"
222,"Medco Solutions Franklin Lakes, NJ"
223,"Musk Foundation El Segundo, CA"
224,"Parsons Corp Washington, DC"
225,"Piper Jaffray Minneapolis, MN"
226,"PNMR Services Albuquerque, NM"
227,"RBC Financial Group Denver, CO"
228,"Ropes & Gray Brookline, MA"
229,"Shea Properties Greenwood Village, CO"
230,"Shorenstein Realty Services San Francisco, CA"
231,"ValueOptions Inc Norfolk, VA"
232,"Winter Park Operations Winter Park, CO"
233,"Yarmony Creek Oil & Gas Vail, CO"
234,"NGP Washington, DC"
235,"Alvarado Construction Denver, CO"
236,"SEIU Washington State Council Seattle, WA"
237,"Denver Business Journal Denver, CO"
238,"Parsons Brinckerhoff Denver, CO"
239,"Hyatt Regency Denver Denver, CO"
240,"Colorado Springs Convention/Visitors Bur Colorado Springs, CO"
241,"Goodyear Tire & Rubber Akron, OH"
242,"T-Mobile USA Parsippany, NJ"
243,"Hogan & Hartson Denver, CO"
244,"PR Newswire New York, NY"
245,"Sage Hospitality Resources Denver, CO"
246,"Bear Creek Capital Cinicinnati, OH"
247,"Epicurean Catering Greenwood Village, CO"
248,"Faegre & Benson Denver, CO"
249,"Ilene Lieberman Campaign Account Fort Lauderdale, FL"
250,"Stacy Joy Ritter for Broward County Parkland, FL"
251,"Union Center Denver, CO"
252,"US Bank National Assn Robbinsdale, MN"
253,"Chipotle Mexican Grill Denver, CO"
254,"Concessions Colorado Atlanta, GA"
255,"Cargill Inc Minneapolis, MN"
256,"Mosaic Corp Plymouth, MN"
257,"SMG Philadelphia, PA"
258,"Graebel Companies Aurora, CO"
259,"Merchants Mortgage & Trust Greenwood Village, CO"
260,"Rothgerber, Johnson & Lyons Denver, CO"
261,"Adams Mark Hotel Denver, CO"
262,"Amalgamated Transit Union Washington, DC"
263,"American Furniture Warehouse Englewood, CO"
264,"Cherokee Denver Raleigh, NC"
265,"CJS Hotel Operator Englewood, CO"
266,"Colorado Assn of Realtors Englewood, CO"
267,"Credit Union Assn of Colorado Denver, CO"
268,"District 8 Senior Events Denver, CO"
269,"Downtown Denver Partnership Denver, CO"
270,"Entravision Communications Santa Monica, CA"
271,"Erickson Retirement Communities Baltimore, MD"
272,"Fidelity Charitable Gift Fund New York, NY"
273,"Haselden Construction Centennial, CO"
274,"HCA Contintental Division Denver, CO"
275,"JE Dunn Construction Denver Denver, CO"
276,"Kutak Rock LLC Denver, CO"
277,"Land Title Insurance Denver, CO"
278,"Metropolitan Homes Denver, CO"
279,"Moore Charitable Foundation New York, NY"
280,"O'Toole Family Foundation Short Hills, NJ"
281,"Park Avenue Uptown Denver, CO"
282,"Perry Rose Katonah, NY"
283,"Sue & Eugene Mercy Jr Foundation New York, NY"
284,"University of Colorado Denver, CO"
285,"Waite, Schneider et al Cincinnati, OH"
286,"Frontier Airlines Denver, CO"
287,"Energy Enterprise Solutions Upper Marlboro, MD"
288,"Jacobs Engineering Group Golden, CO"
289,"Miller Global Properties Denver, CO"
290,"One Source Consulting Upper Marlboro, MD"
291,"Qdoba Mexican Grill Wheat Ridge, CO"
292,"Shughart, Thomson & Kilroy Kansas City, MO"
293,"Kamlet, Shepherd & Reichert Denver, CO"
294,"Concord Inc Denver, CO"
295,"Highland's Garden Cafe Denver, CO"
296,"Ablaze Group Evergreen, CO"
297,"Alem International Management Louisville, CO"
298,"Arcadis Highlands Ranch, CO"
299,"Argonaut Wine & Liquor Denver, CO"
300,"Arnold & Porter Denver, CO"
301,"Aurora Economic Development Council Aurora, CO"
302,"Baker & Hostetler Denver, CO"
303,"Bank of Choice Greeley, CO"
304,"Black Hawk/Central City Visitors C Denver, CO"
305,"Brandeberry-McKenna Public Affairs Denver, CO"
306,"Burg, Simpson et al Englewood, CO"
307,"Capstone Group Denver, CO"
308,"CBRE Real Estate Services Denver, CO"
309,"CO State Conf Electrical Workers E Denver, CO"
310,"Colorado Restaurant Assn Denver, CO"
311,"Compass Bank Foundation Agency Denver, CO"
312,"Continental Airlines Houston, TX"
313,"Corporex Colorado Denver, CO"
314,"Da Davidson Co Denver, CO"
315,"Davis, Graham & Stubbs Denver, CO"
316,"Denver Classroom Teachers Assn Denver, CO"
317,"Denver Hispanic Chamber of Commerce Denver, CO"
318,"Destination Services of Colorado Denver, CO"
319,"DIA Concessionaires Assn Denver, CO"
320,"Dufford & Brown Denver, CO"
321,"Exempla Healthcare Denver, CO"
322,"Fast Enterprises Greenwood Village, CO"
323,"Fisher, Sweetbaum et al Denver, CO"
324,"Fort Morrison, CO"
325,"Foster, Graham et al Denver, CO"
326,"Gutterman Griffiths Littleton, CO"
327,"Haddon, Morgan et al Denver, CO"
328,"Hein & Assoc Denver, CO"
329,"Helen Shreves Esq Denver, CO"
330,"Hixson Enterprises Chicago, IL"
331,"Holcim Inc Waltham, MA"
332,"Holland & Hart Denver, CO"
333,"Ireland, Stapleton et al Denver, CO"
334,"Isaacson Rosenbaum PC Denver, CO"
335,"Kaplan, Kirsch & Rockwell Denver, CO"
336,"Larimer Square Management Denver, CO"
337,"Linebarger, Goggan et al Denver, CO"
338,"MBH Enterprises Denver, CO"
339,"McWhinney Enterprises Loveland, CO"
340,"Metro Denver Automobile Dealers Assn Denver, CO"
341,"Mills & Weitzenkorn Denver, CO"
342,"Montgomery, Little et al Greenwood Village, CO"
343,"Mortenson Construction Minneapolis, MN"
344,"Nestle Waters North America Greenwich, CT"
345,"PEM LLC Denver, CO"
346,"Pittman Development Group Denver, CO"
347,"Professional Account Management Milwaukee, WI"
348,"Rentech Inc Los Angeles, CA"
349,"Resolute Investments Centennial, CO"
350,"Richter Scale Productions Denver, CO"
351,"Roche Colorado Corp Boulder, CO"
352,"Schenkein Inc Denver, CO"
353,"SMG Colorado Convention Center Denver, CO"
354,"Snell & Wilmer Denver, CO"
355,"Stifel Nicolaus Saint Louis, MO"
356,"Stonebridge Realty Advisors Englewood, CO"
357,"SuperShuttle International Denver, CO"
358,"TIAA-CREF Washington, DC"
359,"Tijerina & Assoc Denver, CO"
360,"UMB Bank Denver, CO"
361,"Wedgle & Kukreja Denver, CO"
362,"Wynkoop Brewing Denver, CO"
363,"ACF Property Management Studio City, CA"
364,"Cherokee Investment Partners Denver, CO"
365,"Chotin Group Greenwood Village, CO"
366,"Dean Foods Dallas, TX"
367,"International Entertainment Consul Lakewood, CO"
368,"James J Volker Family Trust Greenwood Village, CO"
369,"Paradise Investment Properties Denver, CO"
370,"Policy Studies Inc Denver, CO"
371,"Vestar Capital Partners Denver, CO"
372,"Boulder Convention & Visitors Bureau Boulder, CO"
373,"Durango Area Tourism Office Durango, CO"
374,"HL2 Seattle, WA"
375,"Skyport Companies Denver, CO"
376,"Town of Estes Park Estes Park, CO"
377,"Ampco Parking System Denver, CO"
378,"Rent-Rite Super Kegs West Denver, CO"
379,"Bookhardt & O'Toole Denver, CO"
380,"Larabar Denver, CO"
381,"Belz Assoc Denver, CO"
382,"Denver Metro Convention & Visitors Denver, CO"
383,"Grand Hyatt Denver Denver, CO"
384,"Jardel Enterprises Greenwood Village, CO"
385,"TCBY Yogurt of Denver Denver, CO"
386,"SSLVP Denver, CO"
387,"Brown & Tedstrom Retirement Planning Denver, CO"
388,"Centerra Properties West Loveland, CO"
389,"Colorado Concern Denver, CO"
390,"Colorado Credit Union League Arvada, CO"
391,"Creme de la Creme Greenwood Village, CO"
392,"Focus Investments Ltd Denver, CO"
393,"Hibernia Holdings Greenwood Village, CO"
394,"Neumeyer FLP Greenwood Village, CO"
395,"Otten, Johnson et al Denver, CO"
396,"Palmos Development Boulder, CO"
397,"PHH2000 Inc Denver, CO"
398,"Ready Temporary Services Denver, CO"
399,"Robert G Hueston PC Denver, CO"
400,"Stratton & Assoc Littleton, CO"
401,"Urban Neighborhoods Real Estate Denver, CO"
402,"Hanfling & Assoc Denver, CO"
403,"Baurs Restaurant Denver, CO"
404,"Denver Theatrical Stage, Film & Denver, CO"
405,"Ocean Lodge Atlanta, GA"
406,"United Parcel Service Washington, DC"
407,"Welchert & Britz Denver, CO"
408,"Bonnie Brae Ice Cream Denver, CO"
409,"Niagara Properties Lakewood, CO"
410,"Patterson & Co Broomfield, CO"
411,"Laughing Woman Publishing Loveland, CO"
412,"5280 Magazine Denver, CO"
