id,title
0,A Program of Action
1,A Program for Selfish People
2,A Program Baby
3,A Profound Faith in AA
4,A Profitable Practice
5,A Process of Repetition
6,A Problem Very Big
7,A PROBLEM
8,A Prisoner Of My Own Universe
9,A Prison Program for the Rehabilitation of Alcoholics (1942)
10,A Priest's Story
11,A Prescription for Sobriety
12,A Prescription for Sobriety
13,A Prayerful Approach to the Steps
14,A PRAYER
15,A Pragmatic Power
16,A Powerful Urge
17,A Powerful Reason for Faith
18,A Powerful Reason for Faith
19,A Powerful Assignment
20,A Power of Example
21,A Power in the Air
22,A Power Greater Than Compulsion
23,A Power Greater Than Alcohol
24,A Power Beyond the Mind
25,A Potluck Celebration
26,A Postscript from the Sergeant
27,A Positive Approach
28,A Position Paper on Anonymity
29,A Portrait of a Marriage
30,A Portable Sanctuary
31,A Portable Program
32,A Portable AA Group
33,A Polite People
34,"A Policy With All the ""Extras"
35,A Pocket Full of Dimes
36,A Plug for Resentments
37,"A Plea to the ""Hard-case"" Aristocracy"
38,A Plea of 'Not Guilty'
39,A Plea for the Young in Years
40,A Plea for Non-interference
41,A Plea for Age Distinctions
42,A Planted Seed
43,A Planted Seed
44,A Plan of Operation
45,A Plan of Action
46,A Plan for Living
47,A Place Where I Feel Wonderful
48,A Place to Belong
49,A Place of Either/Or
