id,title
0,ImagineSolar | Advanced PV Project Experience Feb | 6 - 10
1,RESNET HERS Rater
2,LEED GREEN ASSOCIATE (2 day)
3,BPI Building Analyst and Envelope Professional
4,Basic Photovoltaics Online
5,PVOL202: Advanced PV System Design & the NEC (Grid-Direct)
6,PVOL206: Solar Business & Technical Sales
7,RDOL101: Appropriate Technology for the Developing World
8,PVOL303: Advanced Battery-based PV System Design Series 1
9,PVOL101: Solar Electric Design & Installation (Grid-Direct)
10,PV Sales and Finance Online
11,Advanced Lab Day: Solar PV Design & Installation | Nov 7
12,ImagineSolar | Advanced PV Project Experience | Nov 7 - 11
13,REPV(A): Advanced Design & Installation of Photovoltaic Sys
14,Solar Fundamentals 1A - Online
15,Solar Fundamentals 1B - Online
16,PV Technical Sales
17,Solar Fundamentals 1B - Labs
18,Solar Fundamentals 1A - Labs
19,REST: Renewable Energy Generation with Solar Thermal Systems
20,ONLINE REPV: Renewable Energy with Photovoltaic Systems
21,Small Wind Site Assessor Training Online
22,PV301L: Solar Electric Lab Week (Battery-Based)
23,PV Site Assessor Training Online
24,Solar Space Heating Systems Online
25,Solar Space Heating Systems
26,Solar Domestic Hot Water Systems Online
27,PV201L: Solar Electric Lab Week (Grid-Direct)
28,RESNET HERS Rater
29,PVOL304: Advanced Battery-based PV System Design: Series II
30,SHOL101: Solar Hot Water Design and Installation
31,PVOL101: Solar Electric Design & Installation (Grid-Direct)
32,"PV203 PREP: Battery-based PV System Fundamentals, online"
33,PVOL202: Advanced PV System Design & the NEC (Grid-Direct)
34,PV203 PV Systems Design and Installation Workshop
35,Homebrew Wind Power - Wind Turbine Design and Construction
36,PV101: Solar Electric Design & Installation (Grid-Direct)
37,PV System Design (Online)
38,REPV: Renewable Energy Generation with Photovoltaics
39,Building Energy Analytics
40,Passive House in the Real World
41,Deep Energy Retrofits
42,Wind Turbine Repair and Maintenance
43,Introduction to Tower Climbing and Safety
44,Solar Fundamentals 1A - Online
45,PV201 - PV Design and Installation - Online
46,Basic Photovoltaics Online
47,Advanced Lab Day: Solar PV Design & Installation | August 29
48,ImagineSolar | Advanced PV Project Experience Aug 29 - Sep 2
49,Solar Fundamentals 1B - Online
50,Austin Community College ~ WIND 2359 – Wind Power Systems
51,ACC-ELMT 2372 – Energy Efficient Structures and Assessments
52,Austin Community College ~ ELMT 2275 – Solar Thermal Systems
53,Austin Community College ~ ELMT 2474 - Solar PV Systems
54,Austin Community College ~ ELMT 2276 - Solar PV Installation
55,PV201L: Solar Electric Lab Week (Grid-direct) for Women
56,"PV203 PREP: Battery-based PV System Fundamentals, online"
57,PVOL303: Advanced Battery-based PV System Design: Series I
58,PVOL202: Advanced PV System Design & the NEC (Grid-Direct)
59,PVOL206: Solar Business and Technical Sales - Online
60,PV203 - PV Systems Design and Installation - Workshop
61,PV351L: PV Systems-Tools & Techniques for O&M (Grid-direct)
62,PVOL101: Solar Electric Design & Installation (Grid-Direct)
63,Fronius Service Provider Training
64,Fronius Service Provider Training
65,Fronius Service Provider Training
66,Fronius Service Provider Training
67,Community Energy Transformations: Fort Collins Case Study
68,ImagineSolar | Online Smart Grid and Distributed Generaton
69,BPI Building Analyst and Envelope Professional
70,Fronius Service Provider Training
71,"Free SolarEdge Workshop | Austin, TX | August 6, 2015"
72,ImagineSolar | Online Solar PV Economics and Technical Sales
73,Solar Thermal Site Assessor Training Online
74,PV301L: Solar Electric Lab Week (Battery-Based)
75,ImagineSolar | Foundations Online PV Design & Installation
76,PV201 - PV Design and Installation - Online
