id,title
0,"New Rush single ""One Little Victory"""
1,"Re: New Rush single ""One Little Victory"""
2,HUGE
3,My opinion
4,Re: HUGE
5,Re: HUGE
6,"Re: New Rush single ""One Little Victory"""
7,"Re: New Rush single ""One Little Victory"""
8,"Poison new Album cover, and New Single"
9,"Re: Poison new Album cover, and New Single"
10,"Re: Poison new Album cover, and New Single"
11,The Z Records band called Shayene. Questions
12,Re: The Z Records band called Shayene. Questions
13,Thanks for the info. np
14,Re: The Z Records band called Shayene. Questions
15,Latest sfk style nu-breed alert!
16,Danny Vaughn last night in Sheffield
17,Re: Danny Vaughn last night in Sheffield
18,Re: Danny Vaughn last night in Sheffield
19,Re: Danny Vaughn last night in Sheffield
20,Re: Danny Vaughn last night in Sheffield
21,Reggae version of Seasons
22,Re: Reggae version of Seasons
23,"Hmm, You Wouldn't Be the Dayle..."
24,"Re: Hmm, You Wouldn't Be the Dayle..."
25,"Sorry, & Thanks So Much for Answering Me <n"
26,"guys, need your music knowledge"
27,"Re: guys, need your music knowledge"
28,"Re: guys, need your music knowledge"
29,"Re: guys, need your music knowledge"
30,"Re: guys, need your music knowledge"
31,"Re: guys, need your music knowledge"
32,Harlan Cage
33,Don't know about Foriegner ...
34,harder than westcoast!
35,More to the edgier side of Survivor ...
36,Survivor had their edge!
37,Re: Survivor had their edge!
38,"As you might have guessed, I only own ..."
39,"Re: As you might have guessed, I only own ..."
40,Re: Harlan Cage
41,Re: More like early Survivor mixed with some Vital
42,Re: More like early Survivor mixed with some Vital
43,Re: Harlan Cage
44,hard rock on the radio?
45,Re: hard rock on the radio?
46,Guitarist seeks band -
47,spelyng
48,"Andrew, is Z's Bonfire really German?"
49,"Re: Andrew, is Z's Bonfire really German?"
50,"Re: Andrew, is Z's Bonfire really German?"
51,"Re: Andrew, is Z's Bonfire really German?"
52,Big opportunity for American Music scene!!
53,Re: Big opportunity for American Music scene!!
54,Re: Big opportunity for American Music scene!!
55,"Re: D2 Still Has a Chance, but Not With a Best Of."
56,That was then: This is now!
57,Preaching again I see
58,the youth of america
59,That was then: This is now!
60,Then how about...
61,FRR Your Stuck on Females. Give it a rest!
62,Re: FRR Your Stuck on Females. Give it a rest!
63,not too old...
64,Re: not too old...
65,Well I'm taking Geoff's title.
66,Re: not too old...
67,A followup
68,steel prophet info
69,Re: steel prophet info
70,None more black ..
71,Re: None more black ..
72,LOL
73,Re: LOL
74,Re: LOL
75,Phil Mogg / Tommy Shaw CD's
76,Re: Phil Mogg / Tommy Shaw CD's
77,Re: Phil Mogg / Tommy Shaw CD's
78,Re: Phil Mogg / Tommy Shaw CD's
79,Re: Phil Mogg CD
80,pieces of a dream uk band
81,Stereotypes of the hard rock listener.
82,Re: Stereotypes of the hard rock listener.
83,doesn't all genres have stereotypes?
84,Re: doesn't all genres have stereotypes?
85,Re: doesn't all genres have stereotypes?
86,Serious answer.
87,Re: Stereotypes of the hard rock listener.
88,"I know thiswasn't s'posed to be funny, Jack..."
89,GLAM STRIKES BACK
90,TOTO UPDATE
91,re: TOTO UPDATE
92,"Maybe it's my eyes, but..."
93,mine too... (n/p)
94,Dude....
95,Ah...
96,"Andrew, can we get the black back?"
97,"Re: Maybe it's my eyes, but..."
98,uk melodic rock
99,Anyone catch a St. James show?
100,Re: Anyone catch a St. James show?
101,Re: Anyone catch a St. James show?
102,Firehouse Category 5 question
103,Ummm. Yep
104,Re: Firehouse Category 5 question
105,Re: Firehouse Category 5 question
106,Re: Firehouse Category 5 question
107,Andrew W.K.
108,Re: Andrew W.K.
109,Re: Andrew W.K.
110,Re: Andrew W.K.
111,Stun Leer / Doug Howard?
112,Re: Stun Leer / Doug Howard?
113,Re: Stun Leer / Doug Howard?
114,Re: Stun Leer / Doug Howard?
115,"Don't expect ""Once"" twice..."
116,"Re: Don't expect ""Once"" twice..."
117,Howard's involvement in Stun Leer ...
118,z rock addition maybe
119,Yes
