id,title
0,Meanor Surname DNA Project
1,Holt Surname DNA Project
2,The Holman DNA Project
3,Holland Surname DNA Project
4,Balch Surname Y-DNA Project
5,The Hodges-Hodge DNA Project
6,Hobbs DNA Project
7,The Hinton DNA Project
8,Wohlfeil Surname DNA Project
9,Hinely-Heinle Surname DNA Project
10,O'Higgins-Higgins Project
11,The Heron DNA Project
12,Hensley DNA Project
13,The Heming DNA Project
14,The Hefner DNA Project
15,Isles of the Hebrides DNA Project
16,Head DNA Project
17,The Haworth-Howarth DNA Project
18,The Hatfield DNA Project
19,The HARTLEY DNA Project
20,The Hart DNA Project
21,The Harrison DNA Project
22,Harris Surname DNA Project
23,Harney Surname DNA Project
24,The Harlow DNA Project
25,Hagge-Hacht Surname DNA Project
26,Mitchum - Meacham
27,Flachbart Surname DNA Project
28,The Grady DNA Project
29,The Gounder DNA Project
30,The Gorman DNA Project
31,The Goodwin DNA Project
32,The Goble DNA Project
33,Gleason/Gleeson DNA Project
34,Britt Surname Project
35,The Gilpin Genealogy & DNA World Wide Project Research
36,The Gilley DNA Project
37,Gillenwater Surname DNA Project
38,"Giddens, Giddings, Geddings Surname DNA Project"
39,Graybeal / Graybill & Related Surnames DNA Project
40,Gerbig Surname DNA Project
41,The Geer DNA Project
42,Barkett Surname DNA Project
43,Hogan Surname
44,The Gaudet DNA Project
45,The Gaston DNA Project
46,The Garland/Gernon/Gartland yDNA Project
47,The Garcia DNA Project
48,The Gallion DNA Project
49,Hulcher/Holzschuh Surname DNA Project
50,Deis Surname Project
51,Frame DNA Project
52,Frain DNA Project
53,FA Surname DNA Project
54,The Fisk DNA Project
55,The Finlayson DNA Project
56,The Finkle DNA Project
57,The Fields DNA Project
58,The FANNING DNA Project
59,The Runciman DNA Project
60,Familton Surname DNA Project
61,Locey Surname DNA Project
62,McKeich Surname DNA Project
63,The Fairbairn DNA Project
64,Gnann Surname DNA Project
65,The Exley DNA Project
66,The Meagher Surname DNA Project
67,The Erbeck/Erbach/Ehrbach DNA Project
68,The Emo DNA Project
69,The EMERSON AMERSON AMASON DNA Project
70,Rayl Surname DNA Project
71,Eikemeier Surname DNA Project
72,Cockett-Cacket-Cakot-Surname DNA Project
73,Scholes Surname DNA Project
74,The Eaton DNA Project
75,The Durrett DNA Project
76,The Durie DNA Project
77,Durham Surname DNA Project
78,Durfee DNA Project
79,The Dunn DNA Project
80,The Dunbar DNA Project
81,DF100-CTS4528
82,The Drummond and Drum** DNA Project
83,Skinner Surname DNA Project
84,Southworth-Southard DNA Project
85,Buxton Surname DNA Project
86,Melrose Surname DNA Project
87,Steiert Surname Research Project
88,The Diaz DNA Project
89,Love Surname DNA Project
