id,title
0,BH Division Course Trend Data
1,Honors Student Enrollment in Honors Courses
2,Enrollment in CIS 15 for LC Selection
3,Concurrent Enrollment Survey -- CCCCO
4,Nursing (RN) Enrollment Projections for Grant
5,Message Therapy Program Enrollments
6,"Enrollment Update, Winter 2005"
7,OTI Enrollment Update Winter 2004
8,Tennis Enrollment Trend Winter 2003-04
9,Concurrent K-12 Enrollment
10,Tech Prep Enrollment 2003-04
11,"Census Enrollment Comparison, Fall 2003 to 2004"
12,Enrollment Comparison Methodology
13,OTI Enrollment and Demographics
14,Psychology Enrollment Trends
15,Summer Enrollment Trends
16,Older Adult Program Enrollment
17,Japanese F1 Enr 2004F
18,Highest Enrolled Courses 2003-04
19,"Courses with Enrollment Over 1,000 in 2003-04"
20,"Distance Learning Census Enrollment, Fall 2004"
21,Enrollment Summary for La Voz
22,Town Hall Enrollment Action Update
23,Enrollment in Paralegal
24,Enrollment in Science Programs
25,K-12 Student Enrollments 2004-05
26,Business Enr F1 Visa Holders
27,"De Anza Transfer Students Enrolled at SJSU, 2003-05"
28,Enrollment in Biology Courses
29,Enrollment Management Meeting Notes
30,End of Summer 2005 Enrollment Observations
31,"De Anza College Credit Courses Enrollment, 2004-05"
32,"Enrolled Courses before PSYCH1/SPCH10, Spring 05"
33,"CD 51 Enrollment Trends, 2002-05"
34,"Census Enrollment Trends, 2004-05"
35,"Concurrent EWRT/PHIL Course Enrollment, 2004-05"
36,"ESJ Students Enrolled at a Community College, 2002-04"
37,De Anza Majors Enrolled Census
38,"Enrollments in Distance Learning Report, 2003-05"
39,"English Course Enrollment, 2004-05"
40,"FHDA Transfer Students Enrolled at SJSU, 2003-05"
41,"DA BIOL/ES/ESCI Enrollment, 2003-06"
42,"De Anza Paralegal Program Enrollment, 2004-06"
43,New FHDA Transfer Students Enrolled at SJSU
44,DA Enrollment Fall 2005 & 2006 Census
45,LinC Concurrent Enrollment -- Math-EWRT-ES
46,Proposed Enrollment Planning Committee
47,Enrollment Planning Assumptions
48,De Anza Latino Student Enrollment Census
49,Foothill Network Security Program Enrollments
50,"Enrollment From East San Jose, Fall 2004-06"
51,"Opening Day Enrollment Summary, Winter 2007"
52,"High School Placement Testing Enrollment, Spring 06"
53,"CC Enrollment from ESJ, Fall 2004 and 2005"
54,"De Anza Enrollment Status by Age/Ethnicity, Fall 05"
55,"Enrollment, Winter 2006 to Winter 2007"
56,"Child Development Course, 2005F-2007W"
57,"Student Enrollment by Income Zip Code, Winter 2007"
58,"Percent Latino Enrollment by Zip Code, Winter 2007"
59,"Opening Day Enrollment, Spring 2007"
60,"New Student COUN100 Enrollments, Fall 2006"
61,"DA Paralegal Program Enrollments, 04-05 to 06-07"
62,"Census Enrollment Notes, Spring 2007"
63,"De Anza College CD51 Enrollment Trend, 1994-2007"
64,"Enrollment Note, Early Summer 2007"
65,"Estimated FTES Trend 2004-05, 2005-06, 2006-07"
66,"Distance Learning Enrollments, Summer 2007"
67,"FTES Trends by Division, 2006-07"
68,ARCC Success Indicators by Ethnicity
69,FTES estimates 2007-08 at Fall Census
70,Activity Class Enrollment Trends
71,"FTES Estimates, 2007-2008"
72,"Change in Continuing Students, 2007-08"
73,"Change in Continuing Latino Students, 2007-08"
74,ESL and International Student Enrollment
75,Fremont Union Concurrent Enrollment
76,De Anza College Paralegal Program Enrollments
77,"Census Enrollment, Spring 2008"
78,Distance Learning Enrollment by city
79,"SKIL and LRNA FTES, 2007-08"
80,Distance Learning Enrollment 2007-08
81,Distance Learning Enrollment Trends By Division
82,"Job Corps and Campus Enrollment, 2008-09"
83,Summer 2008 Enrollment Comparison to 2007M
84,"Course Enrollments by Ethnicity, Fall 2007"
85,"Math Enrollment Activity, 2008"
86,"Enrollment in PSME, 2007-08"
87,Enrollment by Santa Clara High School District
88,"DA Weekly census classes less than 20, 2005-06 to 2007-08"
89,Distance Learning Program Review Data
90,Enrollment in AUTO courses by City of Residence
91,Demographics of Disabled Students Served Fall 2007
92,Paralegal Program Enrollments 2008-2009
93,Distance Learning Enrollment Spring 2009
94,High School Enrollment FHDA 2007-08
95,High School Enrollment FHDA 2008-09
96,Targeted Population Enrollment Trends 2005F-2008F
97,COUN100 Enrollments Summer 2009
98,"COOP Enrollment, Unit persistence Financial Aid, F09-S10"
99,"GE for Degree Requirements Area A-E, 2005-06 to 2009-10"
100,"Transfer Area (IGETC) 1-6, 2005-06 to 2009-10"
101,"Transfer Requirements for CSU A-E, 2005-06 to 2009-10"
102,"Seat Count Enrollment Revised, 2008M to 2011W"
103,"Early Registrants Compared to Late Registrants, Fall 2010"
104,"DA Foster Youth, Fall 10 - Spring 11"
105,DA Full and Part-Time Enrollment 2010-2011
106,"Distance Education Enrollment Comparison, 2009-10 to 2010-11"
107,"Year to Year Enrollment Report Estimated WSCH, 2010F-2011F"
108,FTES Estimates 2010-11 to 2011-12
109,Section Enrollment by Division 2006-07 to 2010-11
110,Detailed Section Enrollment 2006-07 to 2010-11
111,"Top 20 Courses with BIOL11, Summer 2011 to Spring 2012"
112,"Census Enrollment Comparisons Report, Spring 2011 and 2012"
113,"Top 15 Courses with ESL5, Summer 2011 to Spring 2012"
114,"Top 20 Courses with ECON001, Summer 2011 to Spring 2012"
