id,title
0,Appliance mounting device
1,Multi-position articulating mounting apparatus for an electronic device
2,Tilt and swivel adjustment of flat panel display having detents for landscape and portrait positions and kickout for preventing contact between flat panel display and base
3,Self-balancing mounting system for a flat panel display
4,Base capable of adjusting the elevation of a panel
5,Multi-position articulating mounting apparatus for an electronic device
6,Brake mechanism for controlling the tilt of a computer display
7,Multi-position articulating mounting apparatus for an electronic device
8,Display apparatus
9,Computer display system with manual fail-safe back-up
10,"Adjustable, self-balancing flat panel display mounting system"
11,Mounting device for a flat screen display panel
12,Monitor support system
13,Stand
14,Friction cylinder for a support device
15,Self-balancing adjustable flat panel mounting system
16,Methods and apparatus for generating force and torque
17,Radial arm system for patient care equipment
18,Adjustable tilt mount
19,Display apparatus
20,Tilting apparatus of monitor
21,Adjustable tilt mount
22,Stand for display
23,Display apparatus
24,Support arm
25,Radial arm system for patient care equipment
26,Stand for supporting a monitor main body
27,Mounting device for a flat screen display panel
28,Fixture for a display unit
29,Multi-position articulating mounting apparatus for an electronic device
30,Self-balancing adjustable mounting system with friction adjustment
31,Self-balancing adjustable flat panel mounting system
32,Display apparatus
33,"Adjustable, self-balancing flat panel display mounting system"
34,Display apparatus
35,Adjustable tilt mount
36,Methods and apparatus for generating force and torque
37,Monitor improved in a tilting and combining structure
38,Extension arm with moving clevis and cable management
39,Monitor
40,Monitor having a moving member counterbalancing weight of display
41,Adjustable lift support apparatus
42,Monitor improved in a tilting and combining structure
43,Display apparatus
44,Mounting device for a flat screen display panel
45,Tilt mounting system
46,Fixture for display unit for allowing displayed image to be seen with ease even upon vibrating
47,Flat panel display mounting system
48,Extension arm with moving clevis
49,Tilt mounting system
50,Articulating arm for flat panel display
51,Monitor improved in a tilting and combining structure
52,Display mount with post-installation adjustment features
53,Self-balancing adjustable flat panel mounting system
54,In-wall mount
55,Adjustable tilt mounting system
56,Radial arm system for patient care equipment
57,Adjustable self-balancing flat panel display mounting system
58,Quick mounting device with modules
59,Vertical motion pendant arm
60,Mounting device for a flat screen display panel
61,Device mount with selectively positionable tilt axis
62,Wall-avoiding self-balancing mount for tilt positioning of a flat panel electronic display
63,Tilt mounting system
64,Quick mounting device with modules
65,Media device mounting system
66,Balanced moment lift system and method
67,Quick mounting device
68,Adjustable tilt mount
69,Lift mechanism systems and methods
70,Tilt mounting system
71,Quick mounting device with modules
72,"Adjustable, self-balancing flat panel display mounting system"
73,Wall-avoiding self-balancing mount for tilt positioning of a flat panel electronic display
74,Positioning and damper device using shear force from cyclic differential compressive strain of a cross-linked thermoplastic
75,Work station with height adjustment lock
76,Keyboard tray tilt
77,Mobile technology cabinet
78,Technology cart
79,Tilt mounting system
80,Universal angle loudspeaker bracket
81,Wall work station
82,Pivot mechanism for adjusting a position of an electronic display
83,Display mount with post-installation adjustment features
84,Circumferential strain rotary detent
85,Dual bar linkage monitor support with adustment feature
86,Angle inclining structure for a desk
87,Display apparatus
88,Display apparatus
89,Monitor
90,System and method of mounting a display screen via a pendulum type mount
91,Monitor improved in a tilting and combining structure
92,Display apparatus
93,Adjustable tilt mount
94,Lift mechanism based on torque equalization principles
95,Flat screen monitor support system
96,Monitor
97,Mechanisms based on torque equalization principles
98,Fueldraulic Actuator Installation and Removal Tool
99,Angle Inclining Structure for a Desk
100,Articulating arm for flat panel display
