id,title
0,"Jaxon Kennel Club, Inc."
1,Del Valle Dog Club Of Livermore
2,Nashville Kennel Club
3,Lebanon County Kennel Club
4,"Steel City Kennel Club, Inc."
5,"Progressive Dog Club Of Wayne County, Inc."
6,Cambridge Minnesota Kennel Club
7,Spokane Kennel Club
8,"Framingham District Kennel Club, Inc."
9,Little Fort Kennel Club Of Waukegan
10,"Coulee Kennel Club, Inc."
11,Wisconsin Rapids Kennel Club
12,"Lake Shore Kennel Club, Inc."
13,Eastern Kentucky Kennel Club
14,"Sheboygan Kennel Club, Inc."
15,Delaware Water Gap Kennel Club
16,"Cincinnati Kennel Club, Inc."
17,Stone City Kennel Club
18,"Blackhawk Kennel Club, Inc."
19,"Pioneer Valley Kennel Club, Inc."
20,"Louisiana Kennel Club, Inc."
21,"Bloomington Indiana Kennel Club, Inc."
22,San Luis Obispo Kennel Club
23,"Mid-continent Kennel Club Of Tulsa, Inc."
24,"International Kennel Club Of Chicago, Inc."
25,"Twin Brooks Kennel Club, Inc."
26,"Western Pennsylvania Kennel Association, Inc."
27,"Wilmington Kennel Club, Inc."
28,"Scott County Kennel Club, Inc."
29,Mississippi Valley Kennel Club
30,"Puyallup Valley Dog Fanciers, Inc."
31,"Kennel Club Of Buffalo, Inc."
32,Berrien Kennel Club
33,"Santa Barbara Kennel Club, Inc."
34,Spirit Of The Heartland Kennel Club
35,"St. Joseph Kennel Club, Inc."
36,Dubuque Kennel Club
37,Cambridge Minnesota Kennel Club
38,Southern Indiana Kennel Club
39,Mckinley Kennel Club
40,Greater Clark County Kennel Club Inc
41,"Sugarbush Kennel Club, Inc."
42,"Oshkosh Kennel Club, Inc."
43,Newnan Kennel Club
44,Edwardsville Illinois Kennel Club
45,"Blackhawk Kennel Club, Inc."
46,"Sequoia Kennel Club, Inc."
47,"Greater Emporia Kennel Club, Inc."
48,Coyote Hills Kennel Club
49,Champaign Illinois Kennel Club
50,"Northwestern Connecticut Dog Club, Inc."
51,"Illinois Capitol Kennel Club, Inc."
52,"Minneapolis Kennel Club, Inc."
53,"Central New York Kennel Club, Inc."
54,Sahuaro State Kennel Club
55,Long Beach Kennel Club
56,"Houston Kennel Club, Inc."
57,"Steel City Kennel Club, Inc."
58,"Springfield Kennel Club, Inc."
59,"Key City Kennel Club, Inc."
60,"Kishwaukee Kennel Club, Inc."
61,"Topeka Kennel Club, Inc."
62,Hawaiian Kennel Club
63,"South Shore Kennel Club, Inc."
64,"Texas Kennel Club, Inc."
65,Worcester County Kennel Club
66,"Logansport Kennel Club, Inc."
67,Camellia Capital Kennel Club
68,"Butler County Kennel Club, Inc."
69,Chain O'lakes Kennel Club
70,"Wallkill Kennel Club, Inc."
71,"National Capital Kennel Club, Inc."
72,"Del Monte Kennel Club, Inc."
73,"Mahoning-shenango Kennel Club, Inc."
74,"Penn Ridge Kennel Club, Inc."
75,Greater Racine Kennel Club
76,"Pontiac Kennel Club, Inc."
77,Greater Humble Area Kennel Club
78,"Gloucester County Kennel Club, Inc."
79,"Ladies' Dog Club, Inc."
80,Oakland Kennel Club
81,"Manatee Kennel Club, Inc."
82,Canada Del Oro Kennel Club
83,"Finger Lakes Kennel Club, Inc."
84,St. Clairsville Ohio Kennel Club
85,"Framingham District Kennel Club, Inc."
86,"Contra Costa County Kennel Club, Inc."
87,"Central Florida Kennel Club, Inc."
88,"Sioux Valley Kennel Club, Inc."
89,"Blackhawk Kennel Club, Inc."
90,"Rochester Minnesota Kennel Club, Inc."
91,"St. Louis Dog Breeders Association, Inc."
92,Valencia Valley Kennel Club Of New Mexico
93,San Luis Obispo Kennel Club
94,"Lorain County Kennel Club, Inc."
95,Kennel Club Of Salinas
96,"Central Iowa Kennel Club, Inc."
97,Plum Creek Kennel Club Of Colorado
98,Dubuque Kennel Club
99,Sacramento Kennel Club
100,North Arkansas Kennel Club
101,Mid-atlantic Hound Association Of Central North Carolina
102,"Winnegamie Dog Club, Inc."
103,"Fargo-moorhead Kennel Club, Inc."
104,"Louisiana Kennel Club, Inc."
105,Champaign Illinois Kennel Club
106,Jupiter-tequesta Dog Club
107,"Richland County Kennel Club, Inc."
108,"Longview-kelso Kennel Club, Inc."
109,Douglasville Kennel Club Of Georgia
110,"Santa Cruz Kennel Club, Inc."
111,"Packerland Kennel Club, Inc."
112,Tullahoma Kennel Club Of Tennessee
113,"Fort Lauderdale Dog Club, Inc."
114,"Columbia Kennel Club, Inc."
115,Mississippi Valley Kennel Club
116,"Greeley Kennel Club, Inc."
117,Salisbury North Carolina Kennel Club
118,Douglasville Kennel Club Of Georgia
119,"Kanadasaga Kennel Club, Inc."
120,Wine Country Kennel Club
121,Tucson Kennel Club
122,Kankakee River Valley Kennel Club
123,Trinity Valley Kennel Club
124,"Land O' Lakes Kennel Club, Inc."
125,"Belle-city Kennel Club, Inc."
126,Tanana Valley Kennel Club
127,"Klamath Dog Fanciers, Inc."
128,Kokomo Kennel Club
129,Flatirons Kennel Club
130,"Richmond Dog Fanciers Club, Inc."
131,"Danville Illinois Kennel Club, Inc."
132,"Pocono Mountain Kennel Club, Inc."
133,Edwardsville Illinois Kennel Club
134,Greater Clark County Kennel Club Inc
135,"Mississippi State Kennel Club, Inc."
136,Columbiana County Kennel Club
137,"Central Iowa Kennel Club, Inc."
138,"Salina Kennel Club, Inc."
139,"Steel City Kennel Club, Inc."
140,"Trenton Kennel Club, Inc."
141,Wyoming Valley Kennel Club
142,"Mid-continent Kennel Club Of Tulsa, Inc."
143,"Toledo Kennel Club, Inc. (BREED & AM OBED)"
144,Kennel Club Of Beverly Hills
145,"Holyoke Kennel Club, Inc."
146,Greater Racine Kennel Club
147,"Mensona Kennel Club, Inc."
148,Moore County Kennel Club Of North Carolina
149,Grand Valley Kennel Club
150,Westminster Kennel Club
151,Durham Kennel Club Inc
152,"Finger Lakes Kennel Club, Inc."
153,"Kennel Club Of Yorkville, Illinois"
154,Northeast Oklahoma Kennel Club
155,"Shreveport Kennel Club, Inc."
156,"Progressive Dog Club Of Wayne County, Inc."
157,"Antelope Valley Kennel Club, Inc."
158,Shasta Kennel Club
159,"Paducah Kennel Club, Inc."
160,Echo Hills Kennel Club Of Ohio
161,"Bexar County Kennel Club, Inc."
162,Southeastern Iowa Kennel Club
163,"Topeka Kennel Club, Inc."
164,"Longview-kelso Kennel Club, Inc."
165,"Panhandle Kennel Club Of Texas, Inc."
166,"Platte Valley Kennel Club Of Fremont, Nebraska"
167,"Illinois Capitol Kennel Club, Inc."
168,"Tri-state Kennel Club, Inc."
169,Decatur Alabama Kennel Club
170,Seminole Dog Fanciers Association
171,Worcester County Kennel Club
172,"Land O' Lakes Kennel Club, Inc."
173,Greater Fredericksburg Kennel Club
174,"Oakland County Kennel Club, Inc. (BREED & OBED #1)"
175,Chain O'lakes Kennel Club
176,Lakeland Winter Haven Kennel Club
177,"Belle-city Kennel Club, Inc."
178,"Valdosta Kennel Club, Inc."
179,Heart Of Iowa Kennel Club
180,Ravenna Kennel Club
181,"Abilene Kennel Club, Inc."
182,"Mid-continent Kennel Club Of Tulsa, Inc."
183,Southern Indiana Kennel Club
184,Fort Dodge Kennel Club
185,"Roanoke Kennel Club, Inc."
186,"Arkansas Kennel Club, Inc."
187,"Wachusett Kennel Club, Inc."
188,"Sugarbush Kennel Club, Inc."
189,"St. Louis Dog Breeders Association, Inc."
190,Mississippi State Kennel Club
191,Gig Harbor Kennel Club
192,Rockford-freeport Illinois Kennel Club
193,"Albany Kennel Club, Inc."
194,Greater Muskegon Kennel Club
195,"Central Iowa Kennel Club, Inc."
196,"Hoosier Kennel Club, Inc."
197,"Kern County Kennel Club, Inc."
198,"Austin Kennel Club, Inc."
199,Walla Walla Kennel Club
200,Macon Kennel Club
201,Shasta Kennel Club
202,"Calcasieu Kennel Club, Inc."
203,Little Fort Kennel Club Of Waukegan
204,"Holyoke Kennel Club, Inc."
205,Duluth Kennel Club
206,"Beaver County Kennel Club, Inc."
207,"Cedar Rapids Kennel Association, Inc."
208,"National Capital Kennel Club, Inc."
209,Savannah Kennel Club
210,"Tualatin Kennel Club, Inc."
211,"International Kennel Club Of Chicago, Inc."
212,"Fayetteville Kennel Club, Inc."
213,"Terre Haute Kennel Club, Inc."
214,Indianhead Kennel Club
215,"Mid-continent Kennel Club Of Tulsa, Inc."
216,"Ladies' Dog Club, Inc."
217,Eagle Rock Kennel Club
218,Cambridge Minnesota Kennel Club
219,"Kishwaukee Kennel Club, Inc."
220,Chambersburg Area Kennel Club
221,Cook Inlet Kennel Club
222,"Metairie Kennel Club, Inc."
