id,title
0,Co Springs Kc
1,Jefferson City Mo Kc
2,St Joseph Kc
3,San Antonio Kc
4,Upper Marlboro Kc
5,"Texas Kennel Club, Inc."
6,Rio Pecos Kennel Club
7,Badger Kennel Club
8,"Greater Emporia Kennel Club, Inc."
9,"Acadiana Kennel Club, Inc."
10,"Santa Maria Kennel Club, Inc."
11,Conyers Kennel Club Of Georgia
12,"Toledo Kennel Club, Inc."
13,Mississippi Valley Kennel Club
14,"Idaho Capital City Kennel Club, Inc."
15,"Meri-miss Kennel Club, Inc."
16,"Blackhawk Kennel Club, Inc."
17,"Pontiac Kennel Club, Inc."
18,Leavenworth Kennel Club
19,Tennessee Valley Kennel Club
20,"Minneapolis Kennel Club, Inc."
21,Kenai Kennel Club Inc.
22,"Austin Kennel Club, Inc."
23,Nebraska Kennel Club Inc
24,Michiana Kennel Club
25,"Roaring Fork Kennel Club, Inc."
26,Tioga County Kennel Club
27,"Louisiana Kennel Club, Inc."
28,West Oahu Kennel Club
29,Hobbs New Mexico Kennel Club
30,Plum Creek Kennel Club Of Colorado
31,Tullahoma Kennel Club Of Tennessee
32,"Galveston County Kennel Club, Inc."
33,Rio Hondo Kennel Club
34,Colorado Springs Kennel Club
35,"Wachusett Kennel Club, Inc."
36,"Finger Lakes Kennel Club, Inc."
37,"Lawrence Jayhawk Kennel Club, Inc."
38,"Rapid City Kennel Club, Inc."
39,"Tri-state Kennel Club, Inc."
40,Alexandria Kennel Club
41,"Keomah Kennel Club, Inc."
42,Garden City Kansas Kennel Club
43,San Jacinto Kennel Club
44,Utah Valley Kennel Club
45,Del-otse-nango Kennel Club
46,Helena Montana Kennel Club
47,Mason City Kennel Club
48,"Northwest Arkansas Kennel Club, Inc."
49,Lost Dutchman Kennel Club
50,Coso Dog Fanciers Of California
51,Long Beach Kennel Club
52,"Jupiter-tequesta Dog Club, Inc."
53,Longview Kennel Club
54,Cheyenne Kennel Club
55,"Lehigh Valley Kennel Club, Inc."
56,Wright County Minnesota Kennel Club
57,"Battle Creek Kennel Club, Inc."
58,Edwardsville Illinois Kennel Club
59,"Pioneer Valley Kennel Club, Inc."
60,Prescott Arizona Kennel Club
61,Fun-tier Kennel Club Of Greater Killeen
62,San Joaquin Kennel Club
63,"Mississippi State Kennel Club, Inc."
64,Fond Du Lac County Kennel Club
65,"Crab Orchard Kennel Club, Inc."
66,Sedalia Kennel Club
67,"Cyclone Country Kennel Club Of Ames, Inc."
68,"Mesilla Valley Kennel Club, Inc."
69,"Idaho Capital City Kennel Club, Inc."
70,"Panhandle Kennel Club Of Texas, Inc."
71,Ventura County Dog Fanciers Association
72,Sawnee Mountain Kennel Club Of Georgia
73,Guadalupe Valley Dog Fanciers
74,Northeast Oklahoma Kennel Club
75,"Beaumont Kennel Club, Inc."
76,"Central Wyoming Kennel Club, Inc."
77,"St. Croix Valley Kennel Club, Inc."
78,Conroe Kennel Club
79,Ashtabula Kennel Club
80,Heart Of Iowa Kennel Club
81,Badger Kennel Club
82,Coyote Hills Kennel Club
83,Greater Racine Kennel Club
84,Redwood Empire Kennel Club
85,"Cape Cod Kennel Club, Inc."
86,"Illinois Capitol Kennel Club, Inc."
87,Travis County Kennel Club
88,"Mid-continent Kennel Club Of Tulsa, Inc."
89,Hobbs New Mexico Kennel Club
90,"American Chesapeake Club, Inc."
91,Lawton Dog Fanciers Association
92,"Ozarks Kennel Club, Inc."
93,Council Bluffs Kennel Club
94,"Manatee Kennel Club, Inc."
95,"Orchid Island Dog Fancier Club, Inc."
96,Clinton Iowa Kennel Club
97,Greater Orange Park Dog Club
98,"Baytown Kennel Club, Inc."
99,Arizona White Mountain Kennel Club
100,York County Kennel Club Of Maine
101,"Laramie Kennel Club, Inc."
102,Michiana Kennel Club
103,"Bald Eagle Kennel Club Of Williamsport, Pa., Inc."
104,Jesse James Kennel Club
105,"Northern Kentucky Kennel Club, Inc."
106,Rio Pecos Kennel Club
107,Kankakee River Valley Kennel Club
108,"Orange Empire Dog Club, Inc."
109,"Kennel Club Of Greater Victoria, Inc."
110,Claremore Kennel Club Of Oklahoma
111,Champaign Illinois Kennel Club
112,Riverside West Kennel Club Of Greater New Orleans
113,Five Valley Kennel Club
114,Cook Inlet Kennel Club
115,Schooley's Mountain Kennel Club
116,"Greater Murfreesboro Kennel Club, Inc."
117,"Lawrence Jayhawk Kennel Club, Inc."
118,"Albany Kennel Club, Inc."
119,"Sioux Empire Kennel Club, Inc."
120,"Lorain County Kennel Club, Inc."
121,Greater Panama City Dog Fanciers Association
122,Oakland Kennel Club
123,"Salina Kennel Club, Inc."
124,"Yakima Valley Kennel Club, Inc."
125,Greater Racine Kennel Club
126,"Cedar Rapids Kennel Association, Inc."
127,Bonneville Basin Kennel Association
128,"Valley Forge Kennel Club, Inc."
129,"Tri-star Kennel Club Of williamson County, Tennessee"
130,Greater Sierra Vista Kennel Club
131,"Baytown Kennel Club, Inc."
132,Abilene Kennel Club
133,"Calcasieu Kennel Club, Inc."
134,Lost Coast Kennel Club Of California
135,"Kenilworth Kennel Club Of Connecticut, Inc."
136,Timberland Valley Dog Fanciers Association
137,New River Valley Kennel Club
138,"Glens Falls Kennel Club, Inc."
139,"St. Croix Valley Kennel Club, Inc."
140,Vicksburg Kennel Club Of Mississippi
141,Prescott Arizona Kennel Club
142,Grand Valley Kennel Club
143,"Chaparral Kennel Club, Inc."
144,"Sioux Empire Kennel Club, Inc."
145,"Pontiac Kennel Club, Inc."
146,"Los Encinos Kennel Club, Inc."
147,Griffin Georgia Kennel Club
148,Plum Creek Kennel Club Of Colorado
149,Tanana Valley Kennel Club
150,D'arbonne Kennel Club
151,"Mid-continent Kennel Club Of Tulsa, Inc."
152,Butte County Kennel Club
153,"Pocatello Kennel Club, Inc."
154,"Tidewater Kennel Club Of Virginia, Inc."
155,"Bexar County Kennel Club, Inc."
156,Burlington Wisconsin Kennel Club
157,Rolla Missouri Kennel Club
158,Hobbs New Mexico Kennel Club
159,"Ochlockonee River Kennel Club Of Florida, Inc."
160,"Kern County Kennel Club, Inc."
161,"Baytown Kennel Club, Inc."
162,Long Island Kennel Club
163,Kennel Club Of The California Sierra
164,Eagle Rock Kennel Club
165,Holland Michigan Kennel Club
