id,title
0,Grtr Sierra Vista Kc
1,Soern Co Kc
2,Manatee Kc
3,West Oahu Kc
4,Scottsbluff Kc
5,Newton Kc
6,Mt. Ogden Kc
7,Eugene Kc
8,Fargo-moorhead Kc
9,Berrien Kc
10,Chenango Vly Kc
11,Waukesha Kc
12,Olympic Kc
13,Prescott Az Kc
14,Ann Arbor Kc
15,Thronateeska Kc
16,Sioux Empire Kc
17,Kalamazoo Kc
18,Eastern Dc
19,Nolan River Kc
20,Grtr Orange Park Dc
21,Garden City Ks Kc
22,Ozarks Kc
23,Rogue Vly Kc
24,So Hills Kc
25,Mohawk Vly Kc
26,Coso Dog Fanciers Of California
27,Rock Creek Kennel Club
28,"Genesee County Kennel Club, Inc."
29,"Key City Kennel Club, Inc."
30,"Asheville Kennel Club, Inc."
31,Coos Kennel Club
32,"Buckhorn Valley Kennel Club, Inc."
33,Hawaiian Kennel Club
34,"Butler County Kennel Club, Inc."
35,Singing River Kennel Club Of Mississippi
36,"Chaparral Kennel Club, Inc."
37,Westminster Kennel Club
38,Timberland Valley Dog Fanciers Association
39,"Heart Of America Kennel Club, Inc."
40,"Raleigh Kennel Club, Inc."
41,Bee-tex Kennel Club
42,Big Spring Kennel Club
43,"Del Sur Kennel Club, Inc."
44,Greater Hattiesburg Kennel Club
45,"Shreveport Kennel Club, Inc."
46,Gallatin Dog Club
47,Chenango Valley Kennel Club
48,"Platte Valley Kennel Club Of Fremont, Nebraska"
49,Golden Gate Kennel Club
50,"Hoosier Kennel Club, Inc."
51,Tullahoma Kennel Club Of Tennessee
52,Detroit Kennel Club
53,"Peninsula Dog Fanciers Club, Inc."
54,Silver State Kennel Club
55,Clarksville Kennel Club
56,"Denton Kennel Club, Inc."
57,Tanana Valley Kennel Club
58,"Fargo-moorhead Kennel Club, Inc."
59,Yellowstone Valley Kennel Club
60,Yorkshire Terrier Club Of Greater Houston
61,Elkhorn Kennel Club
62,Rocky Mountain Yorkshire Terrier Club
63,Leavenworth Kennel Club
64,"Kennel Club Of Columbus, Indiana"
65,Warrenton Kennel Club
66,Sturgis Kennel Club
67,"Kennel Club Of Philadelphia, Inc."
68,Imperial Valley Kennel Club
69,"Merrimack Valley Kennel Club, Inc."
70,Columbia Missouri Kennel Club
71,"Palouse Hills Dog Fanciers, Inc."
72,"Cornhusker Kennel Club Of Lincoln, Nebraska, Inc."
73,Rio Grande Kennel Club
74,Baton Rouge Kennel Club
75,Shasta Kennel Club
76,"Mahoning-shenango Kennel Club, Inc."
77,"Vicksburg Kennel Club Of Mississippi, Inc."
78,Sandusky Kennel Club
79,San Fernando Kennel Club
80,Fort Worth Kennel Club
81,"St. Petersburg Dog Fanciers Association, Inc."
82,Kennel Club Of Pasadena
83,"Roaring Fork Kennel Club, Inc."
84,Leavenworth Kennel Club
85,"Donner Trail Kennel Club, Inc."
86,Sturgis Kennel Club
87,Anniston Kennel Club
88,"Sara Bay Kennel Club, Inc."
89,Hobbs New Mexico Kennel Club
90,"Piedmont Kennel Club, Inc."
91,Stephenville Kennel Club Of Texas
92,Yorkshire Terrier Club Of Los Angeles
93,Greenwich Kennel Club
94,Valparaiso Kennel Club
95,Greater Clark County Kennel Club Inc
96,"Evansville Kennel Club, Inc."
97,"Spartanburg Kennel Club, Inc."
98,"Elmira Kennel Club, Inc."
99,Tropical Toy Dog Fanciers Of Hawaii
100,Lawton Dog Fanciers Association 'fka' Lawton-fort Sill Kc
101,Decatur Alabama Kennel Club
102,Comal County Kennel Club
103,Plum Creek Kennel Club Of Colorado
104,Kings Kennel Club Of California
105,"Beaumont Kennel Club, Inc."
106,"Muskogee Kennel Club, Inc."
107,Metro Mile Hi Kennel Club
108,"Contra Costa County Kennel Club, Inc."
109,"Umpqua Kennel Club, Inc."
110,Greater Clark County Kennel Club Inc
111,Yorkshire Terrier Club Of Greater Houston
112,Southeast Alabama Kennel Club
113,"Sir Francis Drake Kennel Club, Inc"
114,"Bloomington Indiana Kennel Club, Inc."
115,New Mexico Toy Group Club
116,"Marion Kennel Club, Inc."
117,Council Bluffs Kennel Club
118,"Greater Hickory Kennel Club, Inc."
119,Brandon Kennel Club Of Mississippi
120,"Sara Bay Kennel Club, Inc."
121,Ephrata-moses Lake Kennel Club
122,"Mensona Kennel Club, Inc."
123,"Battle Creek Kennel Club, Inc."
124,Mckinley Kennel Club
125,Bryn Mawr Kennel Club
126,"Salina Kennel Club, Inc."
127,Helena Montana Kennel Club
128,"Columbia Kennel Club, Inc."
129,Toy Dog Club Of Puget Sound
130,Caribe Kennel Club
131,Edwardsville Illinois Kennel Club
132,"Clovis Portales Kennel Club, Inc."
133,"Greater Daytona Dog Fanciers Association, Inc."
134,"Calcasieu Kennel Club, Inc."
135,"Arkansas Kennel Club, Inc."
136,Greater Racine Kennel Club
137,Bluebonnet Yorkshire Terrier Club
138,La Porte County Kennel Club
139,Wine Country Kennel Club
140,"Clovis Portales Kennel Club, Inc."
141,Kenai Kennel Club Inc.
142,"Orchid Island Dog Fancier Club, Inc."
143,Silver Bay Kennel Club Of San Diego
144,Detroit Kennel Club
145,"New Brunswick Kennel Club, Inc."
146,Olympia Dog Fanciers Association
147,Jackson Tennessee Dog Fanciers Association
148,"Mid-del-tinker Kennel Club, Inc."
149,"Penn Ridge Kennel Club, Inc."
150,"Tonawanda Valley Kennel Club, Inc."
151,Bonneville Basin Kennel Association
152,Greater Atlanta Toy Dog Association
153,Decatur Alabama Kennel Club
154,"Greater Naples Dog Club, Inc."
155,Delaware Water Gap Kennel Club
156,"Yorkshire Terrier Club Of America, Inc."
157,Guadalupe Valley Dog Fanciers
158,Kings Kennel Club Of California
159,Columbia Missouri Kennel Club
160,"Fayetteville Kennel Club, Inc."
161,"St. Petersburg Dog Fanciers Association, Inc."
162,Crawford County Kennel Club
163,"Windham County Kennel Club, Inc."
164,"Laramie Kennel Club, Inc."
165,"Kettle Moraine Kennel Club, Inc."
166,Lexington Kennel Club Inc
167,Grand Valley Kennel Club
168,South Dade Kennel Club
169,West Texas Kennel Club
170,Silver State Kennel Club
171,"Steel City Kennel Club, Inc."
172,Spokane Kennel Club
173,Flatirons Kennel Club
174,Fort Dodge Kennel Club
175,Yellowstone Valley Kennel Club
176,"Sir Francis Drake Kennel Club, Inc"
177,"Kennel Club Of Columbus, Indiana"
178,Tyler Texas Kennel Club
179,Eastern Dog Club
180,Clearwater Kennel Club
181,Greater Hattiesburg Kennel Club
182,"Piedmont Kennel Club, Inc."
183,Utah Valley Kennel Club
184,"Denton Kennel Club, Inc."
185,Classic Toy Dog Club Of Western Massachusetts
186,Grand Traverse Kennel Club
187,Mount Bachelor Kennel Club
188,"Sugarbush Kennel Club, Inc."
189,"Panhandle Kennel Club Of Texas, Inc."
190,Wright County Minnesota Kennel Club
191,"Tri-star Kennel Club Of williamson County, Tennessee"
192,Delaware Ohio Kennel Club
193,Tacoma Kennel Club
194,Livonia Kennel Club
195,Yorkshire Terrier Club Of Greater New York
196,Hawaiian Kennel Club
197,"Hutchinson Kennel Club, Inc."
198,"Terry-all Kennel Club, Inc."
199,Ponce Kennel Club
200,Grand Rapids Kennel Club
201,Snake River Canyon Kennel Club Of Idaho
202,Lost Coast Kennel Club Of California
203,"Metairie Kennel Club, Inc."
204,Jesse James Kennel Club
205,"Cabrillo Kennel Club, Inc."
206,"South Shore Kennel Club, Inc."
207,Black Mountain Kennel Club Of Nevada
208,"Brazoria Kennel Club, Inc."
209,"International Kennel Club Of Chicago, Inc."
210,"Louisville Kennel Club, Inc."
211,Yosemite Kennel Club
212,"Cincinnati Kennel Club, Inc."
213,"Southern Maryland Kennel Club, Inc."
214,Toy Dog Breeders Association Of Southern California
215,Nolan River Kennel Club
216,"Central Iowa Kennel Club, Inc."
217,"Sun Maid Kennel Club Of Fresno, Inc."
218,"Hoosier Kennel Club, Inc."
219,First Company Governor's Foot Guard Athletic Association
220,"Sequoia Kennel Club, Inc."
221,"Heart Of America Kennel Club, Inc."
222,Walla Walla Kennel Club
223,"Mount Ogden Kennel Club, Inc."
224,Electric City Kennel Club
225,La Porte County Kennel Club
226,"Kennel Club Of Columbus, Indiana"
227,Grand Valley Kennel Club
228,"Palisades Kennel Club, Inc."
229,Wine Country Kennel Club
230,Imperial Valley Kennel Club
231,Kings Kennel Club Of California
232,"Wichita Kennel Club, Inc."
233,Ponce Kennel Club
234,"Central Wyoming Kennel Club, Inc."
235,Mississippi Valley Kennel Club
236,"Farmington Valley Kennel Club, Inc."
237,"Hurricane Ridge Kennel Club Of Washington, Inc."
