id,title
0,Pioneer AMT-Free Municipal Fund A
1,Pioneer AMT-Free Municipal Fund B
2,Pioneer AMT-Free Municipal Fund C
3,Pioneer AMT-Free Municipal Fund Y
4,Pioneer Bond Fund A
5,Pioneer Bond Fund B
6,Pioneer Bond Fund C
7,Pioneer Bond Fund K
8,Pioneer Bond Fund R
9,Pioneer Bond Fund Y
10,Pioneer Bond Fund Z
11,Pioneer Bond VCT Portfolio Class I
12,Pioneer Bond VCT Portfolio Class II
13,Pioneer Cash Reserves Fund A²
14,Pioneer Cash Reserves Fund Y²
15,Pioneer Classic Balanced Fund A
16,Pioneer Classic Balanced Fund B
17,Pioneer Classic Balanced Fund C
18,Pioneer Classic Balanced Fund Y
19,Pioneer Core Equity Fund A
20,Pioneer Core Equity Fund Y
21,Pioneer Disciplined Growth Fund A
22,Pioneer Disciplined Growth Fund Y
23,Pioneer Disciplined Value Fund A
24,Pioneer Disciplined Value Fund B
25,Pioneer Disciplined Value Fund C
26,Pioneer Disciplined Value Fund R
27,Pioneer Disciplined Value Fund Y
28,Pioneer Disciplined Value Fund Z
29,Pioneer Diversified High Income Trust (Closed End)
30,Pioneer Dynamic Credit Fund A3
31,Pioneer Dynamic Credit Fund C3
32,Pioneer Dynamic Credit Fund Y3
33,Pioneer Dynamic Credit Fund Z3
34,Pioneer Emerging Markets Fund A
35,Pioneer Emerging Markets Fund R
36,Pioneer Emerging Markets Fund Y
37,Pioneer Emerging Markets Local Currency Debt Fund A
38,Pioneer Emerging Markets Local Currency Debt Fund C
39,Pioneer Emerging Markets Local Currency Debt Fund Y
40,Pioneer Equity Income Fund A
41,Pioneer Equity Income Fund B
42,Pioneer Equity Income Fund C
43,Pioneer Equity Income Fund K
44,Pioneer Equity Income Fund R
45,Pioneer Equity Income Fund Y
46,Pioneer Equity Income Fund Z
47,Pioneer Equity Income VCT Portfolio Class I
48,Pioneer Equity Income VCT Portfolio Class II
49,Pioneer Floating Rate Fund A
50,Pioneer Floating Rate Fund C
51,Pioneer Floating Rate Fund K
52,Pioneer Floating Rate Fund Y
53,Pioneer Floating Rate Fund Z
54,Pioneer Floating Rate Trust (Closed End)
55,Pioneer Fund A
56,Pioneer Fund C
57,Pioneer Fund R
58,Pioneer Fund Y
59,Pioneer Fund Z
60,Pioneer Fund VCT Portfolio Class I
61,Pioneer Fund VCT Portfolio Class II
62,Pioneer Fundamental Growth Fund A
63,Pioneer Fundamental Growth Fund K
64,Pioneer Fundamental Growth Fund R
65,Pioneer Fundamental Growth Fund Y
66,Pioneer Fundamental Growth Fund Z
67,Pioneer Global Equity Fund A
68,Pioneer Global Equity Fund B
69,Pioneer Global Equity Fund C
70,Pioneer Global Equity Fund Y
71,Pioneer Global High Yield Fund A
72,Pioneer Global High Yield Fund B
73,Pioneer Global High Yield Fund C
74,Pioneer Global High Yield Fund Y
75,Pioneer Global High Yield Fund Z
76,Pioneer Global Multisector Income Fund A4
77,Pioneer Global Multisector Income Fund C4
78,Pioneer Global Multisector Income Fund Y4
79,Pioneer Government Income Fund A
80,Pioneer Government Income Fund B
81,Pioneer Government Income Fund C
82,Pioneer Government Income Fund Y
83,Pioneer High Income Municipal Fund A
84,Pioneer High Income Municipal Fund C
85,Pioneer High Income Municipal Fund Y
86,Pioneer High Income Trust (Closed End)
87,Pioneer High Yield Fund A
88,Pioneer High Yield Fund B
89,Pioneer High Yield Fund C
90,Pioneer High Yield Fund R
91,Pioneer High Yield Fund Y
92,Pioneer High Yield Fund Z
93,Pioneer High Yield VCT Portfolio Class I
94,Pioneer High Yield VCT Portfolio Class II
95,Pioneer Ibbotson Aggressive Allocation Fund A
96,Pioneer Ibbotson Aggressive Allocation Fund C
97,Pioneer Ibbotson Aggressive Allocation Fund Y
98,Pioneer Ibbotson Conservative Allocation Fund A
99,Pioneer Ibbotson Conservative Allocation Fund B
100,Pioneer Ibbotson Conservative Allocation Fund C
101,Pioneer Ibbotson Conservative Allocation Fund Y
102,Pioneer Ibbotson Growth Allocation Fund A
103,Pioneer Ibbotson Growth Allocation Fund B
104,Pioneer Ibbotson Growth Allocation Fund C
105,Pioneer Ibbotson Growth Allocation Fund Y
106,Pioneer Ibbotson Moderate Allocation Fund A
107,Pioneer Ibbotson Moderate Allocation Fund B
108,Pioneer Ibbotson Moderate Allocation Fund C
109,Pioneer Ibbotson Moderate Allocation Fund Y
110,Pioneer International Value Fund A
111,Pioneer International Value Fund B
112,Pioneer International Value Fund C
113,Pioneer International Value Fund Y
114,Pioneer Mid Cap Value Fund A
115,Pioneer Mid Cap Value Fund R
116,Pioneer Mid Cap Value Fund Y
117,Pioneer Multi-Asset Income Fund A
118,Pioneer Multi-Asset Income Fund C
119,Pioneer Multi-Asset Income Fund Y
120,Pioneer Multi-Asset Real Return Fund A
121,Pioneer Multi-Asset Real Return Fund Y
122,Pioneer Multi-Asset Real Return Fund Z
123,Pioneer Multi-Asset Ultrashort Income Fund A
124,Pioneer Multi-Asset Ultrashort Income Fund C
125,Pioneer Multi-Asset Ultrashort Income Fund C2
126,Pioneer Multi-Asset Ultrashort Income Fund K
127,Pioneer Multi-Asset Ultrashort Income Fund Y
128,Pioneer Multi-Asset Ultrashort Income Fund Z
129,Pioneer Municipal High Income Advantage Trust (Closed End)
130,Pioneer Municipal High Income Trust (Closed End)
131,Pioneer Real Estate Shares A
132,Pioneer Real Estate Shares B
133,Pioneer Real Estate Shares C
134,Pioneer Real Estate Shares Y
135,Pioneer Real Estate Shares VCT Portfolio Class I
136,Pioneer Real Estate Shares VCT Portfolio Class II
137,Pioneer Short Term Income Fund A
138,Pioneer Short Term Income Fund B
139,Pioneer Short Term Income Fund C
140,Pioneer Short Term Income Fund C2
141,Pioneer Short Term Income Fund Y
142,Pioneer Strategic Income Fund A
143,Pioneer Strategic Income Fund B
144,Pioneer Strategic Income Fund C
145,Pioneer Strategic Income Fund K
146,Pioneer Strategic Income Fund R
147,Pioneer Strategic Income Fund Y
148,Pioneer Strategic Income Fund Z
149,Pioneer Strategic Income VCT Portfolio Class I
150,Pioneer Strategic Income VCT Portfolio Class II
