id,title
0,Start a new thread within this topic
1,"Labour leadership hustings - Webchat with Andy Burnham, Thursday 30 July, 2pm"
2,New report on maternity discrimination: share your experiences
3,Tesco withdraw Ribena
4,Possible piece of debris from MAS370 found
5,Missing Malaysian Airlines MH-370 - Thread 6
6,Corporate Communism this is the beginning
7,Lord Sewel
8,Why is it legal to hunt lions and leopards and did he deserve the vitriol?
9,#ImInWorkJeremy
10,Breastfeeding in Primark mother charged with perverting the course of justice.
11,Myleen Klass 'opens up' ie slags off her ex
12,Woman killed on escalator in China.
13,This is what Jeremy Corbyn is about
14,Another young black person dies in police custody in the US
15,Unidentified body of a three year old girl found in Australia
16,Control from beyond the grave - a sort of WWYD
17,MP's 'Opening' Food Banks (like opening a 'library' or other valuable service)??
18,An interview with Obama isn't a blooming music video
19,"The Sun, The Queen, a nazi salute"
20,"Establishment Paedophiled Part 2 : **Warning, potential triggers**"
21,"who should baby ""Charlie"" live with?"
22,1 in 10 children born to FGM mothers in Southwark
23,Don Lock tragically murdered in road rage incident
24,Embarrasing Parent Syndrome
25,Greece part II
26,Malala is eighteen
27,UK Parliament; Syria Aircraft Bombing Vote - Part Deux?
28,Women will have to prove they've been raped to get CTC - how low can this Government go?
29,Iran Nuclear Deal - really?
30,MPs to get a 10% pay rise
31,Daniel Pelka's mother has died in jail
32,The SNP have played a blinder
33,Okskar Groening
34,Parents want primary school teachers sacked for Facebook photos
35,Nicky the Fish is off and running! Nicola Sturgeon continues her anti-English whinge fest
36,Fox hunting
37,Has the mother of the baby for sale been found?
38,IBM to offer staff breast-milk-delivery-as-a-service for staff
39,Pluto
40,Stevi Richie and Chloe-jasmine getting married?!
41,Up to one in seven NHS operations unnecessary?
42,"How terrible - a nightmare, to crash and not be found"
43,Freddie Starr lost his defamation case
44,http://www.bbc.co.uk/news/uk-scotland-33497318
45,Market rent and Income thresholds
46,Freddie Starr libel case
47,The Greek debt crisis....why?
48,"Teachers can confiscate ""unhealthy""; items from lunchboxes."
49,Minutes silence tomorrow
50,TTIP. Should we consider leaving the EU after all?
51,7/7
52,Start a new thread within this topic
