id,title
0,Sticky Topic CHALEAN EXTREME/TURBO FIRE HYBRID CHALLENGE TEAM
1,Sticky Topic ****30 Day BUDDY CHALLENGE***
2,Piyo Group!
3,Anyone started/plan to start Chalean Xtreme?
4,2014: Challenge: BURN CIRCUIT 1
5,30 Day ChaLean and Yoga Challenge
6,Turbofire and chalean extreme hybrid group 12/31
7,Anyone want to Start ChaLEAN Monday May14 with me?
8,Team 1~ANDRIZZY (Accountability Buddies)
9,***BUDDY CHALLENGE***
10,90 Day ChaLEAN Extreme & TurboFire Hybrid!
11,***Teams for the 30 day Buddy Challenge***
12,Need a Buddy for the challenge???
13,Chalene's new book PUSH
14,Starting CLX/TF hybrid 8/1
15,Assesing the weight?
16,Humming Bird/Butte erfly/Care Bear chat room
17,GET LEAN DAISIES CHAT ROOM
18,***Dailips/B Bunnies/chat room***
19,APRIL 2011_Get Organized & Achieve Goals w/Chalene
20,"URGENT!! ""GL By Summer Buddies-- IMPORTANT INFO!!"
21,April BSG challenge (for all the teams)
22,GET LEAN BUTTERFLIES CHAT ROOM
23,BUNNIES: GET LEAN WKS 1-4 CHALLENGE
24,GET LEAN BUNNIES CHAT ROOM
25,"""Get Lean By Summer"" Challenge: CANCELLED :("
26,GET LEAN CARE BEARS CHAT ROOM
27,GET LEAN HUMMING BIRDS CHAT ROOM
28,QUESTIONS? Get Lean By Summer 16-Week Challenge
29,BUTTERFLIES: GET LEAN WKS 1-4 CHALLENGE
30,CARE BEARS: GET LEAN WKS 1-4 CHALLENGE (3/2-3/28)
31,HUMMING BIRDS: GET LEAN WKS 1-4 CHALLENGE 3/2-3/28
32,GET LEAN TULIPS CHAT ROOM
33,Week 2 postings?
34,DAISIES: GET LEAN WKS 1-4 CHALLENGE
35,GET LEAN CLOVERS CHAT ROOM
36,GET LEAN RED ROBINS CHAT ROOM
37,GET LEAN BLUE BIRDS CHAT ROOM
38,GET LEAN RAINBOWS CHAT ROOM
39,!!ATTENTION PARTICIPANTS: GET LEAN BY SUMMER!!
40,TULIPS: GET LEAN WKS 1-4 CHALLENGE
41,FEEDBACK: Get Lean By Summer 16-Week Challenge
42,BLUE BIRDS: GET LEAN WKS 1-4 CHALLENGE
43,RED ROBINS: GET LEAN WKS 1-4 CHALLENGE
44,CLOVERS: GET LEAN WKS 1-4 CHALLENGE
45,RAINBOWS: GET LEAN WKS 1-4 CHALLENGE
46,JANUARY 2011 ChaLEAN EXTREME GROUP
47,NOVEMBER ChaLEAN EXTREME GROUP
48,January 2010 Cardio Challenge
49,SEPTEMBER ChaLEAN EXTREME GROUP
