id,title
0,Twitter Yanks Tweets That Repeat Copyrighted Joke
1,Universal Pictures Wants To Remove Localhost and IMDB Pages From Google Results
2,Automakers To Gearheads: Stop Repairing Cars
3,ESA Rebukes EFF's Request To Exempt Abandoned Games From Some DMCA Rules
4,Porn Companies Are Going After GitHub
5,Economist: US Congress Should Hack Digital Millennium Copyright Act
6,Deadmau5 Accuses Disney of Pirating His Music
7,DMCA Claim Over GPL Non-Compliance Shuts Off Minecraft Plug-Ins
8,"After Celebrity Photo Leaks, 4chan Introduces DMCA Policy"
9,Google Receives Takedown Request Every 8 Milliseconds
10,"Wikipedia Reports 50 Links From Google 'Forgotten', Issues Transparency Report"
11,"Hack an Oscilloscope, Get a DMCA Take-Down Notice From Tektronix"
12,"""Internet's Own Boy"" Briefly Knocked Off YouTube With Bogus DMCA Claim"
13,Ask Slashdot: Hosting Services That Don't Overreact To DMCA Requests?
14,Sony Uses DMCA To Shut Down Aibo Hack Site
15,YouTube Threatens To Remove Scientist's Account Over AIDS Deniers' DMCA Claims
16,"Hotfile Settles With MPAA, Drops Countersuit Against Warner Bros"
17,Copyright Takedown Requests to Google Doubled In 2013
18,"HBO Asks Google To Take Down ""Infringing"" VLC Media Player"
19,Sharing HBO Go Accounts Could Result In Prison
20,Hollywood Studios Use DMCA To Censor Pirate Bay Documentary
21,Reps Introduce Bipartisan Bill To Legalize Mobile Device Unlocking
22,DMCA Safe Harbor May Not Apply To Old Copyrighted Works
23,DMCA Safe Harbor May Not Apply To Old Copyrighted Works
24,CipherCloud Invokes DMCA To Block Discussions of Its Crypto System
25,Copyright Ruling Rings With Echo of Betamax
26,TechCrunch:Expanded DMCA Still Has Limits
27,GoPro Issues DMCA Takedown Over Negative Review
28,GoPro issues DMCA take down on product review it does not like
29,"White House Petition To Make Unlocking Phones Legal Passes 100,000 Signatures"
30,White House Petition Lobbies to Make Cell Phone Unlocking Legal
31,Site Copies Content and Uses the DMCA to Take Down the Original Articles
32,Using DMCA As A Way to Scrub Reputations
33,What You Need To Know About Phone Unlocking
34,Unlocking New Mobile Phones Set to Become Illegal in the US
35,DMCA exemption ends on Jan 26th. Unlocking a cellphone becomes illegal
36,"DMCA updates for 2013: jailbreaking, personal copies of DVDs illegal"
37,NZBMatrix Closes Their Website
38,Newzbin2 Closes For Good
39,Newzbin2 Closes for Good
40,Feds Continue To Consider Linux Users Criminals For Watching DVDs
41,Millions of Blogs Knocked Offline By Legal Row
42,EFF To Ask Judge To Rule Universal Abused DMCA
43,Automated DMCA Takedown Notices Request Censorship of Legitimate Sites
44,"YouTube Alters Copyright Algorithms, Will 'Manually' Review Some Claims"
45,"YouTube Alters Copyright Algorithms, Will 'Manually' Review Some Claims"
46,Ask Slashdot: How To Fight Copyright Violations With DMCA?
47,When Kickstarter Projects Go Missing
48,Ask Slashdot: How Do I Deal With Organizations Double Down On The DMCA Process?
49,The Algorithmic Copyright Cops: Streaming Video's Robotic Overlords
50,The Algorithmic Copyright Cops: Streaming Video's Robotic Overlords
51,YouTube Flags Democrats' Convention Video on Copyright Grounds
52,"LendInk EBook Lending Service Returns, Receives Fishy DMCA Notice"
53,Attack of the Google DMCA Search Ranking Hysteria
54,Legitimate eBook Lending Community Closed After Copyright Complaints
55,Legitimate ebook lending community closed after copyright complaints
56,NASA's Own Video of Curiosity Landing Crashes Into a DMCA Takedown
57,EU Parliament Debates a DMCA Equivalent
58,EU Parliament Debates their own DMCA
59,Capitalists Who Fear Change
60,The Canadian DMCA Battle Concludes: How Thousands of Canadians Changed Copyright
61,Copyright Infringer Tries To Shut Down Reporting On Her Infringement
62,Google Lifts The Veil On Copyright Takedowns: Reveals Detailed Data On Who Reque
63,Cops Can Crack an iPhone In Under Two Minutes
64,SOPA-style Amendments Dropped From C-11; DRM Provisions Not
65,Bill C-11 Committee Review - SOPA-style amendments dropped except Digital Locks
66,The Fallout from a Flickr DMCA Takedown
67,Megaupload Drops Lawsuit Against Universal Music
68,Copyright Lobby Wants Canada Out of TPP Until Stronger Copyright Laws Passed
69,WURFL Founders Fire Off DMCA Takedown Against Fork
70,9th Circuit affirms judgment dismissing UMG's case
71,RIAA Lawyer Complains DMCA May Need Revamp
72,riaa lawyer complains DMCA doesnt strip people of
73,A Brief History of Failed Digital Rights Management Schemes
74,DRM graveyard: A brief history of digital rights m
75,New Version of PROTECT IP Bill May Target Legal Sites
76,Universal Uses DMCA To Get Bad Lip Reading Parody Taken Down
77,Justification For Canadian Copyright Reform Revealed
78,Hotfile countersues Warner
79,Android Tricorder Killed By CBS
80,Victory For Music Locker Services?
81,Bitcoin Trademark Troll Now Sending Bogus DMCA Takedowns
82,Removal of Photo Credit Qualifies As DMCA Violation
83,DMCA takedown of Wikipedia hyperlinks to PCI spec
84,City Council Candidate Censors Debate with DMCA
85,Wikileaks Says Public Forced Canadian DMCA Delay
86,Dropbox Attempts To Kill Open Source Project
87,IMSLP Taken Down By UK Publishers Group
88,imslp.org Taken Down Thanks to MPA
89,Judge Reveals Secret Righthaven Copyright Contract
90,White House Wants New Copyright Law Crackdown
91,Sony after visitors on Geohot blog
92,Thingiverse gets its first DMCA Notice
93,CRIA Files Massive Canadian Suit Against IsoHunt
94,GitHub Sends DMCA Counternotice to Sony
95,Sony Sends DMCA Takedown Notice to Gitorious
96,Sony Sends DMCA Takedown Notice To GitHub
97,Sony Sends DMCA Takedown Notice to GitHub
98,Sony Files Lawsuit Against PS3 Hacker GeoHot
99,Virtual Animal Creators in Second Life file Suit
100,Avoiding DMCA Woes As an Indy Game Developer?
101,Jailtime For Jailbreaking
102,Net Neutrality Supporters Hammered In Elections
103,UK Wants ISPs To Be Responsible For Third Party Content Online
104,AP Proposes ASCAP-Like Fees For the News
105,Universal Sends DMCA Takedown On 1980 Report
106,Website assets being stolen - What can I do?
107,DMCA Takedown Notice Leveled Against Ohio Congressional Race Ad
108,US Negotiators Cave On Internet Provisions To ACTA
109,US ISP Adopts Three-Strikes Policy
110,US ISP Adopts Three-Strikes Policy
111,Intel Threatens DMCA Using HDCP Crack
112,Countering a DMCA Takedown In the Magnet Wars
113,"ACTA Text Leaks; US Caves On ISPs, Seeks Super-DMCA"
114,"RIAA President Says Copyright Law ""Isn't Working"""
115,"RIAA President Says Copyright Law ""Isn't Working"""
116,NAMCO Takes Down Student Pac-man Project
117,DMCA Exemptions Don't Matter
118,DMCA Exemptions Don't Matter
119,Jailbreaking your iPhone still voids warranty
120,Court Rules That Bypassing Dongle Is Not a DMCA Violation
121,Author Drops Copyright Case Against Scribd Filter
122,"US Gov't Orders 73,000 Private Websites Offline"
123,Latest Version of ACTA Leaks
124,Brazil Forbids DRM On the Public Domain
125,"Minister pushing ""Canadian DMCA"" smears opponents"
126,YouTube Granted Safe Harbor From Viacom
127,Experts Say ACTA Threatens Public Interest
128,90+ Experts say ACTA Threatens Public Interest
129,UK's RIAA Goes After Google Using the US DMCA
130,Canadian Copyright Lobby Astroturfs C-32
131,"""Canadian DMCA"" Rising From the Dead"
132,Canadian Conservatives to revisit Bill C-61
133,TV Networks Don't Want DMCA Protection For YouTube
134,Another Stab At a Canadian DMCA
135,Canadian DMCA Coming?
136,Amicus brief filed on behalf of YouTube
137,Making Closed Software Act Like It's Open
138,Google Slams Viacom For Secret YouTube Uploads
139,"A Dream for Music, but Labels’ Nightmare"
140,Web Copyright Crackdown On the Way
141,DMCA Amendment Proposed For UK
142,A Second Lessig Fair-Use Video Is Suppressed By WMG
143,Cryptome in Hot Water Again
144,Cryptome's plug pulled?
145,Overzealous Enforcement Means Even Legit Music Blogs Deleted
146,Music blogs wrongly deleted for infringement
147,"Universal, Pay Those EFFing Lawyers"
148,"Adding Up the Explanations For ACTA's ""Shameful Secret"""
149,"DMCA Takedown Scandal, Part Two"
150,"Holy See Declares a ""Unique Copyright"" On the Pope"
151,Scientists Crack 'Entire Genetic Code' of Cancer
152,"Questionable ""Best Effort"" Copyright Enforcement"
153,"Questionable ""Best Effort"" Copyright Enforcement"
154,CRIA Faces $60 Billion Lawsuit
155,"EFF Launches ""Takedown Hall of Shame"""
156,"EFF launches ""Takedown Hall of Shame"""
157,Photoshop Disaster Draws DMCA Notice For Boing Boing
158,TI vs. Calculator Hackers
159,"RSA keys factored, DMCA takedowns issued"
160,Flickr Yanks Image of Obama As Joker
161,EFF Says Burning Man Usurps Digital Rights
162,Judge Rules Against RealDVD
163,California Student Arrested For Console Hacking
164,Google Releases Open Source NX Server
165,Another Question Of Search Engine Legality and Infringement
166,Adobe Uses DMCA On Protocol It Promised To Open
167,EFF Sues Apple Over BluWiki Legal Threats
168,Looking Back At Copyright Predictions
169,Google's Information On DMCA Takedown Abuse
170,Amazon Uses DMCA To Restrict Ebook Purchases
171,Apple Claims That Jail-Breaking Is Illegal
172,Judge Rules WoW Bot Violates DMCA
173,"YouTube Muting, Removing Videos Involving Warner Music"
174,Documentary Released On Canadian Fight Against DMCA
175,Canada Election Result Bad News For DMCA Opponents
176,Apple DMCAs iPodHash Project
177,Toyota Demands Removal of Fan Wallpapers
178,"10 Years Later, Misunderstood DMCA Is the Law That ""Saved the Web"""
179,McCain Campaign Protests YouTube's DMCA Policy
180,DMCA Exemption Time
181,Thomson Reuters Sues Over Open-Source Endnote-Alike Zotero
182,Windows 7 Beta Screenshots Leaked
183,Nielsen Sends Wikipedia DMCA Takedown For Station Descriptions
184,YouTube Reposts Anti-Scientology Videos
185,YouTube Stands Up To IOC Over Free Tibet Video
186,Purported ACTA Wishlist Would Put DMCA To Shame
187,AP Files 7 DMCA Takedowns Against Drudge Retort
188,Canada's Proposed DMCA-Style Law Draws Fire
189,YouTube Fires Back At Viacom
190,YouTube Refuses To Remove Terrorist Videos
191,CoreCodec Apologizes For CoreAVC Takedown
192,CoreAVC for Linux Project taken down due to DMCA
193,"""Hollywood"" Howard Berman To Leave Internet Subcommittee"
194,"Warner Sues Search Engine, Tests DMCA Safe Harbor"
195,Hasbro Using DMCA on Facebook Game Apps
196,A Legal Analysis of the Sony BMG Rootkit Debacle
197,Record Labels Change Minds About Sharing MP3s
198,Canadian DMCA Bill Withdrawn
199,Canadian DMCA Won't Include Consumer Rights
