id,title
0,Oracle To Debut Low-Cost SPARC Chip Next Month
1,Why I Choose PostgreSQL Over MySQL/MariaDB
2,Why I Choose PostgreSQL Over MySQL/MariaDB
3,Ask Slashdot: Linux Database GUI Application Development?
4,Amazon Goes After Oracle (Again) With New Aurora Database
5,Ask Slashdot: Choosing a Data Warehouse Server System?
6,Yale Researchers Prove That ACID Is Scalable
7,Testing the MongoDB Global Write Lock Improvements
8,UK's National Health Service Moves To NoSQL Running On an Open-Source Stack
9,"Privacy Vulnerabilities In Coursera, Including Exposed Student Email Addresses"
10,"Oracle Database Redaction Trivial To Bypass, Says David Litchfield"
11,Ask Slashdot: When Is It Better To Modify the ERP vs. Interfacing It?
12,Oracle Offers Custom Intel Chips and Unanticipated Costs
13,Ask Slashdot: Easy-To-Use Alternative To MS Access For a Charity's Database?
14,"MariaDB 10 Released, Now With NoSQL Support"
15,"Surrogate Database Key, Not Bitcoin Protocol Flaw, To Blame For Mt Gox Problems"
16,Why Don't Open Source Databases Use GPUs?
17,NYT: Healthcare.gov Project Chaos Due Partly To Unorthodox Database Choice
18,"Capturing the Flag, SQLi-Style"
19,Oracle Promises 100x Faster DB Queries With New In-Memory Option
20,"Will Facebook, Twitter, LinkedIn Stay With MySQL?"
21,A Tale of Two MySQL Bugs
22,Ask Slashdot: Speeding Up Personal Anti-Spam Filters?
23,"CouchDB: Roll Your Own, Or Go With a Service?"
24,Database Loophole Lets Legislators Avoid Photo Radar Tickets
25,"Ask Slashdot: Learning DB the Right Way; Books, Tutorials, or What?"
26,Ask Slashdot: Is Postgres On Par With Oracle?
27,Node.js and MongoDB Turning JavaScript Into a Full-Stack Language
28,Review: Oracle Database 12c
29,Monty Suggests a Business-Friendly License That Trends Open
30,MariaDB vs. MySQL: A Performance Comparison
31,"There Is No Reason At All To Use MySQL: MariaDB, MySQL Founder Michael Widenius"
32,MySQL Founders Reunite To Form SkySQL
33,"Harvard/MIT Student Creates GPU Database, Hacker-Style"
34,Wikipedia Moved To MariaDB 5.5
35,Google's BigQuery Vs. Hadoop: a Matchup
36,Security Fix Leads To PostgreSQL Lock Down
37,MySQL's Creator On Why the Future Belongs To MariaDB
38,Longest Running Linux Distribution Slackware Adopts MariaDB
39,Google BigQuery Is Now Even Bigger
40,Former MySQL CEO Mårten Mickos Talks About Managing Remote Workers (Video)
41,$100 Million Student Database Worries Parents
42,Giant database of school children. What could go wrong?
43,"A Tale of Two Databases, Revisited: DynamoDB and MongoDB"
44,Why My Team Went With DynamoDB Over MongoDB
45,MySQL 5.6 Reaches General Availability
46,Fedora 19 Nixing MySQL in Favor of MariaDB
47,Cassandra NoSQL Database 1.2 Released
48,PostgreSQL 9.3 Will Feature UPDATEable Views
49,NYC Police Gathering Cellphone Logs
50,NY city police gathering cellphone ogs
51,Dragonfly BSD 3.2 Released
52,Vermont cops replace clunky records management system with open-source solution
53,Google Spanner: First Globally Scalable Database With External Consistency
54,Google's Spanner - Database that knows what time it is
55,PostgreSQL 9.2 Out with Greatly Improved Scalability
56,World's Smallest And Fastest Database
57,Is MySQL Slowly Turning Closed Source?
58,Database Developed of Every US Bomb Dropped Since WWI
59,"NSA Mimics Google, Angers Senate"
60,Ask Slashdot: Documenting a Tangle of Network Devices?
61,Documenting Network Devices
62,MemSQL Makers Say They've Created the Fastest Database On the Planet
63,The Notorious B.I.G. Data
64,The Fastest Database One the Planet
65,Google's F1 - Scalable Alternative to MySQL
66,Microsoft Research Introduces Record-Beating MinuteSort Tech
67,New MinuteSort Record Set by Microsoft Research
68,Moving From CouchDB To MySQL
69,Critical Vuln Found In All Current Oracle DB Servers
70,Oracle Issues Massive Security Update for 88 Vulnerabilities
71,Blue Gecko is an 11 Year Old Remote Database Administration Startup (Video)
72,"GreenSQL is a Database Security Solution, says CTO David Maman (Video)"
73,Semantic Databases are the Next Frontier for Big Data
74,Oracle Claims Dramatic MySQL Performance Improvements
75,OzLog: Unlimited Private Data Retention For Australia?
76,OzLog: unlimited private data retention for Oz law
77,Serious Oracle Flaw Revealed; Patch Coming
78,Ask Slashdot: Open Source vs Proprietary GIS Solution?
79,Ask Slashdot: Which Web Platform Would You Use?
80,Canonical Drops CouchDB From Ubuntu One
81,Canonical drops CouchDB from Ubuntu One
82,IT's Next Hot Job: Hadoop Guru
83,IT's Next Hot Job: Hadoop Guru
84,LedgerSMB 1.3.0 Released
85,Oracle's Commercial Moves with MySQL are Drawing S
86,Using a Supercomputer To Predict Revolutions
87,Type Safety Coming To DB Queries
88,NewSQL: SQL meets NoSQL
89,"Fluidinfo, Wikipedia For Databases"
90,Apple Removes MySQL From Lion Server
91,Unified NoSQL Query Language Launched
92,Unified NoSQL query language launched
93,Making Sense of the NoSQL Standouts
94,Facebook Trapped In MySQL a 'Fate Worse Than Death'
95,UK police database abuse 'hugely intrusive'
96,Oracle Brings 17 Java Security Fixes in June Patch
97,Court Demands American Airlines List Its Flights On Orbitz
98,Ask Slashdot: Verifying Security of a Hosted Site?
99,Mickos Says MySQL Code Better Than Ever Under Oracle
100,SQL and NoSQL are Two Sides of the Same Coin
101,Drizzle Hits General Availability
102,Iris-Scan ID Cards For Children In Mexico
103,"CouchOne, Membase Merge, Form NoSQL Powerhouse"
104,Cassandra 0.7 Can Pack 2 Billion Columns Into a Row
105,Cassandra 0.7 can pack 2bn columns into a row
106,CA Sues Over DB2 Migration Tool
107,Horizontal Scaling of SQL Databases?
108,Why Browsers Blamed DNS For Facebook Outage
109,"You Are Not Mark Zuckerberg, So Stay In School"
110,Facebook Unveils Details of Downtime
111,"Swedes Cast Write-In Votes for SQL Injection, Donald Duck"
112,"Google Caffeine Drops MapReduce, Adds ""Colossus"""
113,How Do You Organize Your Experimental Data?
114,Cache On Delivery — Memcached Opens an Accidental Security Hole
115,Developing a Niche Online-Content Indexing System?
116,Good Database Design Books?
117,Cisco Says Vegas Conference Attendees' Information Was Leaked
118,Good IC / Electronic Component Inventory Software?
119,Falsehoods Programmers Believe About Names
120,US Sues Oracle Over Alleged Overcharging
121,What Is New In PostgreSQL 9.0
122,What is new in PostgreSQL 9.0
123,Are We Ready For a True Data Disaster?
124,Scalability In the Cloud Era Isn't What You Think
125,Cassandra and Voldemort Benchmarked
126,Cassandra and Voldemort benchmarked
127,"Mass. Data Security Law Says ""Thou Shalt Encrypt"""
128,"Explaining Oracle's Sun Takeover — ""For the Hardware"""
129,Postgres Project To Go NoSQL
130,Atom Processors Set New Record For Power-Efficient Sorting
131,Performance improvements in JDBC module published
132,Key Web App Standard Approaches Consensus
133,"Digg Says Yes To NoSQL Cassandra DB, Bye To MySQL"
134,"Digg says yes to NoSQL, bye to MySQL"
135,Drizzle's Future Moving To Rackspace?
136,Anatomy of a SQL Injection Attack
137,How Twitter Is Moving To the Cassandra Database
138,Open source experiment management software
139,USPTO Grants Google a Patent On MapReduce
140,The FBI wants to know about your IT skills
141,Why Oracle can't easily kill PostgreSQL
142,Google Wants to Administer the First White Spaces
143,Monty Wants To Save MySQL
144,First MySQL 5.5 Beta Released
145,First MySQL 5.5 beta released
146,3 database kings disagree on how to face Hadoop
147,Oracle responds to MySQL purchase concerns
148,Monty says: Help saving MySQL
149,Future of RDBMS is RAM Clouds & SSD
150,Linux OOM Killer - Experimental Thoughts
151,EC Formally Objects To Oracle's Purchase of Sun
152,The NoSQL Ecosystem
153,Amazon Cloud Adds Hosted MySQL
154,Brian Aker Responds To RMS On Dual Licensing
155,MySQL Cofounder Says Oracle Should Sell Database To a Neutral 3d Party
156,Oracle Fined For Benchmark Claims
157,Data Locking In a Web Application?
158,How a Team of Geeks Cracked the Spy Trade
159,Database Error Costs Social Security Victims $500M
160,Copyright Status of Thermodynamic Properties?
161,'Power Capping' the Datacenter
162,Researchers Create Database-Hadoop Hybrid
163,Google's Chiller-Less Data Center
164,Open Source Search Engine Benchmarks
165,"Enthusiasts Convene To Say No To SQL, Hash Out New DB Breed"
166,NSA To Build 20-Acre Data Center In Utah
167,PostgreSQL 8.4 Out
168,PostgreSQL 8.4 Out
169,IT and Health Care
170,One Approach To Open Source Code Contribution and Testing
171,Cisco Introduces Rackmount Servers
172,SQL in a Nutshell
173,SQL in a Nutshell
174,Has MySQL Forked Beyond Repair?
175,"MySQL Founder Starts Open Database Alliance, Plans Refactoring"
176,The Manga Guide to Databases
177,"A Look Into the FBI's ""Everything Bucket"""
178,Web Analytics Databases Get Even Larger
179,"Sun Announces New MySQL, Michael Widenius Forks"
180,What If Oracle Bought Sun Microsystems?
181,Building a Searchable Literature Archive With Keywords?
182,Locating the Real MySQL
183,"What an IBM-Sun Merger Might Mean For Java, MySQL, Developers"
184,"""Slacker DBs"" vs. Old-Guard DBs"
185,Refactoring SQL Applications
186,Reasonable Hardware For Home VM Experimentation?
187,DB Query Becomes Browseable In Virtual World
188,Is the Relational Database Doomed?
189,Five Questions With Michael Widenius
190,MySQL Co-Founder Monty Widenius Quits Sun
191,MySQL Ends Enterprise Server Source Tarballs
192,How To Set Up A Load-Balanced MySQL Cluster
193,Visualizing Complex Data Sets?
194,Oracle and PostgreSQL Debate
195,Is MySQL's Community Eating the Company?
196,Sun's Mickos Is OK With Monty's MySQL 5.1 Rant
197,Amazon Launches Public Data Sets To Spur Research
198,MySQL in a Nutshell
199,"MySQL 5.1 Released, Not Quite Up To Par"
