id,title
0,I'm Casting My Lasso Towards The Sky
1,Lookin' for Love
2,"Ruby, Don't Take Your Love To Town"
3,All The Gold In California
4,Private Conversation
5,The Yellow Rose Of Texas
6,Is Heaven Good Enough For You
7,Do You Know How It Feels To Be Lonesome
8,Still A Lot Of Love In San Antone'
9,Big Rock Candy Mountain
10,What A Crying Shame
11,Leavin Louisiana In Broad Daylight
12,I'm On Fire
13,Blue Eyes Crying In The Rain
14,"Cold, Cold, Heart"
15,"Oh, Bury Me Not"
16,Love Song
17,State Of Mind
18,Like A Wrecking Ball
19,Burn Another Honky Tonk Down
20,"Love Without End, Amen"
21,Many Years Ago
22,South Of The Border
23,Annie's Song
24,No Banker Left Behind
25,Watch You Gonna Do Cowboy
26,There's Nothing Soft About Hard Times
27,You Ask Me To
28,"Blue Days, Black Nights"
29,Break My Mind
30,The Only Mama That'll Walk The Line
31,Bet No One Ever Heard This Bad
32,Long Long Time
33,Life Is Like A Mountain Railroad
34,He Darked The Sun
35,Crazy Arms
36,I Still Miss Someone
37,I Fall To Pieces
38,It Doesn't Matter Anymore
39,I Can't Help It
40,If You're Gonna Play In Texas
41,Tequila Sunrise
42,Streets Of Bakersfield
43,Cotton Eyed Joe
44,Wildwood Weed
45,Angry Words
46,You Are My Sunshine
47,Down To The River
48,"Guitars, Cadillacs, Etc..."
49,Honky Tonk Man
50,My Baby Done Left Me
51,One Of Them Days
