id,title
0,PVOL303: Advanced Battery-based PV System Design Series 1
1,PV301L: Solar Electric Lab Week (Battery-Based)
2,PVOL202: Advanced PV System Design & the NEC (Grid-Direct)
3,PVOL206: Solar Business and Technical Sales - Online
4,PVOL101: Solar Electric Design & Installation (Grid-Direct)
5,PVOL303: Advanced Battery-based PV System Design: Series I
6,"PV203 PREP: Battery-based PV System Fundamentals, online"
7,PV351L: PV Systems-Tools & Techniques for O&M (Grid-direct)
8,PV201L: Solar Electric Lab Week (Grid-direct) for Women
9,PV101: Solar Electric Design & Installation (Grid-Direct)
10,PVOL202: Advanced PV System Design & the NEC (Grid-Direct)
11,PVOL101: Solar Electric Design & Installation (Grid-Direct)
12,SHOL101: Solar Hot Water Design and Installation
13,PVOL304: Advanced Battery-based PV System Design: Series II
14,"PV203 PREP: Battery-based PV System Fundamentals, online"
15,Community Energy Transformations: Fort Collins Case Study
16,PV201L: Solar Electric Lab Week (Grid-Direct)
17,PV301L: Solar Electric Lab Week (Battery-Based)
18,RDOL101: Appropriate Technology for the Developing World
19,PVOL202: Advanced PV System Design & the NEC (Grid-Direct)
20,PVOL206: Solar Business & Technical Sales
21,PVOL101: Solar Electric Design & Installation (Grid-Direct)
22,PV201 - PV Design and Installation - Online
23,PV203 - PV Systems Design and Installation - Workshop
24,PV201 - PV Design and Installation - Online
25,PV203 PV Systems Design and Installation Workshop
26,Fronius Service Provider Training
27,Fronius Service Provider Training
28,Fronius Service Provider Training
29,Fronius Service Provider Training
30,Fronius Service Provider Training
31,BPI Building Analyst and Envelope Professional
32,REPV: Renewable Energy Generation with Photovoltaics
33,RESNET HERS Rater
34,RESNET HERS Rater
35,REST: Renewable Energy Generation with Solar Thermal Systems
36,ONLINE REPV: Renewable Energy with Photovoltaic Systems
37,PV Technical Sales
38,BPI Building Analyst and Envelope Professional
39,LEED GREEN ASSOCIATE (2 day)
40,REPV(A): Advanced Design & Installation of Photovoltaic Sys
41,Homebrew Wind Power - Wind Turbine Design and Construction
42,ImagineSolar | Online Smart Grid and Distributed Generaton
43,Austin Community College ~ ELMT 2474 - Solar PV Systems
44,Advanced Lab Day: Solar PV Design & Installation | Nov 7
45,Austin Community College ~ WIND 2359 – Wind Power Systems
46,Austin Community College ~ ELMT 2276 - Solar PV Installation
47,ImagineSolar | Advanced PV Project Experience Aug 29 - Sep 2
48,ImagineSolar | Online Solar PV Economics and Technical Sales
49,ImagineSolar | Advanced PV Project Experience Feb | 6 - 10
50,ImagineSolar | Advanced PV Project Experience | Nov 7 - 11
51,ImagineSolar | Foundations Online PV Design & Installation
52,Advanced Lab Day: Solar PV Design & Installation | August 29
53,Austin Community College ~ ELMT 2275 – Solar Thermal Systems
54,"Free SolarEdge Workshop | Austin, TX | August 6, 2015"
55,ACC-ELMT 2372 – Energy Efficient Structures and Assessments
56,Solar Fundamentals 1A - Online
57,Solar Fundamentals 1A - Online
58,Solar Fundamentals 1B - Online
59,Solar Fundamentals 1B - Online
60,Solar Fundamentals 1B - Labs
61,Solar Fundamentals 1A - Labs
62,Building Energy Analytics
63,Deep Energy Retrofits
64,Passive House in the Real World
65,Solar Thermal Site Assessor Training Online
66,Basic Photovoltaics Online
67,Introduction to Tower Climbing and Safety
68,Wind Turbine Repair and Maintenance
69,Solar Domestic Hot Water Systems Online
70,PV Site Assessor Training Online
71,Solar Space Heating Systems Online
72,Small Wind Site Assessor Training Online
73,PV Sales and Finance Online
74,Basic Photovoltaics Online
75,PV System Design (Online)
76,Solar Space Heating Systems
