id,title
0,Arks Kc
1,Centennial Sheltie Denver
2,Hobbs Nm Kc
3,Kennel Cl Nortrn Nj
4,Leavenworth Kc
5,Peninsula Dfc
6,Co Springs Kc
7,Warren Co Kc Of Oh
8,Tualatin Kc
9,Moberly Mo Kc
10,Sierra-tuolumne Kc
11,Marion Oh Kc
12,Santa Clara Vly Kc
13,"Chintimini Kennel Club, Inc."
14,"Sequoia Kennel Club, Inc."
15,Council Bluffs Kennel Club
16,"Umpqua Kennel Club, Inc."
17,Somerset Hills Kennel Club
18,"Greater Murfreesboro Kennel Club, Inc."
19,"Albany Kennel Club, Inc."
20,"Valdosta Kennel Club, Inc."
21,"Jupiter-tequesta Dog Club, Inc."
22,"Hangtown Kennel Club Of Placerville, Ca"
23,Flagstaff Kennel Club
24,Kennel Club Of Beverly Hills
25,Mount Bachelor Kennel Club
26,"Galveston County Kennel Club, Inc."
27,"Muncie Kennel Club, Inc."
28,Eureka Kennel Club
29,Hawaiian Kennel Club
30,"Louisiana Kennel Club, Inc."
31,"Manitowoc County Kennel Club, Inc."
32,"Old Dominion Kennel Club Of Northern Virginia, Inc."
33,"Idaho Capital City Kennel Club, Inc."
34,"Salisbury Maryland Kennel Club, Inc."
35,San Joaquin Kennel Club
36,"Chintimini Kennel Club, Inc."
37,Canada Del Oro Kennel Club
38,Mason And Dixon Kennel Club
39,Group Iv Terrier Club Of Salt Lake
40,Spokane Kennel Club
41,"Heart Of America Kennel Club, Inc."
42,Cheyenne Kennel Club
43,Jefferson County Kennel Club Of Missouri
44,Two Cities Kennel Club
45,"Merrimack Valley Kennel Club, Inc."
46,Silver State Kennel Club
47,"Wilmington Kennel Club, Inc."
48,"Klamath Dog Fanciers, Inc."
49,"Chico Dog Fanciers Association, Inc."
50,"Richland Kennel Club, Inc."
51,"Sierra-tuolumne Kennel Club, Inc."
52,"Dayton Kennel Club, Inc."
53,Golden Gate Kennel Club
54,Mount Bachelor Kennel Club
55,Dan Emmett Kennel Club
56,Mckenzie Cascade Dog Fanciers
57,Helena Montana Kennel Club
58,Hot Springs National Park Kennel Club
59,"Salinas Valley Kennel Club, Inc."
60,"Chintimini Kennel Club, Inc."
61,"Kennel Club Of Yorkville, Illinois"
62,Northern California Terrier Association
63,North Arkansas Kennel Club
64,Mississippi Coast Kennel Club
65,Cook Inlet Kennel Club
66,Windward Hawaiian Dog Fanciers Association
67,Mason City Kennel Club
68,Middleburg Kennel Club
69,Sahuaro State Kennel Club
70,Burbank Kennel Club
71,"Glens Falls Kennel Club, Inc."
72,"Belle-city Kennel Club, Inc."
73,Timberland Valley Dog Fanciers Association
74,"Steel City Kennel Club, Inc."
75,"Windham County Kennel Club, Inc."
76,"Illinois Valley Kennel Club Of Peoria, Inc."
77,Indianhead Kennel Club
78,Snake River Canyon Kennel Club Of Idaho
79,"Del Monte Kennel Club, Inc."
80,"Cedar Rapids Kennel Association, Inc."
81,Mckenzie Cascade Dog Fanciers
82,"Greater Murfreesboro Kennel Club, Inc."
83,"Gloucester County Kennel Club, Inc."
84,Shoreline Dog Fanciers Association Of Orange County
85,Rubber City Kennel Club
86,"Valdosta Kennel Club, Inc."
87,Sangre De Cristo Kennel Club
88,"James River Kennel Club, Inc."
89,Sawnee Mountain Kennel Club Of Georgia
90,Missouri Rhineland Kennel Club
91,"Sheboygan Kennel Club, Inc."
92,Windward Hawaiian Dog Fanciers Association
93,"Mississippi State Kennel Club, Inc."
94,Claremore Kennel Club Of Oklahoma
95,Flagstaff Kennel Club
96,"Pocatello Kennel Club, Inc."
97,"Sioux Valley Kennel Club, Inc."
98,"Green Mountain Dog Club, Inc."
99,"Fort Bend Kennel Club, Inc."
100,Northern Neck Kennel Club Of Virginia
101,"Shreveport Kennel Club, Inc."
102,Mckinley Kennel Club
103,"Mid-del-tinker Kennel Club, Inc."
104,"Manitowoc County Kennel Club, Inc."
105,Windward Hawaiian Dog Fanciers Association
106,"Illinois Capitol Kennel Club, Inc."
107,Palm Beach County Dog Fanciers Association
108,Scottsbluff Kennel Club
109,"Lewis-clark Kennel Club, Inc."
110,"Oshkosh Kennel Club, Inc."
111,Warren County Kennel Club Of Ohio
112,"Talbot Kennel Club, Inc."
113,"South Shore Kennel Club, Inc."
114,"Mesilla Valley Kennel Club, Inc."
115,"Rogue Valley Kennel Club, Inc."
116,Clearwater Kennel Club
117,"Fort Bend Kennel Club, Inc."
118,Anniston Kennel Club
119,"Pocatello Kennel Club, Inc."
120,Lost Coast Kennel Club Of California
121,"Eugene Kennel Club, Inc."
122,Windward Hawaiian Dog Fanciers Association
123,Kennel Club Of Salinas
124,"Land O' Lakes Kennel Club, Inc."
125,Detroit Kennel Club
126,Durham Kennel Club Inc
127,Scottsbluff Kennel Club
128,Chief Solano Kennel Club
129,Mt. Palomar Kennel Club
130,Jefferson City Missouri Kennel Club
131,Soft Coated Wheaten Terrier Club Of Greater Milwaukee
132,Conejo Kennel Club
133,"Kenosha Kennel Club, Inc."
134,Black Mountain Kennel Club Of Nevada
135,Imperial Valley Kennel Club
136,"Salina Kennel Club, Inc."
137,Northern California Terrier Association(BREED/ALL-BREED OBED)
138,Lompoc Valley Kennel Club Inc
139,Nisqually Kennel Club
140,"Elmira Kennel Club, Inc."
141,"Sioux Empire Kennel Club, Inc."
142,"Talbot Kennel Club, Inc."
143,"San Mateo Kennel Club, Inc."
