id,title
0,"KL Rolton, KA Blackwell"
1,"SC Taylor, BL Morgan"
2,"CM Edwards, SJ Taylor"
3,"SJ Taylor, DN Wyatt"
4,"LS Greenway, NR Sciver"
5,"S Nitschke, LJ Poulton"
6,"CM Edwards, LK Newton"
7,"AJ Blackwell, LC Sthalekar"
8,"CM Edwards, LA Marsh"
9,"AJ Healy, MM Lanning"
10,"AJ Blackwell, LC Sthalekar"
11,"MM Lanning, EA Perry"
12,"CM Edwards, LS Greenway"
13,"SJ Taylor, DN Wyatt"
14,"LC Sthalekar, KL Rolton"
15,"MM Lanning, EA Perry"
16,"CM Edwards, LA Marsh"
17,"MM Lanning, AJ Blackwell"
18,"KA Blackwell, EA Perry"
19,"EA Perry, RL Haynes"
20,"LJ Poulton, S Nitschke"
21,"LC Sthalekar, AJ Blackwell"
22,"LS Greenway, A Brindle"
23,"LJ Poulton, AJ Blackwell"
24,"MM Lanning, S Nitschke"
25,"MM Lanning, AJ Healy"
26,"JE Cameron, LC Sthalekar"
27,"KL Rolton, LK Ebsary"
28,"AJ Healy, EJ Villani"
29,"LS Greenway, SE Rowe"
30,"SJ Taylor, BL Morgan"
31,"LA Marsh, DN Wyatt"
32,"JE Cameron, AJ Blackwell"
33,"LS Greenway, JL Gunn"
34,"AJ Blackwell, MM Lanning"
35,"SC Taylor, BL Morgan"
36,"MM Lanning, LJ Poulton"
37,"RL Haynes, S Nitschke"
38,"LS Greenway, NR Sciver"
39,"SJ Taylor, A Brindle"
40,"CM Edwards, DN Wyatt"
41,"MM Lanning, AJ Healy"
42,"MM Lanning, JE Cameron"
43,"A Brindle, AE Jones"
44,"S Nitschke, AJ Blackwell"
45,"LJ Poulton, AJ Blackwell"
46,"CM Edwards, JL Gunn"
47,"CM Edwards, SJ Taylor"
48,"SJ Taylor, NR Sciver"
49,"SJ Taylor, A Brindle"
