id,title
0,It's a new year and opportunity knocks
1,Guilt - the pain of it the cure for it
2,Let's face It - most are worry warts
3,Mnason - A disciple of longstanding!
4,Why do we pass the buck?
5,Noah - drunk in a world of possibilities
6,Are you a Closet Christian?
7,God's power displayed - he Is alive
8,Is a dream deferred - a dream denied?
9,We never finish - unfinished business
10,On dusting off some old dreams
11,Is it as lonely at the top as they say?
12,Relationships - is there any we to tell how I am doing?
13,How could anyone abuse a child?
14,Encouraging words - parents of youngsters
15,Parents and teenagers don't give up on each other
16,Remarriage - myth and reality
17,A clear picture of a healthy marriage
18,Sex and the single person
19,No room for trivial pursuits
20,For garden spot- king lost everything
21,Down - but not out
22,He is light coming into a world of darkness
23,He is love coming into a world of indifference
24,God - when God speaks everyone listens
25,Peace - he is the Prince of Peace
26,If I could start over - would anything be different?
27,Are you a Christian – why?
28,Sweat the small stuff
29,There is a price to pay
30,Dives and Lazarus were worlds apart
31,A Choice -- Stone Age or Golden Age
32,Plan - It was love that sent him
33,"Personal - Have you decided what to do about Jesus Christ, the messiah?"
34,Persistent - Christ at the Door
35,Followers of the Way
36,Marriage the second time around
37,Who Should be Invited?
38,The Atlanta Project Doable
39,Newly Married - Now What?
40,Single Parents - I Salute Them
41,Have You Sold Yourself to the Devil?
42,Beyond Death - Curious or Convinced
43,When will the World Come to an End?
44,"After the rage and the Rampage, where do we go from here?"
45,What is it About Night?
46,Out of Sight - Unknown - But Useful
47,Is Belief in Christ the Only Way to Go?
48,Which Comes First - the First Mile or Second?
49,The Next Twenty Years at Peachtree -- The challenges of a long pastorate
50,The State of the Church
51,The 21st Century is Coming - Do We Need a New Religion?
52,How to Keep Going When you Really Want to Quit
53,"Yes Lord, I Have Sinned, But I Have Several Excellent Excuses"
54,Pride - A Hazardous Substance
55,Envy- When Green Isn't Good
56,Lust- Why Settle for Sex When You Can Have Love?
57,"Sloth- Forever Spectators, The Sin of Half-Heartedness!"
58,Greed - How Much Is Enough?
59,Easter - The Day God Said Yes!
60,Anger - From the Slow Burn to a Blinding Rage
61,Some Thoughts on Broken Dreams
62,The Forgotten Option on the Question of Sex
63,What Parents do to and for Their Children
64,The Three Faces of Loneliness
65,The Things That Endure
66,Worry- Life's Great Downer
67,Why Not You?
68,Three Cheers for Columbus!
69,"Father's Day: Substantive or Superficial, That is"
70,Aaron - Mouthpiece or Model
71,Come Before Winter - IV - Honoring Dr. Clarence McCartney
72,Why Now a Long Range Planning Committee?
73,The Demanding Invitation: Come and Follow Me!
74,The Challenge of Being a Minister
75,Some Thoughts on Casting the First Stone
76,The Rise of Selfishness in America
77,"If the Poor Are With Us Always, Why Bother?"
78,Prosperity: A Gift from God
79,The Treasure Test
80,The love of Christ Compels Me
81,When Things Become Commonplace
82,The Mission that Brought Him
83,The Manner of his Coming
84,God is Ready When You Are
85,The one who never changes
86,The Everest within
87,American heroes - where and who are they?
88,Dan Quayle revisited
89,A Sermon On The Amount
90,Galilean Accent!
91,The Three Faces of Forgiveness
92,Where is your brother?
93,What do you want me to do for you?
94,Service of Healing
95,What do you have In your hand?
96,Who do you say that I am?
97,Who will roll away the stone?
98,Spiritual challenges of an overachiever
99,There's nothing over - like Christmas
100,The Family Revisited
101,Nice Guys Finish Last?
102,The AIDS crisis
103,Personal Responsibility -- 'Holding up your corner
104,"Church and state- Vienna, VA revisited"
105,Nation in search of a soul
106,Things my Father Left To Me
107,Come Before Winter
108,Celebrating Our Heritage
109,Who Will Take Care of Me?
110,"Since Korea and Hungary, The World Seems"
111,Treasure and Heart go together
112,Capacity and Expectation
113,Choices Choices! Goat or Sheep
114,What is My Responsibility Toward Others
115,Grace -- An Hour's Work and a Day's Pay!
116,Equipping of the saints
117,Day of remembrance
118,Looking beyond the obvious
119,The Motive That Caused Him to Come
120,He Came - to associate with outcasts
121,He Came - To Save Sinners
122,He Came - to bring us good news
123,He Came - to bring us good news
124,He Came -- I'm glad there was no room in the inn!
125,No vision - no life
126,The church as a community
127,Difference between dreaming and doing
128,Founded in Faith
129,Like Jacob - we wrestle with God
130,The past is prologue
131,Work - Curse or gift from God
132,Let's hear It for _Atlanta
133,How children grow - who will teach them?
134,Aspects of love - love responds
135,Love is Stronger Than Our Greatest Fears!
136,When love lets you down love falters
137,Love hesitates love procrastinates
138,Love Forgives
139,Love provides
140,Love is human - evening service
141,Love suffers evening service
142,Love convinces
143,Love Triumps
144,How does one respond to an act of terror?
145,River’s edge- crucial choices
146,Child - don't do as I do - but as I say
147,Paradise lost
148,Essence of the matter
149,When the sugar comes off the pill
150,Shall we pray in our schools or not
151,What Should a Dad Be Doing?
152,Come Before Winter
153,Church Works When We Worship
154,Let's Hear It For The Helpers
155,Church works... Serve eagerly
156,Church works... Give generously
157,Church works - when we live worthily
158,Taking stew out of stewardship
159,Living In the red
160,What earthly use Is the church
161,It is never too late to claim your mountain
162,The moral deficit
163,I don't like criticism - do you
164,Choices - How should we live?
165,Can We Go Home Again?
166,Focused on Sharing
167,Good Life Raises Three Questions
168,A Million Man March
169,Some Lessons Learned from the Evening News
170,Is experience the best teacher?
171,Dealing with defeat
172,Stress is getting to me
173,Loneliness
174,Faith - believing the impossible
175,"Day of Ambition, False Promises, Betrayal"
176,"My Lord, What a Morning"
177,Death - Teach us oh Lord to number our days
178,Sorrow - a kings grief observed
179,Rainbow - string around God's finger
180,"Marriage Made in Heaven, Lived out in Buckhead"
181,Action - just do It
182,Family values
183,"Peace, Blessed are the Peace Makers"
184,Looking Forward
185,Perservance
186,PRIZE--The Race is Not Always to the Swift
187,COURAGE--What's your Excuse
188,How To Feel Good About Plan B
189,Come Before the Winter
190,Why Join When I Can Just Visit?
191,Some Just Drift Away
192,Are We Listening to Rhoda?
193,Substance Abuse In the Bible?
194,Careful About Fishing With Jesus
195,It Is Important to Finish Well
196,The Things We Have Done Together
197,Principle of freedom - your choice
198,Principle of reciprocity
199,…And Now the Offering
200,Principle of consistency
201,Principle of change
202,"Bad Things, Good People"
203,Promised messiah
204,Messiah is coming
205,Announcement of his arrival
206,Our messiah surprises us
207,What is the messiah looking for?
208,Beware of hasty conclusions
209,What have we done with our dreamers?
210,Now How Do We Keep Our Dreams
211,How Did Hypocrites Get Such A Bad Name?
212,Competition - Good or Bad?
213,Jesus -- Republican or Democrat?
214,Life's Three Foundations
215,Messiah is coming
216,What I believe about Sin?
217,"Revenge, Retribution, or Forgiveness?"
218,What I believe about Success?
219,What I believe about the Holy Spirit?
220,What I believe about personal evangelism
221,What I Believe About the Church
222,Secret Disciple
223,Simon
224,"Defiant Thief, He died as he lived."
225,Judas
226,What I believe about salvation
227,I was once a youth - I remember when …
228,What I believe about the Bible
229,Things to know before saying “I do”
230,Marriage is a marathon
231,Relighting the Original Match
232,Why build now?
233,If PPC ceased to exist - who would miss it
234,Is there a crisis of integrity in USA?
235,Price is a prime consideration
236,Are we ready for a new century?
237,Called for such a time as this?
238,When our faith is in a slump?
239,God so loved – why?
240,Are you rich toward God?
241,What Is success?
242,When?
243,On Forgetting to say 'Thank You'
244,The bootstrap fallacy
245,The foundations of happiness
246,They brought him gifts
247,Christmas - What happened to it?
248,Is there room for one more?
249,The secret of living is giving
250,A match made in heaven
251,A match made in heaven
252,Beware of hasty conclusions
253,The platinum rule
254,When your principles are under pressure
255,What Do You Want Us To Do
256,We all have our scars
257,The kind of prayer that cleanses
258,Are you listening God?
259,I dream of having a praying church
260,Does the Cloud Over the Oval Office reflect us
261,David - a man after God's own heart
262,A nobody becomes somebody
263,Dealing with giants
264,Cast me not away
265,David as a friend
266,David at his best in the wilderness
267,Blessed to Give & Blessed by Receiving
268,The ABC's of the Last Supper
269,David as an adversary
270,What Kind of World Do We Have--Diverse or Divided?
271,The Things That a Family Must Have
272,Who decides about family values?
273,Challenge of being a single Christian
274,The picture of the Ideal marriage
275,We are building a church for all seasons
276,The tabloids and the tongue
277,Remembering the good old days
278,"Our children, the final test"
279,B.H.A.G.
280,Come Before Winter
281,Who am I?
282,What to tell my children about the crisis In D.C?
283,How will I be remembered?
284,Am I travelling alone?
285,"Jesus loves me, this I know"
286,All the way my savior leads me
287,Lead on - oh King eternal
288,Give of your best to the master
289,Now thank we all our God
290,Just as I am without one plea
291,Sometimes too much is not enough
292,Contrasting moods of Christmas
293,What can we give Jesus for Christmas?
294,Gloria in excelsis
295,The song that Mary sang
296,"New Years tensions: come back this way, go another way"
297,The limits of tolerance
