id,title
0,Security monitoring system and method
1,Mask construction for profile correction on an RFID smart label to improve print quality and eliminate detection
2,Mounting clip having a wireless communication device
3,Handle tag for identification of a container
4,RFID enabled corrugated structures
5,Resilient member with wireless communication device
6,Deployable identification device
7,Method and system for forming RF reflective pathways
8,RFID temperature device and method
9,Security bag
10,Continuous feedback container security system
11,Method for forming electrically conductive pathways
12,Methods and apparatus for location determination based on dispersed radio frequency tags
13,System and method to enhance security of shipping containers
14,Smart and secure container
15,RFID based security network
16,RFID reader for a security network
17,System and method for monitoring individuals and objects associated with wireless identification tags
18,Cordless telephone system
19,Controller for a security system
20,RFID reader for a security system
21,Multi-controller security network
22,RFID transponder for a security system
23,Communications architecture for a security network
24,Communications control in a security system
25,"Systems, methods, and apparatus for monitoring a container associated with an item"
26,Device enrollment in a security system
27,"Tamper monitoring article, system and method"
28,System and method for tracking inventory
29,Life raft container security system and method
30,Clip for RFID transponder of a security network
31,Device and method for identifying a container
32,System and method for monitoring a portable article
33,Base pan and cabinet for an air conditioner
34,System and device for detecting object tampering
35,Multi-level meshed security network
36,Container inspection system
37,Tamper-resistant electronic seal
38,"Method, device systems and computer programs for producing and tracing printed documents with a determinate identifier"
39,Smart container monitoring system
40,Storage container smart collar
41,Smart container monitoring system
42,Cargo security sensing system
43,Method of forming an RF circuit assembly having multiple antenna portions
44,RFID asset identification systems
45,Tamper monitoring system and method
46,Electronic locking seal
47,RFID tag label
48,Component diversity in a RFID security network
49,Portable telephone in a security network
50,Fixed part-portable part communications network for a security network
51,"RFID devices for verification of correctness, reliability, functionality and security"
52,System and method for tracking inventory
53,Device and method for identifying a container
54,Smart container monitoring system
55,"Integrated tracking, sensing, and security system for intermodal shipping containers"
56,Locking apparatus for shipping containers
57,Shipping container integrity device and system
58,Shipping container integrity device and system
59,Method and apparatus for varying signals transmitted by a tag
60,Semiconductor device and manufacturing method thereof
61,System and method for tracking inventory
62,Shipping container security process
63,Security packaging
64,System and method for tracking inventory
65,Status detector and communication unit and system for remote tracking of padlocks
66,Communicating radio frequency modem for intrusion detection and tracking
67,Point of sale inductive systems and methods
68,Point of sale inductive systems and methods
69,Semi-covert RFID enabled containers
70,RFID enabled paper rolls and system and method for tracking inventory
71,RFID based security system
72,Controller for a security system
73,System and method to enhance security of shipping containers
74,Continuous feedback container security system
75,RFID reader for a security network
76,Cordless telephone system
77,RFID based security network
78,Configuration program for a security system
79,Life raft container security system and method
80,Water air land tracks baggage identification locator computer product and methods
81,Monitorable sealing cable lock
82,System and method to enhance security of shipping containers
83,Anti-theft method for detecting the unauthorized opening of containers and baggage
84,Anti-theft method for detecting the unauthorized opening of containers and baggage
85,Vorrichtung und Verfahren zur �berwachung von Beh�ltern
86,"Method, device systems and computer programs for producing and tracing printed documents with a determinate identifier"
87,Container surveillance system
88,Continuous feedback container security system
89,Monitorable locking assemblies
90,Method of forming rfid circuit assembly
91,System and device for detecting object tampering
92,Cargo security sensing system
93,Status detector and communication unit and system for remote tracking of padlocks
94,Tracking and control of personal effects
