id,title
0,We don't blog much
1,Manual versus Mechanical
2,Bike to the moon
3,Shaking My Head
4,How do I handle a group ride?
5,what brings out the sarcastic in you?
6,Insert inspirational cycling lesson here... ;)
7,Horror stories!
8,Movie/Actor Game
9,The Song Game
10,Clipping in
11,June challenge
12,Bands or Singers A-Z
13,Rant about boyfriend!
14,Squeee! Another 'what bike' question
15,Make a sentence from this word
16,what do friends say about your sense of humor?
17,The Celebrity Name Game
18,Hi all
19,Perhaps a Strange Question?
20,Performance Statistics
21,The Best Bike Ride in Every State...?
22,Riding Conditions
23,What Bike?
24,Fictional characters A to Z
25,A-Z: Television Shows
26,Poll: What bike do you ride?
27,April Challenge
28,Plans for the Spring
29,Anyone have kids used to crap food? I need help!
30,List Things That REALLY Push Your Buttons!
31,Sing along with the Sarcastics
32,"Advice for working in practice, A-Z"
33,New to this team
34,What Is the Dumbest Thing You Witnessed Today?
35,"Saddle Soreness: Tips for Riding ""Lighter"""
36,Getting my Bike legs! (I'm freaking out here)
37,stock market tip
38,What purpose does compression anything have?
39,Anyone???
40,Discuss Week 3 Here
41,Bike recommendations
42,February Goals
43,January challenge --getting to the core
44,Discuss Week 2 Here
45,How did you get started cycling?
46,How do you bundle up for cold rides?
47,The days are getting shorter...
48,New Member Intro
49,"Lost Job, Rode Bike: 1800 Miles!!"
50,Pain in the seat
51,Knot your shoe ties or wear velcro!
52,November Challenge--Prep for the winter
53,Hi from a sluggish starter
54,Three Syllable Words A to Z
55,A-Z girls names
56,Sorry to be MIA!
57,2012 Mile Tracker
58,hello girls!
59,Greetings from Louisiana
60,Introduce yourself here...at your own risk...
61,What do you personally wear when winter cycling?
62,Shall we define New Goals/
63,Just for fun--favorite holiday movie!
64,HAVING FUN WITH GOODIE GIFTING
65,Just for fun--what holiday song do you HATE?
66,December challenge - love your bike!
67,10 Bike Fit Myths... Debunked
68,Most Embarrasing Moment...
69,What's on your gift list?
70,What Exercises Do You Do to Improve Performance
71,Do you do your own repairs?
72,"Playing through, or laying back?"
73,Hi! Looking for advice
74,What exercise did you do today?
