id,title
0,Airless syringe
1,Fluid management and component detection system
2,Contrast media injection apparatus
3,Pressure sleeve assembly
4,Fluid injection apparatus with improved contrast visualization
5,"Light, thin, and flexible medication infusion apparatuses attachable to user's skin"
6,Hydraulic remote for a medical fluid injector
7,System for detecting air
8,Fluid injection system for coronary intervention
9,"Weight dependent, automatic filling dosage system and method of using same"
10,Pressure sleeve assembly
11,System for detecting air
12,Injector system and fluid control device providing sharp bolus injection
13,System for detecting air
14,Fluid delivery system having a fluid level sensor and a fluid control device for isolating a patient from a pump device
15,Injector
16,Injector
17,Control device for a fluid delivery system
18,"Devices, systems and methods for determining parameters of one or more phases of an injection procedure"
19,Malfunction detection with derivative calculation
20,Hydraulic remote for a medical fluid injector
21,Drip chamber and fluid level sensing mechanism for a fluid delivery system
22,Flow based pressure isolation mechanism for a fluid delivery system
23,Catheter fluid control system
24,Disposable pumping system and coupler
25,Method and system for removing air from a flow path of a fluid injection device
26,Syringe mount for a medical fluid injector
27,Medical fluid injection system
28,Balloon inflation device
29,Fluid delivery system including a valve and a pressure transducer
30,Medical fluid injection system
31,Injector
32,Method and system for removing air from a flow path of a fluid injection device
33,Simulated contrast injection medium
34,Flow based pressure isolation mechanism for a fluid delivery system
35,Disposable pumping system and coupler
36,Multi-fluid medical injector system and methods of operation
37,Syringe with flow control valves and associated methods
38,Fluid mixing control device for a multi-fluid delivery system
39,Method of preparing for a fluid injection procedure using a medical injector and a syringe
40,Fluid injection apparatus with improved contrast visualization
41,System for detecting air
42,Injector system and fluid control device providing air purging and sharp bolus injection
43,Safety device for an infusion pump
44,Hydraulic remote for a medical fluid injector
45,Injector
46,Injector
47,Air propelled party streamer device
48,"Pressure isolation mechanisms, method of use thereof and fluid delivery systems including pressure isolation mechanisms"
49,Catheter Fluid Control System
50,Cardiac ablation system with inflatable member having multiple inflation settings
51,Disposable Pumping System and Coupler
52,具有流量控制阀的注射器和相关方法
53,Medical fluid injection system
54,Medical fluid injection system
55,Medical fluid injection system with stored injection parameters
56,Method to provide graphical setup information to a user of a powered medical fluid injection system
57,Catheter fluid control system
58,Fluid injection apparatus with improved contrast visualization
59,Syringe with flow control valves and associated methods
