id,title
0,WORD ASSOCIATION
1,A to Z words ending ING
2,birds a-z
3,Movies... A to Z Titles
4,Bands or Singers A-Z
5,Animals A-Z!!!!
6,Ready to lose the baby weight!!!
7,NEW!! Last names A to Z
8,Name a place: Alphabetically
9,Another MOVIE game...see if we can keep this going
10,Spelling Bee (10+ letter words A-Z)
11,Two words - change one
12,GIRLS names A to Z
13,COLORS...A-Z
14,"A-Z words ending in ""Y"""
15,Show How You Feel Today With an Emoticon
16,Last Fruit Eaten?
17,Word Association II
18,A - Z Boy names
19,Post Any Emoticon
20,What color is your shirt today?
21,I Am (alphabetically)
22,Did you eat breakfast? If so what?
23,A - Z BODY PARTS
24,CHANGE A LETTER
25,Chaneg one letter to make a new word
26,A-Z girls names
27,5 Letter Words! (From A-Z)
28,Three Syllable Words A to Z
29,Change one of 5 letters or rearrange them
30,Quick:the first word that comes in your mind?
31,A - Z girl names
32,The chase is on... help kitty stay ahead of doggy
33,BOYS names A to Z
34,PETS NAMES A -Z
35,Did You Excercise Today?
36,What are you watching on TV?
37,How many minutes exercise have you done today?
38,Songs that mention an Exercise
39,Keep the Bunny hopping along!!!
40,A to Z song titles
41,What good decision did you make today?
42,Are You Happy Right Now?
43,Need exercise name...please help
44,What did you eat for supper today?
45,What was your Cardio of the Day?
46,"A-Z words ending in ""ed"""
47,A-Z Things in the Room With You
48,Name an old television show
49,What kind of fruit did you last eat?
50,Girls Names using last letter as first
51,A - Z Occupations
52,My favorite part of my body today is....
53,Did you exercise today?
54,What is your exercise plan for today?
