id,title
0,PV201L: Solar Electric Lab Week (Grid-Direct)
1,PV301L: Solar Electric Lab Week (Battery-Based)
2,RDOL101: Appropriate Technology for the Developing World
3,PVOL202: Advanced PV System Design & the NEC (Grid-Direct)
4,PVOL206: Solar Business & Technical Sales
5,PVOL101: Solar Electric Design & Installation (Grid-Direct)
6,PVOL303: Advanced Battery-based PV System Design Series 1
7,PVOL202: Advanced PV System Design & the NEC (Grid-Direct)
8,PVOL206: Solar Business and Technical Sales - Online
9,PVOL101: Solar Electric Design & Installation (Grid-Direct)
10,PVOL303: Advanced Battery-based PV System Design: Series I
11,"PV203 PREP: Battery-based PV System Fundamentals, online"
12,PV351L: PV Systems-Tools & Techniques for O&M (Grid-direct)
13,PV201L: Solar Electric Lab Week (Grid-direct) for Women
14,PV101: Solar Electric Design & Installation (Grid-Direct)
15,PVOL202: Advanced PV System Design & the NEC (Grid-Direct)
16,PVOL101: Solar Electric Design & Installation (Grid-Direct)
17,Community Energy Transformations: Fort Collins Case Study
18,SHOL101: Solar Hot Water Design and Installation
19,PVOL304: Advanced Battery-based PV System Design: Series II
20,"PV203 PREP: Battery-based PV System Fundamentals, online"
21,PV203 - PV Systems Design and Installation - Workshop
22,PV201 - PV Design and Installation - Online
23,PV203 PV Systems Design and Installation Workshop
24,Fronius Service Provider Training
25,Fronius Service Provider Training
26,Fronius Service Provider Training
27,Fronius Service Provider Training
28,Fronius Service Provider Training
29,BPI Building Analyst and Envelope Professional
30,RESNET HERS Rater
31,REPV: Renewable Energy Generation with Photovoltaics
32,RESNET HERS Rater
33,REST: Renewable Energy Generation with Solar Thermal Systems
34,ONLINE REPV: Renewable Energy with Photovoltaic Systems
35,PV Technical Sales
36,BPI Building Analyst and Envelope Professional
37,LEED GREEN ASSOCIATE (2 day)
38,REPV(A): Advanced Design & Installation of Photovoltaic Sys
39,Homebrew Wind Power - Wind Turbine Design and Construction
40,Austin Community College ~ ELMT 2275 – Solar Thermal Systems
41,ImagineSolar | Advanced PV Project Experience Feb | 6 - 10
42,ACC-ELMT 2372 – Energy Efficient Structures and Assessments
43,ImagineSolar | Advanced PV Project Experience | Nov 7 - 11
44,Austin Community College ~ ELMT 2474 - Solar PV Systems
45,Advanced Lab Day: Solar PV Design & Installation | August 29
46,Austin Community College ~ WIND 2359 – Wind Power Systems
47,"Free SolarEdge Workshop | Austin, TX | August 6, 2015"
48,Austin Community College ~ ELMT 2276 - Solar PV Installation
49,ImagineSolar | Online Smart Grid and Distributed Generaton
50,Advanced Lab Day: Solar PV Design & Installation | Nov 7
51,ImagineSolar | Advanced PV Project Experience Aug 29 - Sep 2
52,ImagineSolar | Online Solar PV Economics and Technical Sales
53,Solar Fundamentals 1A - Online
54,Solar Fundamentals 1A - Online
55,Solar Fundamentals 1B - Online
56,Solar Fundamentals 1B - Online
57,Solar Fundamentals 1B - Labs
58,Solar Fundamentals 1A - Labs
59,Building Energy Analytics
60,Deep Energy Retrofits
61,Passive House in the Real World
62,Basic Photovoltaics Online
63,Introduction to Tower Climbing and Safety
64,Wind Turbine Repair and Maintenance
65,Solar Domestic Hot Water Systems Online
66,PV Site Assessor Training Online
67,Solar Space Heating Systems Online
68,Small Wind Site Assessor Training Online
69,PV Sales and Finance Online
70,Basic Photovoltaics Online
71,PV System Design (Online)
72,Solar Space Heating Systems
