id,title
0,"Chaparral Kennel Club, Inc."
1,Heart Of The Plains Kennel Club
2,"Cornhusker Kennel Club Of Lincoln, Nebraska, Inc."
3,Plum Creek Kennel Club Of Colorado
4,"Santa Clara Valley Kennel Club, Inc."
5,"Hutchinson Kennel Club, Inc."
6,Flatirons Kennel Club
7,"Austin Kennel Club, Inc."
8,Conyers Kennel Club Of Georgia
9,Grand Valley Kennel Club
10,"San Mateo Kennel Club, Inc."
11,Gold Country Kennel Club
12,Evergreen Colorado Kennel Club
13,"Fort Bend Kennel Club, Inc."
14,"Orange Empire Dog Club, Inc."
15,San Jacinto Kennel Club
16,Minnesota River Valley Kennel Club
17,"Greater Emporia Kennel Club, Inc."
18,"Tidewater Kennel Club Of Virginia, Inc."
19,Seminole Kennel Club
20,"Santa Cruz Kennel Club, Inc."
21,Metro Mile Hi Kennel Club
22,"Oklahoma City Kennel Club, Inc."
23,"Kettle Moraine Kennel Club, Inc."
24,St. Charles Missouri Kennel Club
25,"Sun Maid Kennel Club Of Fresno, Inc."
26,Dubuque Kennel Club
27,"Palouse Hills Dog Fanciers, Inc."
28,"Illinois Valley Kennel Club Of Peoria, Inc."
29,"Olympic Kennel Club, Inc."
30,Cheyenne Kennel Club
31,Gloucester Kennel Club Of Virginia
32,"San Mateo Kennel Club, Inc."
33,Garden City Kansas Kennel Club
34,"Denton Kennel Club, Inc."
35,Metro Mile Hi Kennel Club
36,"Southern Maryland Kennel Club, Inc."
37,"Donner Trail Kennel Club, Inc."
38,Greater Orange Park Dog Club
39,Seward County Kennel Club
40,Hawkeye Kennel Club
41,"Jupiter-Tequesta Dog Club, Inc."
42,"Buckhorn Valley Kennel Club, Inc."
43,"Richland Kennel Club, Inc."
44,Canada Del Oro Kennel Club
45,West Central Oklahoma Kennel Club
46,Skyline Dog Fanciers Of San Mateo County
47,Kansas Toy Dog Club
48,Camellia Capital Kennel Club
49,"Rogue Valley Kennel Club, Inc."
50,Sangre De Cristo Kennel Club
51,Kanadasaga Kennel Club
52,"Santa Maria Kennel Club, Inc."
53,"Roaring Fork Kennel Club, Inc."
54,Gallatin Dog Club
55,Oakland Kennel Club
56,"Puyallup Valley Dog Fanciers, Inc."
57,"Okaloosa Kennel Club, Inc."
58,Scottsbluff Kennel Club
59,Chief Solano Kennel Club
60,Kennel Club Of Pasadena
61,Snake River Canyon Kennel Club Of Idaho
62,Sedalia Kennel Club
63,"Lawrence Jayhawk Kennel Club, Inc."
64,"Sierra-tuolumne Kennel Club, Inc."
65,"Waukesha Kennel Club, Inc."
66,Rio Pecos Kennel Club
67,Sooner State Kennel Club
68,Lakeland Winter Haven Kennel Club
69,Canada Del Oro Kennel Club
70,Scottsbluff Kennel Club
71,Chief Solano Kennel Club
72,"Illinois Valley Kennel Club Of Peoria, Inc."
73,Cambridge Minnesota Kennel Club
74,Mckenzie Cascade Dog Fanciers
75,"Wisconsin Kennel Club, Inc."
76,Sedalia Kennel Club
77,Cheyenne Kennel Club
78,Gallatin Dog Club
79,"Chaparral Kennel Club, Inc."
80,"Tri-state Kennel Club, Inc."
81,Conroe Kennel Club
82,Greater Humble Area Kennel Club
83,Camellia Capital Kennel Club
