id,title
0,FSNamesystem initialization failed
1,How to make Hadoop listen on multiple network interfaces ?
2,Question about Data Node configuration
3,Re: Text files vs. SequenceFiles
4,Re: create error
5,Re: Partitioned Datasets Map/Reduce
6,Re: what affects number of reducers launched by hadoop?
7,Question regarding Shuffle
8,Help Regarding MAPREDUCE
9,Re: Question regarding Shuffle
10,how to compile HADOOP
11,What is it??? help required
12,What is IPC classes for???
13,Re: What is IPC classes for???
14,how to add jar file to hadoop
15,Re: how to add jar file to hadoop
16,compiling issues hadoop
17,Re: decomission a node
18,Re: Killed : GC overhead limit exceeded
19,Re: REST web service on top of Hadoop
20,"Re: FAQ for ""New to Hadoop"""
21,Re: HDFS without Consideration for Map and Reduce
22,Re: java.lang.OutOfMemoryError: Java heap space
23,Re: java.lang.OutOfMemoryError: Java heap space
24,Re: java.lang.OutOfMemoryError: Java heap space
25,Re: java.lang.OutOfMemoryError: Java heap space
26,Re: java.lang.OutOfMemoryError: Java heap space
27,Re: java.lang.OutOfMemoryError: Java heap space
28,Re: java.lang.OutOfMemoryError: Java heap space
29,Re: Hadoop Streaming
30,Re: Seperate Server Sets for Map and Reduce
31,Re: Is it possible to use NullWritable in combiner? + general question about combining output from many small maps
32,Re: Is it possible to use NullWritable in combiner? + general question about combining output from many small maps
33,Re: Distance Calculation problem
34,Re: REST web service on top of Hadoop
35,Re: error:Caused by: java.lang.ClassNotFoundException: com.hadoop.compression.lzo.LzopCodec
36,Re: Intermediate files generated.
37,Re: Text files vs. SequenceFiles
38,Re: What is it??? help required
39,Re: Please help! Corrupt fsimage?
40,Re: Question about Data Node configuration
41,Re: What is IPC classes for???
42,"Re: jobtracker.jsp reports ""GC overhead limit exceeded"""
43,"Re: jobtracker.jsp reports ""GC overhead limit exceeded"""
44,Question about LZO(Caused by: java.lang.ClassNotFoundException: com.hadoop.compression.lzo.LzopCodec)
45,Lzo question
46,LZO Question
47,LZO Question
48,Re: Lzo question
49,error:Caused by: java.lang.ClassNotFoundException: com.hadoop.compression.lzo.LzopCodec
50,Re: error:Caused by: java.lang.ClassNotFoundException: com.hadoop.compression.lzo.LzopCodec
51,How to get lzo compression library loaded?
52,Re: problem with rack-awareness
53,Re: decomission a node
54,Re: iozone is not working with HDFS over libfuse
55,Re: HDFS without Consideration for Map and Reduce
56,"Re: How do I remove ""Non DFS Used""?"
57,Re: Question about Data Node configuration
58,Re: WARN util.NativeCodeLoader: Unable to load native-hadoop library
59,Re: using 'fs -put' from datanode: all data written to that node's hdfs and not distributed
60,Re: Thoughts about Hadoop cluster hardware
61,Re: WARN util.NativeCodeLoader: Unable to load native-hadoop library
62,Re: WARN util.NativeCodeLoader: Unable to load native-hadoop library
63,Re: WARN util.NativeCodeLoader: Unable to load native-hadoop library
64,Re: How to control the number of map tasks for each nodes?
65,Re: How to control the number of map tasks for each nodes?
66,Re: Is it safe to set default/minimum replication to 2?
67,Re: HDFS without Consideration for Map and Reduce
68,Re: Hadoop Streaming
69,Re: Hadoop Streaming (with Python) and Queue's
70,Re: StreamXmlRecordReader and gzip
71,Re: Concurrent Mappers
72,Re: getJobID and job handling
73,HDFS without Consideration for Map and Reduce
74,Re: HDFS without Consideration for Map and Reduce
75,Re: HDFS without Consideration for Map and Reduce
76,Next Release of Hadoop version number and Kerberos
77,Re: Next Release of Hadoop version number and Kerberos
78,RE: processing xml files
79,Re: HDFS InputStream and ZipFiles
80,Re: Question regarding Shuffle
81,Re: Distributed Updateable Cache
82,rebalancing replication help
83,RE: rebalancing replication help
84,RE: decommissioning nodes help
85,RE: decommissioning nodes help
86,Hadoop Shutdown Hook
87,Re: how to do a reduce-only job
88,Re: Single Node with multiple mappers?
89,Re: manipulate counters in new api
90,mapside joins
91,Re: Chukwa questions
92,Chukwa questions
93,Preventing/Limiting NotReplicatedYetException exceptions
94,Is it safe to set default/minimum replication to 2?
95,Fwd: Re: Preventing/Limiting NotReplicatedYetException exceptions
96,Re: Preventing/Limiting NotReplicatedYetException exceptions
97,Re: Preventing/Limiting NotReplicatedYetException exceptions
98,"Namenode throws NPE, won't start"
99,Seattle Hadoop Day! August 14th
100,1 · 2 · 3 · 4 · 5 · Next »
