id,title
0,PUT YOUR MAY CELEBRATIONS HERE
1,Let's Chat & Get Support
2,How many times?
3,Use an Emotion to show how your feeling today.
4,Your favorite character?
5,Top Ten Resturants
6,Your favorite park? ride?
7,MANY Changes Coming
8,How Many Log In Points Did You Get Today?
9,A VERY SPECIAL BIRTHDAY!!
10,FAVORITE SITCOM GROWING UP
11,FAVORITE FOOD
12,Eat it or give it away?
13,The Biggest Loser
14,Anyone experience...
15,Final Loser; WEIGH IN WEEK FIVE
16,Ruby Say's Let Us Chat & Ask For Support Here
17,Final Loser; Weigh in WEEK FOUR
18,Final Loser; Weigh in WEEK THREE
19,Sign up for Christmas in July challenge!
20,Final Loser; Weigh in WEEK TWO
21,Final Loser; Weigh in WEEK ONE
22,Final loser daily challenge!
23,Final Loser support chat!
24,Final Loser: STARTING WEIGH IN
25,weight loss comparision chart
26,later in the summer?
27,Do you get home sick?
28,Have you watched
29,Send a Goodie game!
30,Check out the new thread on the Ruby WFN team
31,Ruby Says It's Hot
32,Heat?
33,Thank you!!
34,Post Your May Celebrations Here
35,Do you own....
36,Discuss Ruby Episodes here
37,Post Your March celebrations here
38,Ideal Protein Diet
39,Ruby Lite Needs our help
40,Sign up for Rootin' for Ruby's Spring Challenge!
41,What is your neighborhood pet peeve?
42,Pet Peeve About Cleaning
43,Ruby Premiere
44,Name A TV Show You Watch
45,Ruby
46,Ruby-Lite needs support!
47,CLOSED: NO MORE SIGN UPS
48,How many minutes of Zumba did you do today?
49,How are you feeling about your progress in June?
50,"CLOSED...no more sign ups, sorry!"
51,Voted Most Popular Blog
52,Have you ever been?
53,Have you ever raised a farm animal?
54,Have you been to you High School reunion?
55,CLOSED
56,THANK YOU!!!!
57,How old....
58,Talk about Ruby/ Discuss Ruby Episodes
59,Have you ever been in a car accident?
60,How are you feeling about your progress in April?
61,What are your secrets??? :)
62,"Wrinkle cream, moisturizers, and exfoliators"
63,Favorite perfume?
64,Hi make-up mamas!
65,30 DAY SHRED (JM) Together!!! - 1 MONTH CHALLENGE
66,Ruby's new book
67,How far away from your birthplace do you live now?
68,The Biggest Loser
69,"Daily ""Shred"" Check In"
70,Closed
71,April Challenge - I Dare You ... Spark Streaks
72,HI!
73,What Curly Hair Type Are You?
74,Do you shampoo your hair?
