id,title
0,Start a new thread within this topic
1,Present ideas for 15yo
2,Christmas organiser app?
3,What are your children still playing with almost 7 months on...
4,AIBU to wish it was Christmas now?!
5,Christmas Bargain Thread: The Prequel 2015
6,Sylvanians
7,How many days till Christmas 2015 then.............?
8,What to do with old decorations.
9,Present for 11 year old boy
10,Budgets for small children
11,Present ideas for 19 year old niece
12,Xboxone or ps4?
13,Progress report on Christmas 2015
14,when does lego land xmas opening start to go on sale? visiting santa etc
15,No clue what to get a 1yo and a 4yo
16,Must have this Christmas
17,What can I do with this?!
18,Ideas for a 6yo ds and a 8 yo dd
19,Christmas Decorating - minimal spend
20,Homemade gifts non alcoholic -something a bit special
21,Home made gifts - rhubarb vodka?
22,Thomas Land at Christmas
23,Starting from scratch for Christmas..
24,"Those hoop the hoop car track things - what are they called, which do you recommend?"
25,Please help me make a directory of alternative shops/sellers that make hand made beautiful items...
26,Celebrating Christmas in July for my disabled son
27,Christmas present - where would I get a microphone/disco lights like these (link attached)?
28,Best christmas present buying money saving tip...
29,I know what date it is before you ask... am planning Christmas food anyone want to help?
30,Present for 10 Year old girl
31,Gift wrap
32,Oh come all ye Countdowners
33,Our Generation Dolls - are they worth it?
34,Can you help motivate me?
35,Joint Present for a five and nearly three year old
36,Christmas Birthdays
37,Best place to visit Santa Herts/Beds
38,Amazon Prime Day - Wed 15th July
39,What are junior school girls into?
40,John Lewis Christmas shop appears to be open online...
41,"What can I start buying now, ready for a 3 yo and almost 11 yo?"
42,Ideas for 1 year old....
43,Your favourite Christmas outings?
44,Minions!
45,Harry Potter World in the Snow
46,Ideas to keep Christmas exciting for my only child
47,Heads up - Christmas UK 'wakes up' on Thursday
48,Website for getting organised
49,Christmas bargain thread 2015 - presents for teens ( in pictures) !
50,Now I know it's early...
51,Start a new thread within this topic
