id,title
0,Solar Thermal Site Assessor Training Online
1,PV301L: Solar Electric Lab Week (Battery-Based)
2,ImagineSolar | Online Solar PV Economics and Technical Sales
3,"Free SolarEdge Workshop | Austin, TX | August 6, 2015"
4,ImagineSolar | Online Smart Grid and Distributed Generaton
5,BPI Building Analyst and Envelope Professional
6,Fronius Service Provider Training
7,Fronius Service Provider Training
8,Community Energy Transformations: Fort Collins Case Study
9,Fronius Service Provider Training
10,Fronius Service Provider Training
11,Fronius Service Provider Training
12,PVOL206: Solar Business and Technical Sales - Online
13,PV203 - PV Systems Design and Installation - Workshop
14,PV351L: PV Systems-Tools & Techniques for O&M (Grid-direct)
15,"PV203 PREP: Battery-based PV System Fundamentals, online"
16,PVOL202: Advanced PV System Design & the NEC (Grid-Direct)
17,PVOL303: Advanced Battery-based PV System Design: Series I
18,PVOL101: Solar Electric Design & Installation (Grid-Direct)
19,Solar Fundamentals 1B - Online
20,Austin Community College ~ WIND 2359 – Wind Power Systems
21,Austin Community College ~ ELMT 2474 - Solar PV Systems
22,Austin Community College ~ ELMT 2275 – Solar Thermal Systems
23,PV201L: Solar Electric Lab Week (Grid-direct) for Women
24,ACC-ELMT 2372 – Energy Efficient Structures and Assessments
25,Austin Community College ~ ELMT 2276 - Solar PV Installation
26,ImagineSolar | Advanced PV Project Experience Aug 29 - Sep 2
27,Advanced Lab Day: Solar PV Design & Installation | August 29
28,Basic Photovoltaics Online
29,PV201 - PV Design and Installation - Online
30,Solar Fundamentals 1A - Online
31,Introduction to Tower Climbing and Safety
32,Wind Turbine Repair and Maintenance
33,Passive House in the Real World
34,Building Energy Analytics
35,Deep Energy Retrofits
36,PV System Design (Online)
37,REPV: Renewable Energy Generation with Photovoltaics
38,PV101: Solar Electric Design & Installation (Grid-Direct)
39,PV203 PV Systems Design and Installation Workshop
40,Homebrew Wind Power - Wind Turbine Design and Construction
41,PVOL304: Advanced Battery-based PV System Design: Series II
42,"PV203 PREP: Battery-based PV System Fundamentals, online"
43,PVOL101: Solar Electric Design & Installation (Grid-Direct)
44,Solar Domestic Hot Water Systems Online
45,SHOL101: Solar Hot Water Design and Installation
46,PVOL202: Advanced PV System Design & the NEC (Grid-Direct)
47,RESNET HERS Rater
48,PV201L: Solar Electric Lab Week (Grid-Direct)
49,Solar Space Heating Systems
50,PV301L: Solar Electric Lab Week (Battery-Based)
51,Solar Space Heating Systems Online
52,PV Site Assessor Training Online
53,Small Wind Site Assessor Training Online
54,ONLINE REPV: Renewable Energy with Photovoltaic Systems
55,REST: Renewable Energy Generation with Solar Thermal Systems
56,Solar Fundamentals 1A - Labs
57,Solar Fundamentals 1B - Labs
58,PV Technical Sales
59,Solar Fundamentals 1A - Online
60,REPV(A): Advanced Design & Installation of Photovoltaic Sys
61,Solar Fundamentals 1B - Online
62,ImagineSolar | Advanced PV Project Experience | Nov 7 - 11
63,Advanced Lab Day: Solar PV Design & Installation | Nov 7
64,PVOL206: Solar Business & Technical Sales
65,RDOL101: Appropriate Technology for the Developing World
66,PVOL101: Solar Electric Design & Installation (Grid-Direct)
67,PVOL303: Advanced Battery-based PV System Design Series 1
68,PVOL202: Advanced PV System Design & the NEC (Grid-Direct)
69,PV Sales and Finance Online
70,Basic Photovoltaics Online
71,BPI Building Analyst and Envelope Professional
72,LEED GREEN ASSOCIATE (2 day)
73,RESNET HERS Rater
74,ImagineSolar | Advanced PV Project Experience Feb | 6 - 10
