id,title
0,I want to believe... That
1,Before we go too far...
2,Per Scout...
3,I would love for this to be
4,Coffee now (Pacific time
5,You threw me by not
6,The sandbagging is getting
7,Thanks for this discussion. I
8,"In general, I roll my eyes at"
9,Bullets
10,I think the assumption is
11,Absolutely. I'm hoping that
12,Smith
13,I'm listening on my iPhone
14,Wow... Make sure to listen to
15,Re: SAM
16,I now look forward to
17,Brian has done a lot of
18,"Jebus, the content this week..."
19,"Hello: Ross Douglas, per"
20,Very interesting that his
21,OT Taylor Decker
22,Speaking of Brandon Graham...
23,Best recruit since Jerod Ward in 1994.
24,I don't think we'd need
25,I guess I can understand it
26,"""Did I hit somebody? Did I"
27,Counter-programming to
28,Serious question for anyone
29,Meridian Pint or RedRocks on
30,Now a fun one...
31,Feels good to see Michigan
32,I have no problem with the
33,Six Zero better get to work...
34,And then he created...
35,Slight correction...
36,"There was a clear ""break his"
37,Also have to remember that
38,This is intended to be a slam
39,As far as I can tell...
40,"""To summarize them all, I"
41,His analysis is
42,I understand the sentiment of
43,I'm okay with this...
44,That answers that question.
45,We're referring to it as the snowpacalypse...
46,Warren leaving has no impact...
47,Ezeh was bad; no doubt. But
48,Don't read too much into his comments.
49,What I saw that gives me confidence...
50,"Decent, yes."
51,Carvin Johnson
52,The takeaway from this...
53,I'm thinking of cashing in my tickets...
54,"Honestly, I hope I never run into a player again."
55,My guess: Brian's been
56,MGoBlog was always a great
57,That he's not leaving until
58,Does this cast equal doubt on
59,Speaking of Sparty comparisons...
60,"Agree, reluctantly."
61,Whether he is taking credit
62,Also confused by the line...
63,Thank Jebus...
64,There's maybe one or two
65,"In all seriousness, this"
66,"Stupid question, but..."
67,Until the recent regional
68,All of them.
69,Yes. ESPN2.
70,Good to hear.
71,Agreed.
72,Always felt a little meh...
73,30-70 lbs?
74,Very nice pickup for Beilein
75,The definition of. Well
76,Added bonus...
77,Absolutely agree; however...
78,I nominate Chase Daniel.
79,I hope the Fightin' Creamsicles...
80,I got the sense that Cissoko
81,It was a cheap shot.
82,"Look, I'm a homer too, but..."
83,What was the logic behind
84,It's all relative...
85,I'm having difficulty
