id,title
0,"By the way, love the Antione"
1,Pretty sure the water just
2,Plus he looks just like
3,Love that clip. Everitt
4,Won't be able to call it a
5,I think we are going to have
6,Can't comment on Justified
7,"Yeah, no GoT really sucks."
8,"Hmmmn, interesting news but"
9,"Wow, so much negativity. I"
10,Rorschach Test
11,I'd be really pissed if I
12,I have no problem holding the
13,Seems like stability to the
14,Yep GoT and Walking Dead are
15,Not so fast. We're still in
16,I'm surprised no programs
17,I don't have any inside info
18,I only drink at work. My
19,It says the University of
20,Unfortunately Stidham just
21,From Twitter
22,"Unfortunately, I saw a"
23,"From what I heard, Nicholson"
24,What About Gibbons' Civil Rights?
25,I don't know about that. The
26,Shhhhh......
27,I had the opposite reaction.
28,My father's words
29,Whaaaaaa
30,What a little Diva
31,Bo almost left in '82 for money
32,MA's and Loafs
33,Ah right. Thanks for the
34,Hooligans
35,Muppets on Sunday?
36,For Profit?
37,Great idea. Shouldn't be too
38,Jeremy Clark
39,Not to pick nits but they
40,I am completely baffled as to
41,Yeah I can't believe the
42,Andrews is not a true football player.
43,I heard on another site that
44,Here is the video of
45,This is better than the
46,247 Rankings are pretty bad
47,I still effing hate Rocket
48,Yup.
49,True. I love Coach Brown.
50,Arguing with stupid people
51,"Espn put him on their ""Watch"
52,If you're still reading this
53,"Lordy lordy, look who's forty!"
54,I wish I was a baller....
55,Hoke wouldn't have answered
56,"Yep, saw the same thing on"
57,Hand specifically names Bud
58,Not sure if you're updating
59,He's been saying a lot of
60,Whatever happened to Hunt
61,Remember to click MgoBlog ads
62,I believe Reon Dawson is also
63,I don't think this makes BW look bad
64,I was trying to think of who
65,Does not compute....
66,This.
67,To your point
68,I'm glad you posted the
69,Nice Schwag
70,"Sorry for another ""I heard"""
71,I believe I saw a tweet last
72,I'd be really suprised. He
73,Snoop Pearson
74,I hate ND for a bunch of
75,I'll always remember the day
76,Scorpion!
77,Another reason to hate TAMU
78,Disagree
79,Would've been funnier if they
80,Who want to sex Mutombo?
81,I believe Shane wanted to
82,11 Warriors too
83,"In that interview, Beyer said"
84,Me too. Reminds me of the
85,Is this a trick question?
86,ugh....very sorry for the
87,A close friend of mine quit
88,"Now that you mention that, I"
89,Ondre confessed to being
90,oops sorry
91,I think he played better than
92,I read somewhere that Derrick
93,I read somewhere that Derrick
94,Unfortunately UFM is Tapping in to Cass Tech
95,Are the coaches firm @ 24 in
96,"Wow, the man does it all."
97,"Hmmmn. In this scenario, I"
98,You're the one who needs to
99,Billy Price to OT?
100,I believe USC's 2013 class
101,I agree. And I don't think
102,"oops, please delete if"
103,I was nine at the time so I
104,Funny. Tell Magnus he goes
105,I would think even someone
106,That was really cool. And
107,Taco Pants!
108,I was also suprised by the
109,This. I was especially angry
110,Perfect response. I like his
111,I think Bailey and McQuay are
112,Did Ondre say what his weight
113,Thanks for posting that.
114,High School kids do just fine
115,Sucks that we missed on Isaac
116,Lol. That's messed up dude.
117,Seems genuine to me
118,The fact that he hasn't been
119,Treadwell and done
120,We're waaay overdue
121,"Actually, yes I am. And I"
122,Sociopath?
123,I believe he is announcing at
124,No prognostication but I'm
125,"From what I hear, Dymonte"
126,Productivity loss
127,Its a mystery
128,Please don't shoot the messenger.
129,"Yeah, we really do have a"
130,We have so much talent on the
131,Saban looked like their best
132,Its a matter of depth
133,Guilty.
134,There were a few big name
135,3* Devin Butler
136,That sucks bro. I enjoyed
137,I stand corrected by the man
138,Magnus does a good job of
139,Daniels is just one of many
140,Apparently Sam Webb says the
141,"Ouch. Too soon, too soon."
142,I'm sure the coaches could
143,Isaac can play receiver too
144,Troll Alert
145,Sub-positions
146,I don't think we've seen
147,"Yep, depends on who the RB"
148,The two guys I'd love to snag
149,Seven is about the age I
150,As long as we're having
151,Haha. Ty Isaac is like a
152,Who are the other redshirt
153,Athelete
154,Michigan won a share of the
155,Recruiting
156,"Dukes, Lewis & Dawson"
157,Jabrill Peppers
158,My first thought too. I just
159,It's Ace!
160,Gideons
161,I still can't believe we got
162,Exactly
163,I'm worried that Isaac is
164,The only explanation.
165,Dymonte moved up too
166,Agree totally. Even small
167,SIAP but did it say anywhere
168,Totally agree and I'm afraid
169,"41 minutes ago on Twitter,"
170,On twitter TomVH pointed out
171,I'm listening. I think Sam
172,Ethan Pocic
173,Hilarious Gif
174,Fwiw Scout has him as a mid 3
175,Awesome show. And the only
176,There are a bunch of big
177,Sounds like we'll have plenty
178,Deveon Smith
179,Deveon Smith
180,Warren Sapp
181,I love your optimism.
182,Post a link so we can at
183,"Lol, what a jerk."
184,"Wow, this really really"
185,Thanks for posting that.
186,I don't think the board is
187,Teabagging is a sex crime? I
188,Great. I hope its on par
189,If we were going to take 2 wr
190,I hope not. We're almost as
191,Totally agree. Thats why I
192,I didn't see a rating for him
193,I think he's visiting Jan
194,If anyone finds that deal
195,I bet you had some epic
196,Its not beyond the realm of
197,Good pickup. I like that
198,I would rather have Pharaoh
199,Molk to Lions
