id,title
0,Customer Appreciation Golf Outing Postponed
1,4-H Member Dues Program
2,St. Mary's School Receives NEW Cooperative Foundation Donation
3,WIC Members Approve Merger with NEW Cooperative
4,2015-2016 Scholarship Recipients Announced!
5,Rowan Facility Announcement
6,2015-2016 Scholarship Deadline Approaching!
7,2015-2016 NEW Cooperative Scholarship Program Now Open!
8,No Service Charge Price Later Contracts Available
9,2014 Annual Meeting TONIGHT!
10,2014 Patronage Rates Announced
11,Branstad signs Harvest Weight proclamation
12,Mornng Market Report
13,State agriculture cooperatives agree on best environmental practices
14,College Day Hosted by NEW Cooperative & WinField
15,GLIDDEN PLOT DAY LOCATION MOVED
16,NEW Cooperative Featured in National Publication!
17,Coon Rapids Open House
18,NEW Cooperative Purchases Herbers Seed of Coon Rapids
19,"FCC Approves Merger with NEW Cooperative, Inc."
20,NEW Cooperative to Host Unite to Fight Charity Event
21,Foundation Supports Veterans Memorial Park
22,4-H Member Dues Program
23,NEW Cooperative Photo Contest Now Open
24,2014 Summer Interns are off to a Great Start!
25,Lanyon Grain Expansion Announced
26,Grain Engulfment Rescue Tube Donated to Lohrville Fire Department
27,2012 USDA Census of Agriculture Data Released
28,2014-2015 Scholarship Recipients Announced!
29,Fire Destroys Structure at LuVerne Facility
30,Scholarship Application Deadline Extended!
31,2014-2015 NEW Cooperative Scholarship Applications Now Available
32,No Service Charge Price Later Contracts Available
33,Lidderdale Feed Expansion
34,Duncombe Feed Team meets with Daybreak Foods Staff
35,2013 Annual Meeting Information
36,"NEW Cooperative Foundation Donates $10,000"
37,NEW Cooperative on WHO Today!
38,Patronage Rates Announced!
39,Harvest Weight Proclamation Signed
40,2013 Grain Harvest Policies Released
41,2013 Plot Days
42,Important Update from ACWA
43,NEW Cooperative Gives Back to Glidden-Ralston High School
44,2013 Summer Interns Report For Duty
45,Spring Brings Increased Farm Equipment Movement on Roadways
46,2013-2014 Scholarship Winners Announced
47,NEW Cooperative Foundation Helps Fight Local Hunger
48,CME Announces Reduced Trading Hours
49,"NEW Cooperative Foundation Awards $10,000 Donation"
50,2013-2014 NEW Cooperative Scholarship Applications Now Available
51,NEW Cooperative Driver Accident Free for 37 Years
52,NEW Cooperative Gives To Local Charities
53,NEW Cooperative Annual Meeting Sees Record Turnout
54,2012 Annual Meeting Information
55,Ag suppliers recommit to Code of Practice for Nitrogen Fertilization
56,NEW Cooperative grows agronomy services in Webster County
57,Scale Tickets Receivable By Text Message
58,Winner of the Plot Tours Dekalb Gun Safe Announced
59,Vincent Location Hosts Visitors from Brazil
60,2012 Grain Policies Approved
61,America's Farmers Grow Communities-Monsanto Fund
62,Ag Day Poster Art Contest Opens
63,Plot Tours Begin at NEW Cooperative
64,Supporting Area Youth and Our County Fairs
65,Donation from NEW Cooperative Foundation Helps Badger Fire Department
66,Donation From Foundation Helps Local Rescue Team
67,Glidden Grain Expansion Project Updates
68,NEW Cooperative 2012 Summer Interns
69,Renwick Project Playground Receives Donation from NEW Cooperative Foundation
70,NEW Cooperative Partners With Iowa Food & Family Project on Agricultural Advocacy
71,Donation to Bode Fire Department Presented
72,NEW Cooperative Scholarship Recipients Announced
73,Excavating Takes Place at NEW Cooperative Locations
74,"NEW Cooperative Foundation Awards $10,000 Donation"
75,2013-2014 NEW Cooperative Scholarship Applications Now Available
