id,title
0,ECMWF United Kingdom
1,ERDC DSRC United States
2,Ford Motor Company United States
3,Ford Motor Company United States
4,Government United States
5,Government United States
6,Government United States
7,Government United States
8,Government United States
9,Government Communications Headquarters United Kingdom
10,"KISTI Supercomputing Center Korea, South"
11,MITI - AIST - RIPS Japan
12,NASA/Ames Research Center/NAS United States
13,National Centers for Environment Prediction United States
14,National Security Agency United States
15,Naval Oceanographic Office - NAVO DSRC United States
16,NOAA/Geophysical Fluid Dynamics Laboratory (GFDL) United States
17,Pittsburgh Supercomputing Center United States
18,Silicon Graphics United States
19,"Tohoku University, Institute of Fluid Science Japan"
20,Postsdam Institute for Climate Impact Research Germany
21,DLR Germany
22,Manufacturer (G) United States
23,Technische Universitaet Braunschweig Germany
24,BellSouth United States
25,HPC2N - Umea University Sweden
26,Air Force/Eglin Air Force Base United States
27,Commissariat a l'Energie Atomique (CEA) France
28,Commissariat a l'Energie Atomique (CEA) France
29,Compagnie Generale de Geophysique (CGG) France
30,Cray Research United States
31,ECMWF United Kingdom
32,Environmental Protection Agency United States
33,IDRIS France
34,Meiji University Japan
35,Phillips Petroleum Company United States
36,Reactor & Nuclear Fuel Development Japan
37,Silicon Graphics United States
38,Technische Universitaet Darmstadt Germany
39,"Tohoku University, Institute of Fluid Science Japan"
40,University of Alaska - Arctic Region Supercomputing Center United States
41,"KT Freetel Korea, South"
42,Micron Technology United States
43,CERN Switzerland
44,InterUniversity Israel
45,North Carolina Supercomputing Center (NCSC) United States
46,University of Houston United States
47,Chase Manhattan United States
48,Southwestern Bell United States
49,ONERA France
50,DOE/SC/Oak Ridge National Laboratory United States
51,Tokyo Metropolitan University Japan
52,Chase Manhattan United Kingdom
53,Chase Manhattan United Kingdom
54,"KT Freetel Korea, South"
55,National Institute for Fusion Science (NIFS) Japan
56,Veritas DGC United States
57,DOE/SC/Argonne National Laboratory United States
58,IBM - Thomas Watson Research Center - Deep Blue United States
59,American Airlines United States
60,CENAPAD-MG/CO Brazil
61,Ecole Normale Superieure France
62,General Motors/Hughes Missile Systems Company United States
63,General Motors/Hughes Missile Systems Company United States
64,Micron Technology United States
65,Nippon Telegraph and Telephone (NTT) Japan
66,Nippon Telegraph and Telephone (NTT) Japan
67,Comdisco United States
68,Posten Sweden
69,BC Tel Canada
70,Commissariat a l'Energie Atomique (CEA) France
71,DaimlerChrysler United States
72,Merck & Co United States
73,Pratt and Whitney United States
74,Fujitsu United States
75,Autozone United States
76,Institute of Space & Astronautical Science (ISAS) Japan
77,Air Force Research Laboratory United States
78,Air Force Research Laboratory United States
79,Air Force Research Laboratory United States
80,Air Force Research Laboratory United States
81,Air Force Research Laboratory United States
82,Air Force Research Laboratory United States
83,Air Force Research Laboratory United States
84,BMW AG Germany
85,Boston University United States
86,Boston University United States
87,C4 / Centre Europeo del Parallelismo de Barcelona Spain
88,Chalmers University of Technology Sweden
89,Chalmers University of Technology Sweden
90,E-Systems/Raytheon United States
91,E-Systems/Raytheon United States
92,Ecole Polytechnique Federale de Lausanne Switzerland
93,ERDC DSRC United States
94,Industrial Light & Magic United States
95,Informix United States
96,Informix United States
97,Informix United States
98,Japan Information Processing Service Japan
99,Kyoto University Japan
