id,title
0,Exercising outdoors is better for you than gym
1,Deep Snow Safety in the Backcountry or the Resort
2,Links and News from the Outdoor World
3,"TED Talk: Christopher McDougall, ""Are we born to run?"""
4,"Apply for ""Best Internship on Earth"" with Sierra Club"
5,Trailspace is Turning 10: Essay Contest
6,"Boulder tops ""America's 15 Most Active Cities"""
7,8000 Meters... On a Climbing Wall
8,Video: Ultimate Fun on Skinny Skis
9,Obama presents America's Great Outdoors report
10,Links and News from the Outdoor World
11,"Find your passion, find your happiness"
12,Snowshoeing: Gateway to winter for kids of all ages
13,National Forest Service unveils proposed forest planning management rule
14,"Bear Aware: ""Man vs. Wild"" video game"
15,Explorers and history buffs prepare for South Pole centennial trips
16,Outdoor Retailer: Illuminating Lanterns and Hybrid Lights
17,Outdoor Retailer: Seen at the Show
18,NPS releases draft on flights and noise in Grand Canyon
19,"Polartec introduces NeoShell, ""most breathable waterproof fabric"""
20,Outdoor Retailer: Interesting Hydration
21,"Climbers face Denali and Rainier fee increases, mountain groups raise concerns"
22,Outdoor Retailer: Hardgood Gear Highlights
23,Outdoor Retailer: Flashlights from Fenix
24,Outdoor Retailer: Dean Cummings launches H20 ski line
25,Outdoor Retailer: Clothing highlights from head to toe
26,"Outdoor Retailer: Fun lights, all about the blink"
27,Outdoor Retailer: Headlamp Highlights
28,Outdoor Retailer: Gore-Tex Active Shell promises waterproof fabric with high breathability
29,Park Service to hold open houses on Denali mountaineering fee
30,"Outdoor Retailer: Kelty lights, vintage packs, pads"
31,Outdoor Retailer: Avalanche Airbags Expand
32,Outdoor Retailer: Primus Liquid Fuel Pump
33,Outdoor Retailer: Hagan Skis
34,"Outdoor Retailer: Transitional Gear from Loki, Voile"
35,Outdoor Retailer: All Season NeoAir from Therm-a-Rest
36,Outdoor Retailer: How to use a snow density gauge
37,Outdoor Retailer: First Polartec NeoShell Jackets
38,Outdoor Retailer: Talus ColdAvenger face mask
39,"Outdoor Retailer: Adidas unveils expansive line of outdoor shoes, clothing"
40,Outdoor Retailer: SPOT turns smartphones into satellite communicators
41,Salazar Restores BLM Protections for Wild Lands
42,Outdoor Retailer: Ueli Steck designs climbing knife for Wenger
43,Outdoor Retailer: Toughstakes for snow or sand
44,"Outdoor Retailer: Snowshoes from Crescent Moon, Easton, Tubbs"
45,"Celebrate 2010, Welcome 2011"
46,Outtakes from Outdoor Retailer
47,Outdoor Retailer Winter Market 2011
48,Outdoor Retailer: Gear for ninjas (and other backcountry enthusiasts)
49,Make a Movie with John Krakauer and Jeff Lowe
