id,title
0,Women's Health Services & Contraceptive Counseling
1,Withdrawal from Course MSI and MSII (COM)
2,What You Need to Know About the New I-901 SEVIS Fees
3,"Westchester Community College, Course Equivalents at"
4,Weapons on Campus
5,Volunteer Peer Tutor Formi
6,Visiting Student application - LCME accredited schools
7,Visiting Student Application
8,Visiting Student Account Request Form
9,Visiting Medical Student Exposure to Infectious and Environmental Hazards Policies and Procedures Manual
10,Violent Felonies
11,Verification Worksheet-SNAP Documentation
12,Verification Worksheet - Institutional Verification (V4)
13,Verification Worksheet - Independent (V6)
14,Verification Worksheet - Independent (V5)
15,Verification Worksheet - Independent (V1)
16,Verification Worksheet - Dependent (V6)
17,Verification Worksheet - Dependent (V5)
18,Verification Worksheet - Dependent (V1)
19,Verification Worksheet - Child Support Documentation (V3)
20,Urology Advising
21,"Upstate of Mind, Issue 2"
22,"Upstate of Mind, Issue 1"
23,Upstate and Oncenter Map and Directions
24,Upstate Housing Application
25,Upstate Academic Strategies
26,"Unique Elective Form, College of Medicine"
27,"Ulster County Community College, Course Equivalents at"
28,Tuition Payment Due Dates
29,Tuition Monthly Payment Plan Application (Summer Semester)i
30,Tuition Monthly Payment Plan Application (Spring Semester)i
31,Tuition Monthly Payment Plan Application (Fall Semester)i
32,Tuition Liability for College of Health Professions and College of Nursing students
33,Transfer Credit Appeal
34,Transfer Credit (CON/CHP)
35,"Tracks for Syracuse Campus, College of Medicine"
36,"Tracks for Binghamton Campus, College of Medicine"
37,"Tompkins Cortland Community College, Course Equivalents at"
38,Things to See and Do on Campus and Beyond
39,The International Student’s Guide to Admission and Study
40,"Syracuse University, Course Equivalents at"
41,Surgery Advising
42,"Sullivan County Community College, Course Equivalents at"
43,"Suffolk County Community College, Course Equivalents at"
44,Students with Disabilities Information (Assessment)
45,Students First Website Guide
46,Student Immunization Form
47,Student Health Insurance Packet
48,Student Health Form
49,Student Handbook 9.6: Common Drugs: Symptoms of Abuse & Penalties
50,Student Handbook 9.5: Safety
51,Student Handbook 9.3: College of Medicine
52,Student Handbook 9.2: College of Nursing
53,Student Handbook 9.1: College of Health Professions
54,Student Handbook 9.0: College of Graduate Studies
55,Student Handbook 8: Finances and Financial Aid
56,Student Handbook 7: University Policies
57,Student Handbook 6: Student Code of Conduct
58,Student Handbook 5: Student Affairs and Support
59,Student Handbook 4: Academic Calendars
60,Student Handbook 3: Who's Who on Campus
61,Student Handbook 2: Table of Contents
62,Student Handbook 1: Letter from the Dean
63,Student Handbook
64,Student Expression
65,Student Counseling Center Outreach & Special Programs Guide
66,Student Authorization for Release of Medical Information
67,Student Affairs: Mission and Organization Chart
68,"Sexual Assault, Domestic Violence, and Stalking"
69,Session III NSO Schedule
70,Session III NSO Booklet
71,Session II NSO Schedule
72,Session II NSO Booklet
73,Session I NSO Schedule
74,Session I NSO Booklet
75,Self-Help: Anxiety Management
76,Self Help: Weight Management Strategies
77,Self Help: Twenty lessons for Weight Loss Success
78,Self Help: Time Management
79,Self Help: Sleep Strategies
80,Self Help: Sexual Assault and Rape
81,Self Help: Overcoming Perfectionism
82,Self Help: Managing Test Anxiety
83,Self Help: Managing Stress
84,Self Help: Evaluating Relationships
85,Self Help: Depression and Medical School
86,Self Help: Aquiring and Maintaining Information (Study Skills)
87,"Schenectady County Community College, Course Equivalents at"
88,"Satisfactory Academic Progress: MS, DPT and PhD Programs"
89,Satisfactory Academic Progress: College of Medicine
90,Satisfactory Academic Progress: College of Health Professions and Nursing Undergrad
91,Satisfactory Academic Progress - Undergrad Policy
92,Satisfactory Academic Progress - Graduate Policy
93,Sample Personal Statement
94,Sample Curriculum vitaes
95,"SUNY Purchase, Course Equivalents at"
96,"SUNY Potsdam, Course Equivalents at"
97,"SUNY Plattsburgh, Course Equivalents at"
98,"SUNY Oswego, Course Equivalents at"
99,"SUNY Oneonta, Course Equivalents at"
100,"SUNY Old Westbury, Course Equivalents at"
101,"SUNY New Paltz, Course Equivalents at"
102,"SUNY Morrisville, Course Equivalents at"
103,"SUNY Maritime, Course Equivalents at"
104,"SUNY Fredonia, Course Equivalents at"
105,"SUNY Farmingdale, Course Equivalents at"
106,"SUNY Empire State, Course Equivalents at"
107,"SUNY Delhi, Course Equivalents at"
108,"SUNY Cortland, Course Equivalents at"
109,"SUNY College of Environmental Science & Forestry (ESF), Course Equivalents at"
110,"SUNY Cobleskill, Course Equivalents at"
111,"SUNY Canton, Course Equivalents at"
112,"SUNY Buffalo State, Course Equivalents at"
113,"SUNY Brockport, Course Equivalents at"
114,"SUNY Binghamton, Course Equivalents at"
115,"SUNY Alfred State College, Course Equivalents at"
116,"SUNY Albany, Course Equivalents at"
117,SHORT TERM EMERGENCY LOAN APPLICATION
118,"SEVIS Transfer Out ""Release"" Formi"
119,SEVIS Transfer In Formi
120,Rural Medical Scholars Program
121,Rules for Maintaining Valid F-1 Status
122,"Rockland Community College, Course Equivalents at"
123,Residency Specialty Advisor List
124,Residency Program: National Specialty Organizations and Contact Information
125,Residency Program Match List - 2015
126,Residency Program Match List - 2014
127,Residency Program Match List - 2013
128,Residency Program Match List - 2012
129,Residency Program Match List - 2011
130,Residency Program Match List - 2010
131,Residency Program Match List - 2008
132,Residency Program Match List - 2007
133,Residency Program Match List - 2006
134,Residency Program Match List - 2005
135,Residency Program Match List - 2004
136,Residency Program Match List - 2003
137,Residency Program Match List - 2009
138,Residency Program 2007 Match Statistics (College of Medicine)
139,Residency Planning Guide: Class of 2015
140,Report of Medical Examination
141,Repayment of Federal and State Aid
142,Registrar Request Form
143,Recommendation letters CHP
144,Reciprocal Credits for the MD/MPH program
145,Radiology Advising
146,Radiation Oncology Advising
147,Quick Reference Guide for MyUpstate
148,Psychiatry Advising
149,Psychiatric Disabilities Documentation
150,Program Extension Regulations for Students in F-1 Status
151,Procedures for MD/PhD Students Earning Elective Credit
152,Prescription Reimbursement Form for International Students
153,Prague Selective
154,Practice of Medicine Information Letter
155,Plastic Surgery Advising
156,Physical/Sensory Disability Documentation
157,Physical Medicine & Rehabilitation (PM&R) Advising
158,Personal Safety Committee
159,Period Dates
160,Pediatrics Advising
161,Payment of Charges
162,Pathology Advising
163,Pass/Fail Grade Request
164,Parking
165,Otolaryngology (ENT) Advising
166,Orthopaedic Surgery Advising
167,"Orange County Community College, Course Equivalents at"
168,Ophthalmology Advising
169,"Onondaga Community College, Course Equivalents at"
170,Off-Campus Employment Regulations for International Students
171,OB/Gyn Advising
172,"North Country Community College, Course Equivalents at"
173,Non-Matriculated Student Registration Form
174,"Niagara County Community College, Course Equivalents at"
175,Neurosurgery Advising
176,Neurology Advising
177,"Nassau Community College, Course Equivalents at"
178,Multicultural Affairs Brochure
179,"Monroe Community College, Course Equivalents at"
180,Molecular and Cellular Principles of Medicine Information Letter
181,"Mohawk Valley Community College, Course Equivalents at"
182,Missing Student
183,Minimum Computer Requirements
184,Meningococcal Vaccine Response Form
185,Meningoccal Fact Sheet
186,Medical Student Summer Research and Work Opportunity Directory
187,Medical Student Summer Experiences: 2007 (Class of 2010)
188,Medical Student Summer Experiences: 2006 (Class of 2009)
189,Medical Student Summer Experiences: 2005 (Class of 2008)
190,Medical Scholars Program
191,Medical Reimbursement Form for International Students
192,Medical Literature Curriculum Information Letter
193,Medical & Security Evacuation & Repatriation Program
194,"Mansfield University, Course Equivalents at"
195,Loiter - Trespass
196,Loan Adjustment Form
197,Link to SNMA Website
198,"Letter of Recommendation Form, College of Nursing"
199,"Letter of Recommendation Form, College of Health Professions"
200,Leave of Absence/Withdrawal/Transfer
201,Learning Disabilities Intake Form
202,"Le Moyne College, Course Equivalents at"
203,"Jefferson Community College, Course Equivalents at"
204,"Jamestown Community College, Course Equivalents at"
205,Intramural Sports Roster
206,Intramural Sports Reporting Form
207,Intramural Sport Rule Sheet: Volleyball
208,Intramural Sport Rule Sheet: Tennis
209,Intramural Sport Rule Sheet: Soccer
210,Intramural Sport Rule Sheet: Racquetball
211,Intramural Sport Rule Sheet: Floor Hockey
212,Intramural Sport Rule Sheet: Flag Football
213,Intramural Sport Rule Sheet: Dodgeball
214,Intramural Sport Rule Sheet: Basketball
215,Intramural Sport Rule Sheet: 3 on 3 Basketball
216,International Students Policies
217,International Programs - Contact List
218,International Medice Program Experiences of Upstate Students
219,Internal Medicine Advising
220,Information Update & Policy Affirmation
221,Independent Study
222,Immigration Related Forms (Link to www.USCIS.gov)
223,IFMSA Application Formi
224,ID Cards
225,I-20 Application
226,Human Anatomy Information Letter
227,"Hudson Valley Community College, Course Equivalents at"
228,"Herkimer County Community College, Course Equivalents at"
229,"Health Insurance, Disability Insurance, and Health Fee"
230,Health Center Authorization & Referral Form for International Students
231,Health Center Authorization & Referral Claim Form for International Students
232,Health Career Immersion Institute
233,Health Assessment - Annual
234,Graduation Requirements Syracuse Campus 2012
235,Graduation Requirements Binghamton Campus 2012
236,"Genesee Community College, Course Equivalents at"
237,"Fulton Montgomery Community College, Course Equivalents at"
238,Frequently Asked Questions about Course Enrollment
239,Fostering Professionalism
240,Foreign Student Financial Statement
241,"Finger Lakes Community College, Course Equivalents at"
242,Financial Aid Handbook
243,Federal Financial Aid Guide
244,Federal Educational Rights and Privacy Act (FERPA)
245,"Fashion Institute of Technology, Course Equivalents at"
246,Family Medicine Advising
247,FERPA Release Authorization Form
248,F-1 Optional Practical Training Reporting Requirements
249,Extended Curriculum Schedule College of Medicinei
250,Ex-Offender Policy
251,"Erie Community College, Course Equivalents at"
252,"Equal Opportunity, Non-Discrimination and Title IX"
253,Enrollment Procedures for Non-matriculated students
254,Enrollment Procedures College of Nursing
255,Enrollment Procedures College of Health Professions
256,Emergency Medicine Advising
257,Electives and Elective Lottery
258,E-Mail
259,"Dutchess Community College, Course Equivalents at"
260,Drug Conviction Worksheet
261,Dermatology Advising
262,Crime Prevention
263,Credit Card Marketing - Prohibition
264,Credit By Exam
265,Course Withdrawal for College of Health Professions and College of Nursing students
266,Course Selection/Catalog - College of Medicine (COM)
267,Course Selection/Catalog - College of Graduate Studies
268,Course Selection Procedures and Policies Class of 2017
269,Course Selection Procedures and Policies Class of 2016
270,Course Selection Procedures and Policies Class of 2015
271,Course Selection Procedures and Policies Class of 2014
272,Course Selection Procedures and Policies Class of 2013
273,Course Code Numbers
274,Course Auditor Registration Form
275,Course Audit
276,"Corning Community College, Course Equivalents at"
277,Consortium Agreement Instructions
278,Consortium Agreement
279,Commencement Save The Date Postcard
280,Commencement Planning Brochure
281,Commencement Invite Postcard
282,Commencement Information Form
283,Commencement Hooding Form
284,"Columbia Greene Community College, Course Equivalents at"
285,Collegiate Science and Technology Entry Program Applicationi
286,College of Nursing Consumer Information
287,College of Nursing Application for Admission: Registered Nurse First Assistant (RNFA) Program
288,"College of Nursing Application for Admission - BS, MS and Post Master's"
289,College of Nursing
290,College of Medicine: Year 4
291,College of Medicine: Year 3
292,College of Medicine: Year 2
293,College of Medicine: Year 1 and Summer Gross Anatomy
294,College of Medicine: Masters in Public Health
295,College of Medicine Exam Schedule
296,College of Medicine Consumer Information
297,College of Health Professions: Respiratory Therapy
298,"College of Health Professions: Radiation Therapy, BS, BPS"
299,College of Health Professions: Physician's Assistant Program
300,College of Health Professions: Medical Technology MS
301,College of Health Professions: Medical Technology BS
302,College of Health Professions: Medical Imaging BS & BPS
303,College of Health Professions: Medical Biotechnology
304,College of Health Professions: Doctor of Physical Therapy (Entry Level)
305,College of Health Professions: Cardiovascular Perfusion
306,College of Health Professions Consumer Information
307,College of Graduate Studies Consumer Information
308,College of Graduate Studies Application to Admission: MS and PhD Programs
309,College of Graduate Studies
310,"Clinton Community College, Course Equivalents at"
311,Clicker Information
312,Clerkship Tracks and Policies
313,Clerkship Change
314,Class Attendance and Religious Beliefs
315,Clark Tower Welcome Pack
316,Child Sexual Abuse Reporting
317,Change of Namei
318,Change of Address
319,Certificate of Health Statement
320,"Cayuga Community College, Course Equivalents at"
321,Campus Disruptions and Maintenance of Public Order
322,Campus Crime Reporting and Statistics (Clery Act)
323,CTSEP Book Loan Program List
324,COM White Coat Ceremony Invite
325,COM Basic Science Selectives
326,"CLEP, Course Equivalents at"
327,CHP White Coat Ceremony Invite
328,CAB Athletic Facilities Policies and Regulations
329,CAB Athletic Facilities Day Pass
330,"Business Activities on Campus, Distribution of Materials"
331,Budget Adjustment Request Form
332,"Broome Community College, Course Equivalents at"
333,"Borough of Manhattan Community College, Course Equivalents at"
334,Blood and Body Fluid Exposure
335,Blood & Body Fluid Exposure Protocol
336,Blanket Student Accident and Sickness Insurance for the Dependents of International Students/Scholars
337,Blanket Student Accident and Sickness Insurance for International Students/Scholars
338,Bias Related Crime Prevention
339,"Bergen Community College, Course equivalents at"
340,Authorization for Release of Medical Records to Upstate Medical University
341,Authorization for Release of Medical Records
342,Attention Defficit Hyperactivity Disorder (ADHD) Documentation
343,Application for New York State Residency Status for Tuition Billing Purposes
344,Animals on Campus
345,Anesthesiology Advising
346,Allergy History Screening Formi
347,Alcohol and Other Drugs
348,Aid for Part-Time Study Application (APTS)
349,Advance Enrollment Procedures College of Nursing
350,Advance Enrollment Procedures College of Health Professions
351,"Adirondack Community College, Course Equivalents at"
352,Add/Drop for College of Health Professions and College of Nursing students
353,Add/Drop College of Medicine (COM) Elective
354,Add/Drop CN/CHP/CGS and MPH
355,Accommodations for Students with Disabilities
356,Academic Support Request Formi
357,Academic Catalog
358,Academic Calendars: Medicine and Graduate Studies 2008-2009
359,Academic Calendar 2015-2016
360,Academic Calendar 2014-2015
361,Academic Calendar 2013-2014
362,Academic Calendar 2012-2013
363,Academic Calendar 2011-2012
364,Academic Calendar 2010-2011
365,Academic Calendar 2009-2010
366,3+3 Doctor of Physical Therapy program with SUNY Oswego
367,3+3 Doctor of Physical Therapy program with SUNY Geneseo
368,3+3 Doctor of Physical Therapy program with SUNY College at Oneonta
369,3+3 Doctor of Physical Therapy program with SUNY Brockport
370,3+3 Doctor of Physical Therapy program with Le Moyne College
371,"2015-16 Tracks for Syracuse Campus, College of Medicine"
372,"2015-16 Tracks for Binghamton Campus, College of Medicine"
373,"2014-15 Tracks for Syracuse Campus, College of Medicine"
374,"2014-15 Tracks for Binghamton Campus, College of Medicine"
375,2014 Match Data Book
376,"2013-14 Tracks for Syracuse Campus, College of Medicine"
377,"2013-14 Tracks for Binghamton Campus, College of Medicine"
378,2013 - 2014 COM Basic Science Selectives
