id,title
0,Adaptor to facilitate interconnection of medicine bottle and syringe
1,Means for safe collection and transfer of body fluids
2,Visual magnification apparatus for a syringe
3,Syringe filling and metering device
4,Cartridge assembly for a lyophilized compound forming a disposable portion of an injector pen and method for same
5,Apparatus for drawing fluids into a hypodermic syringe
6,Apparatus for aiding in the preparation of an injection serum
7,"Device, kit, and process for filling of a print cartridge of an ink jet printer"
8,Syringe needle cover and vial connector
9,Syringe and vial connector
10,Device for alkalizing local anesthetic injection medication
11,Elastomeric syringe actuation device
12,Vial holder
13,Apparatus for adjusting a gas injector of furnace
14,Automated analysis apparatus having fixed cells
15,Syringe device for mixing two compounds
16,Syringe alignment device
17,Solution dispensing bottle assembly
18,Syringe guide and vial holder
19,Filling device for cartridges
20,Dual vial connecting system for lyophilized products
21,Syringe loading aid
22,Direct dual filling device for sealing agents
23,Syringe guide and vial holder
24,Device for connecting a receptacle and a container and ready-for-use set comprising same
25,Tilting direct dual filling device
26,Syringe safety device
27,Lancet depth adjustment assembly
28,Single use lancet assembly
29,Syringe guide
30,Lancet device
31,Single use lancet device
32,Direct dual filling device for sealing agents
33,Kit including side firing syringe needle for preparing a drug in an injection pen cartridge
34,Syringe safety device
35,Single use lancet device
36,Device for connection between a receptacle and a container and ready-to-use assembly comprising same
37,"Method for producing a device for connecting a receptacle and a container, corresponding connecting device and ready-for-use assembly comprising a device of this type"
38,Syringe devices and methods for mixing and administering medication
39,Lancet depth adjustment assembly
40,Syringe devices and methods for mixing and administering medication
41,Syringe devices and methods for mixing and administering medication
42,Syringe devices and methods for mixing and administering medication
43,Syringe devices and methods for mixing and administering medication
44,Syringe devices and methods for mixing and administering medication
45,Fluid transfer device
46,Syringe devices and methods for mixing and administering medication
47,"Mixing/administration syringe devices, protective packaging and methods of protecting syringe handlers"
48,Liquid drug delivery devices for use with syringes with widened distal tips
49,Liquid drug medical device
50,Single use lancet assembly
51,Single use lancet assembly
52,Liquid drug medical device
53,Liquid drug transfer devices for failsafe correct snap fitting onto medicinal vials
54,Lancet device
55,"Syringe devices, components of syringe devices, and methods of forming components and syringe devices"
56,Syringe devices and methods for mixing and administering medication
57,Medicament mixing and injection apparatus
58,Apparatus and method for filing a syringe
59,Fluid control device with manually depressed actuator
60,"Mixing/administration syringe devices, protective packaging and methods of protecting syringe handlers"
61,Reconstitution device
62,"Syringe devices, components of syringe devices, and methods of forming components and syringe devices"
63,Fluid transfer devices with sealing arrangement
64,Magnifying collapsed plunger rod
65,Syringe safety device
66,Kit including side firing syringe needle for preparing a drug in an injection pen cartridge
67,Lancet device
68,Syringe guide
69,Television tuner for both analog and digital signal
70,Method and apparatus for filling syringes
71,Reservoir filling aid for a medical pump
72,Drug vial adapter with downwardly depending stopper
73,An adaptor for medicine bottle
74,Syringe device for mixing two compounds
75,Vial holder
76,Syringe alignment device
77,Device for reconstituting medicaments for injection
78,Magnifying collapsed plunger rod
