id,title
0,"Today, I'm grateful for . . ."
1,October Walk 1-2 miles per day
2,Emoticon how you're feeling today!
3,Idaho Cafe.....Our Place for Daily Chat
4,Did you overeat yesterday?
5,Feeling Positive or Negative?
6,What are you reading?
7,What made you smile today?
8,What are you drinking right now?
9,DO YOU OWN?
10,what are you drinking right now?
11,Poll: Today I feel..
12,Name a place: Alphabetically
13,What was the last vegetable you ate??
14,What color is your shirt today?
15,Last Fruit Eaten?
16,Mmmm... 1st page beer!
17,Emoticon- Rotate devil and happy face
18,Coffee today?
19,what was the last vegetable you ate?
20,TEA today?
21,CLICK if you love Spark!
22,Post something yellow
23,Sunny or cloudy today?
24,A-Z . . .Places I've Never Been
25,Login Points Today?
26,Yum Or Yuck?
27,Name an old television show
28,What was your sparks point login today?
29,What is your reason to lose weight today?
30,Did you walk today?
31,Use emoticon to show your feelings today
32,HAVE YOU HUDDLED TODAY ?
33,Stop by and leave a smiley...
34,How many login points today?
35,name one non weight related goal for today
36,What fresh vegetables do you have on hand?
37,HOW MANY HOURS OF SLEEP?
38,How Many Points Until Your NEXT Trophy???
39,Grammar pet peeves
40,Just wondering where everybody is located???
41,What kind of fruit did you last eat?
42,Three Word Phrases A - Z
43,Post a food icon
44,What do you drink most frequently during the day?
45,LAST LETTER STARTS NEXT WORD
46,What is the last thing you watched on Tv?
47,Let's NOT count....and SAY we did!
48,What's the weather like in your neck of the woods?
49,A to Z ... Places I Have Been
50,Name a Book you have read
51,third letter starts a new food...
52,did you drink water today?
53,First drink this morning
54,Post Any Emoticon
55,What was the last book you read?
56,Did you wake up before the sunshine this morning?
57,Soda Today
58,are you alcohol free today?
59,Weather and place??
60,WHAT WAS YOUR FIRST DRINK TODAY?
61,Post a smile
62,Should you be in bed right now?
63,Did you make your bed today?
64,Show How You Feel Today With an Emoticon
65,Tired or Full of Energy?
66,What Colour Is Your Shirt Today?
67,Tea or Coffee?
68,Did you eat breakfast? If so what?
69,What are you eating right now
70,Three Syllable Words A to Z
71,How often do you weigh yourself?
72,Name a movie adapted from a comic book.
73,Anything Sports A - Z
74,Name a Cartoon Character
