id,title
0,Hian Kc
1,Galveston Co Kc
2,Fond Du Lac Co Kc
3,Seward Co Kc
4,Rolla Mo Kc
5,Mattaponi Kc
6,Genesee Vly Kc
7,Clearwater Kc
8,Oshkosh Kc
9,Battle Creek Kc
10,Chattanooga Kc
11,Manatee Kc
12,Abilene Kc
13,Beaufort Kc
14,Danville Kc
15,Blennerhassett Kc
16,Bennington Co Kc
17,Heart Of Plains Kc
18,Durham Kc
19,Tennessee Valley Kennel Club
20,"Palouse Hills Dog Fanciers, Inc."
21,Rolla Missouri Kennel Club
22,Kokomo Kennel Club
23,Fort Dodge Kennel Club
24,Marshfield Area Kennel Club
25,Missouri Rhineland Kennel Club
26,"Danville Kennel Club, Inc."
27,Griffin Georgia Kennel Club
28,"Tri-state Kennel Club, Inc."
29,"Greater Ocala Dog Club, Inc."
30,Worcester County Kennel Club
31,Southeast Alabama Kennel Club
32,Silver State Kennel Club
33,"Central Wyoming Kennel Club, Inc."
34,"Huntingdon Valley Kennel Club, Inc."
35,Lake Minnetonka Kennel Club
36,Nasa Area Dog Fanciers Association
37,Yuma Kennel Club
38,"Linn County Kennel Club, Inc."
39,"Danville Kennel Club, Inc."
40,Maury County Kennel Club Of Tennessee
41,Northeast Oklahoma Kennel Club
42,"Terre Haute Kennel Club, Inc."
43,Chesapeake Virginia Dog Fanciers Association
44,"Fargo-moorhead Kennel Club, Inc."
45,Colorado Springs Kennel Club
46,"Chico Dog Fanciers Association, Inc."
47,"Lackawanna Kennel Club, Inc."
48,"Valley Forge Kennel Club, Inc."
49,Heart Of The Plains Kennel Club
50,"New Castle Kennel Club, Inc."
51,Penobscot Valley Kennel Club
52,West Central Oklahoma Kennel Club
53,"Forsyth Kennel Club, Inc."
54,"Meri-miss Kennel Club, Inc."
55,"Camden County Kennel Club, Inc."
56,"Park Shore Kennel Club, Inc."
57,"Brazos Valley Kennel Club, Inc."
58,Montgomery Kennel Club
59,"Mount Ogden Kennel Club, Inc."
60,"Virginia Kennel Club, Inc."
61,"Genesee Valley Kennel Club, Inc."
62,Leavenworth Kennel Club
63,"Lewiston-Auburn Kennel Club, Inc."
64,"Mattoon Kennel Club, Inc."
65,Northlake Kennel Club Of Greater Covington
66,"Hoosier Kennel Club, Inc."
67,Scottsbluff Kennel Club
68,Ephrata-moses Lake Kennel Club
69,"Old Dominion Kennel Club Of Northern Virginia, Inc."
70,Bartlesville Kennel Club
71,Tupelo Kennel Club
72,Mount Pleasant Michigan Kennel Club
73,"Kennel Club Of Texarkana, Inc."
74,Ox Ridge Kennel Club
75,Central Ohio Kennel Club
76,Hobbs New Mexico Kennel Club
77,Tuscaloosa Kennel Club
78,"Yakima Valley Kennel Club, Inc."
79,"Quincy Kennel Club, Inc."
80,"Toledo Kennel Club, Inc."
81,"Kenilworth Kennel Club Of Connecticut, Inc."
82,Conejo Kennel Club
83,Longview Kennel Club
84,"Hoosier Kennel Club, Inc."
85,"Sioux Empire Kennel Club, Inc."
86,"Forsyth Kennel Club, Inc."
87,Columbiana County Kennel Club
88,Windward Hawaiian Dog Fanciers Association
89,Bee-tex Kennel Club
90,Montgomery Kennel Club
91,Durango Kennel Club
92,Grand Traverse Kennel Club
93,Cambridge Minnesota Kennel Club
94,Rock Creek Kennel Club
95,La Porte County Kennel Club
96,Mississippi Coast Kennel Club
97,Cook Inlet Kennel Club
98,Chattanooga Kennel Club
99,"Richland Kennel Club, Inc."
100,Sahuaro State Kennel Club
101,Chambersburg Area Kennel Club
102,"Acadiana Kennel Club, Inc."
103,"Central New York Kennel Club, Inc."
104,Bartlesville Kennel Club
105,Golden Triangle Kennel Club Of Mississippi
106,"Vacationland Dog Club, Inc."
107,"Marion Ohio Kennel Club, Inc."
108,Marquette Kennel Club
109,"Tri-city Kennel Club, Inc."
110,West Texas Kennel Club
111,"Mesilla Valley Kennel Club, Inc."
112,Kachina Kennel Club
113,"Harrisburg Kennel Club, Inc."
114,"Toledo Kennel Club, Inc."
115,Butte County Kennel Club
116,Alaska Kennel Club
117,Greater Hattiesburg Kennel Club
118,"Huntington Kennel Club, Inc."
119,Lompoc Valley Kennel Club Inc
120,"Topeka Kennel Club, Inc."
121,Hot Springs National Park Kennel Club
122,"Illinois Capitol Kennel Club, Inc."
123,"Kennel Club Of Philadelphia, Inc."
124,Northlake Kennel Club Of Greater Covington
125,"Dog Fanciers Association Of Oregon, Inc."
126,Ponce Kennel Club
127,"Waterloo Kennel Club, Inc."
128,"Baytown Kennel Club, Inc."
129,"Intermountain Kennel Club, Inc."
130,Tanana Valley Kennel Club
131,Valparaiso Kennel Club
132,Marshfield Area Kennel Club
133,"Wichita Kennel Club, Inc."
134,"Kennel Club Of Columbus, Indiana"
135,"Onondaga Kennel Association, Inc."
136,Laurel Highlands Kennel Association
137,"Greater Miami Dog Club, Inc."
138,"Mississippi State Kennel Club, Inc."
139,Hawaiian Kennel Club
140,Hilton Head Island Kennel Club
141,Maury County Kennel Club Of Tennessee
142,Beckley West Virginia Kc
143,Coeur D'alene Dog Fanciers
144,Snake River Canyon Kennel Club Of Idaho
145,Fort Dodge Kennel Club
146,Lima Kennel Club
147,Mohawk Valley Kennel Club
148,Leavenworth Kennel Club
149,"Rochester Minnesota Kennel Club, Inc."
150,Greenville Mississippi Kennel Club
151,"Central Indiana Kennel Club, Inc."
152,"Okaloosa Kennel Club, Inc."
153,"Peninsula Dog Fanciers Club, Inc."
154,Kachina Kennel Club
155,Heart Of Iowa Kennel Club
156,Macon Kennel Club
157,"Greater Clarksburg Wv Kennel Club, Inc."
158,Lake Minnetonka Kennel Club
159,Conewango Valley Kennel Club
160,Five Valley Kennel Club
161,"Meri-miss Kennel Club, Inc."
162,Northeastern Maryland Kennel Club
163,"Crab Orchard Kennel Club, Inc."
164,St. Clairsville Ohio Kennel Club
165,Marquette Kennel Club
166,Grand Valley Kennel Club
167,Greater Philadelphia Dog Fanciers Association
168,Tacoma Kennel Club
169,Lost Dutchman Kennel Club
170,South Arkansas Kennel Club
171,"Kennel Club Of Greater Victoria, Inc."
172,Valley Isle Kennel Club Of Maui
173,"Paducah Kennel Club, Inc."
174,"Pocatello Kennel Club, Inc."
175,Penobscot Valley Kennel Club
176,Chambersburg Area Kennel Club
177,Coos Kennel Club
178,Mobile Kennel Club
179,"Fort Steuben Kennel Association, Inc."
180,Mississippi Gulf Coast Kennel Club
181,"Wallkill Kennel Club, Inc."
182,Tupelo Kennel Club
183,Columbia Missouri Kennel Club
184,Scottsbluff Kennel Club
185,Tuscaloosa Kennel Club
186,"Intermountain Kennel Club, Inc."
187,"Mid-continent Kennel Club Of Tulsa, Inc."
188,Northlake Kennel Club Of Greater Covington
189,Mckinley Kennel Club
190,Western Carolina Dog Fanciers Association
191,Michiana Kennel Club
192,Duluth Kennel Club
193,"Roanoke Kennel Club, Inc."
194,Gold Country Kennel Club
195,Hot Springs National Park Kennel Club
196,"Cornhusker Kennel Club Of Lincoln, Nebraska, Inc."
197,Lawton Dog Fanciers Association
198,"Minneapolis Kennel Club, Inc."
199,"Cen-tex Kennel Club, Inc."
200,Livonia Kennel Club (BREED & OBED 1)
201,Southeast Arkansas Kennel Club
202,West Texas Kennel Club
203,"Meri-miss Kennel Club, Inc."
204,Garden City Kansas Kennel Club
205,"Del Sur Kennel Club, Inc."
206,"Brazos Valley Kennel Club, Inc."
207,Greater Orange Park Dog Club
208,"Waterloo Kennel Club, Inc."
209,Seward County Kennel Club
210,Caddo Kennel Club Of Texas
211,Southeast Alabama Kennel Club
212,Jackson Tennessee Dog Fanciers Association
213,Middlesex County Kennel Club
214,Electric City Kennel Club
215,Bismarck Kennel Club
216,"Cedar Rapids Kennel Association, Inc."
217,"Greater Murfreesboro Kennel Club, Inc."
218,"Mesilla Valley Kennel Club, Inc."
219,"Tidewater Kennel Club Of Virginia, Inc."
220,"Coulee Kennel Club, Inc."
221,"Umpqua Kennel Club, Inc."
222,Nolan River Kennel Club
223,Oak Ridge Kennel Club
224,"Hoosier Kennel Club, Inc."
225,San Jacinto Kennel Club
226,Heart Of Iowa Kennel Club
227,Durango Kennel Club
228,"Okaloosa Kennel Club, Inc."
229,Grand Traverse Kennel Club (Breed/Obed #1)
230,Penobscot Valley Kennel Club
231,"Huntington Kennel Club, Inc."
232,Greater Shelby Kennel Club
233,"Providence County Kennel Club, Inc."
234,Marshfield Area Kennel Club
235,"Panhandle Kennel Club Of Texas, Inc."
236,"Dayton Kennel Club, Inc."
237,Edwardsville Illinois Kennel Club
238,"Louisville Kennel Club, Inc."
239,Scottsbluff Kennel Club
240,Greater Orange Park Dog Club
241,"Intermountain Kennel Club, Inc."
242,"Blennerhassett Kennel Club, Inc."
243,Butte County Kennel Club
244,Mount Pleasant Michigan Kennel Club
245,"Genesee Valley Kennel Club, Inc."
246,"Woodstock Dog Club, Inc."
