id,title
0,Lake Eustis Kc
1,Pontiac Kc
2,Richmond Df
3,De Water Gap Kc
4,Mt. Ogden Kc
5,Fox River Vly Kc
6,Mt. Baker Kc
7,Greeley Kc
8,Raleigh Kc
9,Griffin Ga Kc
10,Hilton Head Islnd Kc
11,Ms State Kc
12,Soeast Al Kc
13,Three Rvrs Kc Of Mo
14,Tullahoma Kc Of Tn
15,Grtr Naples Dc
16,Butler Co Kc
17,Greenwich Kc
18,National Capitl Kc
19,Rock Creek Kc
20,Kachina Kc
21,Nor Shore Kc
22,"Richmond Dog Fanciers Club, Inc."
23,"Lake Eustis Kennel Club, Inc."
24,"Staten Island Kennel Club, Inc."
25,"Columbia Kennel Club, Inc."
26,"Hockamock Kennel Club, Inc."
27,"Southern Maryland Kennel Club, Inc."
28,"Western Reserve Kennel Club, Inc."
29,"Tonawanda Valley Kennel Club, Inc."
30,"Hatboro Dog Club, Inc."
31,Mobile Kennel Club
32,"Mid-del-tinker Kennel Club, Inc."
33,Cahaba Valley Kc
34,"Chesapeake Kennel Club Of Maryland, Inc."
35,"Kennel Club Of Palm Springs, Inc."
36,"Puyallup Valley Dog Fanciers, Inc."
37,Southeast Alabama Kennel Club
38,Chattanooga Kennel Club
39,Heartland Dog Club Of Florida
40,Virginia Beach Kennel Club
41,Longview Kennel Club
42,"Raleigh Kennel Club, Inc."
43,Slidell Dog Fanciers Association
44,Sandusky Kennel Club
45,Savannah Kennel Club
46,"Monticello New York Kennel Club, Inc."
47,"Beaufort Kennel Club, Inc."
48,"Mid-del-tinker Kennel Club, Inc."
49,Holland Michigan Kennel Club
50,Southern Indiana Kennel Club
51,"Shenandoah Valley Kennel Club, Inc."
52,Inverness Florida Kennel Club
53,"Furniture City Kennel Club, Inc."
54,"Forsyth Kennel Club, Inc."
55,Hendersonville Kennel Club
56,"Valdosta Kennel Club, Inc."
57,"Pensacola Dog Fanciers Association, Inc."
58,Nashville Kennel Club
59,"Galveston County Kennel Club, Inc."
60,"Shreveport Kennel Club, Inc."
61,Rio Grande Kennel Club
62,Greater Fort Myers Dog Club
63,"Skyline Kennel Club, Inc."
64,"Central Maine Kennel Club, Inc."
65,Wright County Minnesota Kennel Club
66,Greater Muskegon Kennel Club
67,Tyler Texas Kennel Club
68,"Brookhaven Kennel Club, Inc."
69,Griffin Georgia Kennel Club
70,"Idaho Capital City Kennel Club, Inc."
71,Hobbs New Mexico Kennel Club
72,Garden City Kansas Kennel Club
73,"Waterloo Kennel Club, Inc."
74,Jefferson County Kennel Club Of Missouri
75,"Vacationland Dog Club, Inc."
76,"Hangtown Kennel Club Of Placerville, Ca"
77,South Dade Kennel Club
78,Colorado Springs Kennel Club
79,Great Lakes All Terrier Association
80,Five Valley Kennel Club
81,"Upper Marlboro Kennel Club, Inc."
82,Douglasville Kennel Club Of Georgia
83,Greater Freeport Illinois Kennel Club
84,"Lawrence Jayhawk Kennel Club, Inc."
85,Hilton Head Island Kennel Club
86,South Windsor Kennel Club
87,Tacoma Kennel Club
88,Suwannee Valley Kennel Club Of Florida
89,"Wichita Kennel Club, Inc."
90,"Palouse Hills Dog Fanciers, Inc."
91,"Mensona Kennel Club, Inc."
92,Plainfield Kennel Club
93,West Highland White Terrier Club Of Greater Denver
94,Mckinley Kennel Club
95,"Pioneer Valley Kennel Club, Inc."
96,Nisqually Kennel Club
97,"Sugarbush Kennel Club, Inc."
98,West Volusia Kennel Club
99,Holland Michigan Kennel Club
100,"Fort Bend Kennel Club, Inc."
101,"Beaufort Kennel Club, Inc."
102,"Clovis Portales Kennel Club, Inc."
103,"Mississippi State Kennel Club, Inc."
104,Livingston Kennel Club
105,"Greater Orange Park Dog Club, Inc."
106,"Belle-city Kennel Club, Inc."
107,Saginaw Valley Kennel Club
108,Chief Solano Kennel Club
109,Fort St. Clair Kennel Club
110,"St. Louis Dog Breeders Association, Inc."
111,Carroll Kennel Club
112,Champaign Illinois Kennel Club
113,"Champlain Valley Kennel Club, Inc."
114,Nebraska Kennel Club
115,Longview Kennel Club
116,"Carolina Kennel Club, Inc."
117,Sawnee Mountain Kennel Club Of Georgia
118,"Columbia Kennel Club, Inc."
119,"Cornhusker Kennel Club Of Lincoln, Nebraska, Inc."
120,"Cyclone Country Kennel Club Of Ames, Inc."
121,"Town And Country Kennel Club, Inc."
122,"Ochlockonee River Kennel Club Of Florida, Inc."
123,"Superstition Kennel Club, Inc."
124,Newnan Kennel Club
125,Puerto Rico Kennel Club
126,"Waukesha Kennel Club, Inc."
127,Three Rivers Kennel Club Of Missouri
128,Burbank Kennel Club
129,"Chaparral Kennel Club, Inc."
130,"Lizard Butte Kennel Club, Inc."
131,"Gloucester County Kennel Club, Inc."
132,Anniston Kennel Club
133,Edwardsville Illinois Kennel Club
134,Greater Gainesville Dog Fanciers Association
135,Greater Panama City Dog Fanciers Association
136,La Porte County Kennel Club
137,"Brazos Valley Kennel Club, Inc."
138,"Waterloo Kennel Club, Inc."
139,Crawford County Kennel Club
140,Tupelo Kennel Club
141,Durango Kennel Club
142,"Asheville Kennel Club, Inc."
143,Rolla Missouri Kennel Club
144,"Battle Creek Kennel Club, Inc."
145,Marshfield Area Kennel Club
146,"Bayou Kennel Club, Inc."
147,Windward Hawaiian Dog Fanciers Association
148,Thronateeska Kennel Club
149,"Town And Country Kennel Club, Inc."
150,Charleston Kennel Club
151,"Belle-city Kennel Club, Inc."
152,"Greater Clarksburg Wv Kennel Club, Inc."
153,"Fayetteville Kennel Club, Inc."
154,Saginaw Valley Kennel Club
155,Colorado Springs Kennel Club
156,Cudahy Kennel Club
157,"Burlington Kennel Club, Inc."
158,"Rochester Minnesota Kennel Club, Inc."
159,West Volusia Kennel Club
160,"Augusta Kennel Club, Inc."
161,"Kennel Club Of Greater Victoria, Inc."
162,Silver State Kennel Club
163,Myrtle Beach Kennel Club
164,"Hangtown Kennel Club Of Placerville, Ca"
165,Yellowstone Valley Kennel Club
166,Alaska Kennel Club
167,"Paper Cities Kennel Club, Inc."
168,Conyers Kennel Club Of Georgia
169,Helena Montana Kennel Club
170,Greater Humble Area Kennel Club
171,"Mississippi State Kennel Club, Inc."
172,Pasco Florida Kennel Club
173,Livonia Kennel Club
174,"Douglasville Kennel Club Of Georgia, Inc."
175,Greater Orange Park Dog Club
176,North Arkansas Kennel Club
177,Myrtle Beach Kennel Club
178,Riverside West Kennel Club Of Greater New Orleans
179,Rock Creek Kennel Club
180,Nebraska Kennel Club
181,New River Valley Kennel Club
182,"Jaxon Kennel Club, Inc."
183,Tupelo Kennel Club
184,Mason City Kennel Club
185,"Greater Ocala Dog Club, Inc."
186,"Golden Valley Kennel Club, Inc."
187,Savannah Kennel Club
188,Starved Rock Kennel Club
189,"Greater Lowell Kennel Club, Inc."
190,"Ochlockonee River Kennel Club Of Florida, Inc."
191,"Wisconsin Kennel Club, Inc."
192,"Piedmont Kennel Club, Inc."
193,"Pioneer Valley Kennel Club, Inc."
194,Badger Kennel Club
195,"Mount Ogden Kennel Club, Inc."
196,Langley Kennel Club
197,"Yakima Valley Kennel Club, Inc."
198,Conewango Valley Kennel Club (BREED AND OBED 1)
199,Berrien Kennel Club
200,"Carolina Kennel Club, Inc."
201,Mid-coast Kennel Club Of Maine
202,"Berks County Kennel Club, Inc."
203,Rockford-freeport Illinois Kennel Club
204,Greater Venice Florida Dog Club
205,"Sioux Empire Kennel Club, Inc."
206,"Marion Kennel Club, Inc."
207,"Lorain County Kennel Club, Inc."
208,Clemson Kennel Club
209,"Sun Maid Kennel Club Of Fresno, Inc."
210,"Finger Lakes Kennel Club, Inc."
211,Seward County Kennel Club
212,Mt. Palomar Kennel Club
213,Missouri Rhineland Kennel Club
214,Eagle Rock Kennel Club
215,Berrien Kennel Club
216,"Lackawanna Kennel Club, Inc."
217,"Northern Kentucky Kennel Club, Inc."
218,Kennel Club Of Niagara Falls (BREED/OBED 1)
219,Anniston Kennel Club
220,"Lawrence Jayhawk Kennel Club, Inc."
221,Montgomery Kennel Club
222,Ventura County Dog Fanciers Association
223,"Kennel Club Of Yorkville, Illinois"
224,Grand Island Kennel Club
225,Greater Muskegon Kennel Club
226,"Calcasieu Kennel Club, Inc."
227,Columbiana County Kennel Club
228,"Burlington Kennel Club, Inc."
229,"Greater Emporia Kennel Club, Inc."
230,"South Shore Kennel Club, Inc."
231,Warrenton Kennel Club
232,"Augusta Kennel Club, Inc."
233,"Augusta Kennel Club, Inc."
234,"Tri-star Kennel Club Of williamson County, Tennessee"
235,Saline County Kennel Club Of Arkansas
236,Brandon Florida Kennel Club
237,Mississippi Gulf Coast Kennel Club
238,Clemson Kennel Club
239,Arrowhead Kennel Club
240,Hobbs New Mexico Kennel Club
241,Everglades Terrier Club
242,"Kern County Kennel Club, Inc."
243,Tuscaloosa Kennel Club
244,"Palouse Hills Dog Fanciers, Inc."
245,Virginia Beach Kennel Club
246,Riverside West Kennel Club Of Greater New Orleans
247,Boca Raton Dog Club Inc
248,Alaska Kennel Club
249,Sandemac Kennel Club
250,"Sioux Empire Kennel Club, Inc."
251,North Arkansas Kennel Club
252,"Beaufort Kennel Club, Inc."
253,"Beaufort Kennel Club, Inc."
254,Saginaw Valley Kennel Club (Breed/Obed #1)
255,Heartland Dog Club Of Florida
256,"Sunflower Kennel Club Of Olathe, Kansas"
257,Greater Kingsport Kennel Club
258,Warren County Kennel Club Of Ohio
259,"Lake Shore Kennel Club, Inc."
260,Bushy Run Kennel Club
261,"Brookhaven Kennel Club, Inc. (Show #1)"
