id,title
0,Black v. Amen
1,Harmon v. Brucker
2,U.S. v. Schaefer Brewing Co.
3,"Panama Canal Co. v. Grace Line, Inc."
4,County Of Marin v. United States
5,Pub. Service Comm'n v. United States
6,Byrd v. Blue Ridge Cooperative
7,Kovacs v. Brewer
8,United States v. Procter & Gamble
9,Labor Board v. Duval Jewelry Co.
10,Lewis v. Labor Board
11,Flora v. United States
12,Triplett v. Iowa
13,Societe Internationale v. Rogers
14,"Chicago v. Atchison, T. & S. F. R. Co."
15,Ivanhoe Irrig. Dist. v. Mccracken
16,Hanson v. Denckla
17,NAACP v. Alabama
18,Hinkle v. New England Ins. Co.
19,Hotel Employees v. Leedom
20,Leedom v. Kyne
21,Flemming v. Florida Citrus Exch.
22,Allied Stores Of Ohio v. Bowers
23,Ganger v. City Of Miami
24,Spevack v. Strauss
25,Joseph v. Indiana
26,Irvin v. Dowd
27,Martin v. Creasy
28,N. A. A. C. P. v. Alabama
29,Harrison v. N. A. A. C. P.
30,Allegheny County v. Mashuda Co.
31,Louisiana P. & L. Co. v. Thibodaux City
32,Taylor v. Mcelroy
33,Mitchell v. Oregon Frozen Foods Co.
34,Oil Workers Unions v. Missouri
35,United States v. Mersky
36,Florida Lime Growers v. Jacobsen
37,Mcgann v. United States
38,Flora v. United States
39,Phillips v. New York
40,N. H. Fire Ins. Co. v. Scanlon
41,Parker v. Ellis
42,Needelman v. United States
43,Rohr Corp. v. San Diego County
44,Pennsylvania R. Co. v. United States
45,Texas Gas Corp. v. Shell Oil Co.
46,Clay v. Sun Insurance Office
47,Hoffman v. Blaski
48,Miner v. Atlass
49,U.S. v. American-Foreign Ss. Corp.
