id,title
0,Worthy Is The Lamb (AMPB: Darlene Zschech)
1,"Wonderful, Merciful Savior (AMPB: Selah)"
2,"Wonderful, Merciful Savior (AMPB: Selah)"
3,Redeember (AMPB: Nicole C. Mullen)
4,Feel The Nails (AMPB: Ray Boltz)
5,Via Dolorosa (AMPB: Sandi Patty)
6,Was It A Morning Like This (AMPB: Sandi Patty)
7,Watch The Lamb (AMPB: Ray Boltz)
8,Bless the Broken Road
9,Lamb Of God (AMPB: Twila Paris)
10,There Is A Fountain (AMPB: Selah)
11,There Is A Fountain (AMPB: Selah)
12,There Is A Fountain
13,Glory
14,Rescue me
15,"From The Inside Out (AMPB: Phillips, Craig & Dean)"
16,Let Me Rediscover You (AMPB: Downhere)
17,My Hope Is In You (AMPB: Aaron Shust)
18,Strong Enough To Save (AMPB: Tenth Avenue North)
19,Keep Breathing (AMPB: Kerri Roberts)
20,You Are My Shepherd (AMPB: Tricia Brock)
21,Fall Apart (AMPB: Josh Wilson)
22,Rise (AMPB: Shawn McDonald)
23,Give You Peace (AMBP: Echoing Angels)
24,Courageous (AMPB: Casting Crowns)
25,City On The Hill (AMPB: Casting Crowns)
26,"Jesus, Friend Of Sinners (AMPB: Casting Crowns)"
27,Already There (AMPB: Casting Crowns)
28,"Well, The (AMPB: Casting Crowns)"
29,Spirit Wind (AMPB: Casting Crowns)
30,Just Another Birthday (AMPB: Casting Crowns)
31,Wedding Day (AMPB: Casting Crowns)
32,Angel (AMPB: Casting Crowns)
33,My Own Worst Enemy (AMPB: Casting Crowns)
34,Face Down (AMPB: Casting Crowns)
35,So Far To Find You (AMPB: Casting Crowns)
36,Alive (AMPB: Natalie Grant)
37,Be Born In Me (AMPB: Francesca Battistelli)
38,When Love Sees You (AMPB: Mac Powell)
39,"Great Day, The (AMPB: M.W. Smith/D. Zshech)"
40,Grace Found Me (AMPB: Rush of Fools)
41,We Are (AMPB: Kari Jobe)
42,Just As I Am (AMPB: Fernando Ortega)
43,Stronger In The Broken Places (AMPB: Mark Harris)
44,Give Them Jesus (AMPB: Jaci Velasquez)
45,God Is Still God (AMPB: Heather Williams)
46,Everything Good (AMPB: Ashes Remain)
47,"At Your Name (Yahweh, Yahweh) (AMPB: Phil Wickham)"
48,Remind Me Who I Am (AMPB: Jason Gray)
49,All For You (AMPB: MIKESCHAIR)
50,All This Time (AMPB: Britt Nicole)
51,Carry Me To The Cross (AMPB: Kutless)
52,What A Savior (AMPB: Laura Story)
53,When The Stars Burn Down (Blessing And Honor)
54,I Choose Jesus (AMPB: Moriah Peters)
55,Risen Today (AMPB: Aaron Shust)
56,"Same God, The (AMPB: NewSong)"
57,Overcome (AMPB: Jeremy Camp)
58,"Hurt & The Healer, The (AMPB: MercyMe)"
59,I Turn To You (AMPB: Selah)
60,I Turn To You (AMPB: Selah)
61,White Flag (AMPB: Passion - Chris Tomlin)
62,Forever Reign (AMPB: One Sonic Society)
63,This Is The Day (AMPB: Phil Wickham)
64,If I Ever Needed Grace (AMPB: Jimmy Needham)
65,Beginning To End (AMPB: Rush Of Fools)
66,Rise Up (AMPB: Matt Maher)
67,As For Me And My House (AMPB: John Waller)
68,"Jesus, Son Of God (AMPB: Passion)"
69,"10,000 Reasons (AMPB: Passion - Matt Redman)"
70,No Turning Back (AMPB: Passion - Chris Tomlin)
71,After All (Holy) (AMPB: David Crowder*Band)
72,Forgiveness (AMPB: Matthew West)
73,When Mercy Found Me (AMPB: Rhett Walker Band)
74,Shouldve Been Me (AMPB: Citizen Way)
75,Steady My Heart (AMPB: Kari Jobe)
76,Good To Be Alive (AMPB: Jason Gray)
77,Nothing But The Blood (AMPB: Andy Cherry)
78,Scars (AMPB: Jonny Diaz)
79,You Are Loved (AMPB: Heather Williams)
80,Who You Are (AMPB: Unspoken)
81,What Grace Looks Like (AMPB: 33Miles)
82,Rest In The Hope (AMPB: Karyn Williams)
83,Beautiful You (AMPB: Trent Monk)
84,Finally Home (AMPB: Kerrie Roberts)
85,I Am Yours (AMPB: The Afters)
86,Rest Easy (AMPB: Andrew Peterson)
87,Your Presence Is Heaven (AMPB: Israel Houghton)
88,Well Done (AMPB: Moriah Peters)
89,More Than Amazing (AMPB: Lincoln Brewster)
90,Even If (AMPB: Kutless)
91,All Things Possible (AMPB: Mark Schultz)
92,Right Beside You (AMPB: Building 429)
93,One Thing Remains(AMPB:Passion-Kristian Stanfill)
94,Banner Of Love (AMPB: Luminate)
95,"Great I Am (AMPB: Phillips, Craig & Dean)"
96,Jesus In Disguise (AMPB: Brandon Heath)
97,You Are I Am (AMPB: MercyMe)
98,We Are Free (AMPB: Aaron Shust)
99,I Need A Miracle (AMPB: Third Day)
100,Awake My Soul (AMPB: Chris Tomlin)
101,Whom Shall I Fear (God Of Angel Armies)
102,Lay Me Down (AMPB: Chris Tomlin)
103,God's Great Dance Floor (AMPB: Chris Tomlin)
104,Crown Him (Majesty) (AMPB: Chris Tomlin)
105,Shepherd Boy (AMPB: Chris Tomlin)
106,Sovereign (AMPB: Chris Tomlin)
107,Countless Wonders (AMPB: Chris Tomlin)
108,Thank You God For Saving Me (AMPB: Chris Tomlin)
109,Restore (AMPB: Chris August)
110,Not For A Moment (After All) (Studio Series)
111,Pieces (AMPB: Meredith Andrews)
112,Middle Of Your Heart (AMPB: for KING & COUNTRY)
113,Strangely Dim (AMPB: Francesca Battistelli)
114,Never Beyond Repair (AMPB: Everfound)
115,Strong God (AMPB: Meredith Andrews)
116,Rise To You (AMPB: Jason Castro)
117,Carry Me (AMPB: Josh Wilson)
118,As For Me (AMPB: FFH)
119,Come To The River (AMPB: Rhett Walker Band)
120,"Jesus, Firm Foundation (AMPB: Various)"
121,"Lord, I Need You (AMPB: Matt Maher)"
122,New Man (AMPB: All Things New)
123,Nothing Is Wasted (AMPB: Jason Gray)
124,Promises (AMPB: Sanctus Real)
125,Reckless (AMPB: Jeremy Camp)
126,Slip On By (AMPB: Finding Favour)
127,Somebody Tell Them (AMPB: City Harbor)
128,Swallow The Ocean (AMPB: NewSong)
129,Take Me To The King (AMPB: Tamela Mann)
130,We Won't Be Shaken (AMPB: Building 429)
131,Words (AMPB: Hawk Nelson (feat. Bart Millard))
132,Worn (AMPB: Tenth Avenue North)
133,You Are (AMPB: Colton Dixon)
134,Light of the Stable
135,Timeless
136,You Are My King (AMPB: Newsboys)
137,You Raise Me Up
138,Selah Songbook
139,Hiding Place
140,Greatest Hymns
141,Bless the Broken Road: The Duets Album
142,"THE SELAH SONGBOOK, Volume 2"
143,You Deliver Me
144,One Thing I Know
145,Press On
146,Press On
147,Press On
148,"Wonderful, Merciful Savior"
149,Hold On
150,Timeless
151,You Raise Me Up
152,I Bless Your Name
153,All My Praise
154,You Are My Hiding Place
155,There Is Power In The Blood
156,Be Thou My Vision
157,Bless The Broken Road (w/ Melodie Crittenden)
158,RESCUE ME
159,Be Still My Soul
160,Rose of Bethlehem
161,Hiding Place
162,Greatest Hymns
163,Bless The Broken Road: The Duets Album
164,Timeless: The Selah Collection
165,You Deliver me
166,Hope of the Broken
167,You Amaze Us
