id,title
0,Refrigerated merchandiser with modular external frame structure
1,Rack frame
2,Rack for an equipment cabinet
3,Rack for mounting electronic apparatuses
4,Multi-variant cart construction for transporting lighting equipment
5,Electrical appliance framework having a threaded bar for fixing of components to the framework
6,Hinged wire management panel assembly
7,Framework system for electrical/electronic controls
8,Modular enclosure and method
9,Fixture for displaying merchandise
10,Switchgear cabinet with a frame and door elements
11,Earthquake resistant enclosure for electronic equipment
12,Equipment rack system
13,Electronic equipment enclosure
14,Modular structure with modular component parts for making shelves and closets
15,Equipment storage apparatus
16,Adjustable communications equipment dual relay rack
17,Apparatus for storing customer trays
18,Library apparatus
19,Earthquake-resistant electronic equipment frame
20,Frame for a switch cabinet
21,Modular and flexible server frame enclosure
22,Configurable shelving/storage system
23,Rack
24,Rack cabinet and method for making same
25,Equipment mounting racks and cabinets
26,Thigh protective device for construction workers and method of using same
27,Adjustable shelving/display system
28,Equipment mounting racks and cabinets
29,Equipment mounting racks and cabinets
30,Equipment mounting strap
31,Earthquake-resistant electronic equipment frame
32,Adjustable shelving/display system
33,Adjustable shelving/display system
34,Method for combined air and liquid cooling of stacked electronics components
35,Corner post and manufacturing process for making same
36,Indoor-outdoor equipment enclosure and method for assembling the same
37,Indoor-outdoor equipment enclosure and method for assembling the same
38,Removable caster system
39,Assembly and method for ruggedizing computer racks and/or electronic cage assemblies
40,Fixture accessories
41,Integrated frame and central electronic complex structure
42,Tiered battery cabinet
43,Method of assembling fixture accessories
44,Seismically hardened two-post electronic equipment rack
45,Merchandising system and method of assembly
46,Modular beach cart system
47,Equipment cabinet
48,Rail mounting clamp for electronic equipment enclosure
49,Server cabinet
50,Electronic equipment cabinet structure
51,Supporting device for display apparatus
52,Cable pass-through panel for electronic equipment enclosure
53,Seismically resistant network equipment rack
54,Electrical equipment enclosure
55,Method for combined air and liquid cooling of stacked electronics components
56,Waist supported structure with attachment band
57,Modular beach cart system
58,Apparatus and method for housing electronic equipment and increasing floor space utilization in a secure environment
59,Server Cabinet
60,Rack assembly
61,Server cabinet
62,Case-cabinet frame specially for electric appliance
63,"Cabinet frame, particularly for electrical apparatus"
64,Storage cabinet and method of assembling same
65,Refrigerated merchandiser with modular external frame structure
66,Earthquake resistant enclosure for electronic equipment
67,Equipment mounting strap
