id,title
0,Hoosier Kc
1,Va Kc
2,Licking River Kc
3,Canadian Vly Kc
4,Roanoke Kc
5,Lorain Co Kc
6,Marquette Kc
7,Grtr Freeport Il Kc
8,New Castle Kc
9,Kennel Cl Philadelphia
10,Kennel Cl Niagara Falls
11,Golden Triangle Kc Of Ms
12,Carroll Co Kc
13,Scottsbluff Kennel Club
14,Heartland Dog Club Of Florida
15,Simi Valley Kennel Club
16,"Contra Costa County Kennel Club, Inc."
17,Five Valley Kennel Club
18,"Green Mountain Dog Club, Inc."
19,"Raleigh Kennel Club, Inc."
20,Anniston Kennel Club
21,"Medina Kennel Club, Inc."
22,"Glens Falls Kennel Club, Inc."
23,"Central Indiana Kennel Club, Inc."
24,Greater Panama City Dog Fanciers Association
25,"Onondaga Kennel Association, Inc."
26,Huntsville Kennel Club
27,"Windham County Kennel Club, Inc."
28,"Pocatello Kennel Club, Inc."
29,"Central Florida Kennel Club, Inc."
30,"Upper Marlboro Kennel Club, Inc."
31,Heart Of The Plains Kennel Club
32,Morris And Essex Kennel Club
33,"Rapid City Kennel Club, Inc."
34,Comal County Kennel Club
35,Tuscaloosa Kennel Club
36,Northlake Kennel Club Of Greater Covington
37,"Arkansas Kennel Club, Inc."
38,"Memphis Kennel Club, Inc."
39,"Laramie Kennel Club, Inc."
40,Shasta Kennel Club
41,"Roanoke Kennel Club, Inc."
42,"Tidewater Kennel Club Of Virginia, Inc."
43,Saline County Kennel Club Of Arkansas
44,"Jupiter-tequesta Dog Club, Inc."
45,Rubber City Kennel Club
46,Cambridge Minnesota Kennel Club
47,Kokomo Kennel Club
48,D'arbonne Kennel Club
49,"Paducah Kennel Club, Inc."
50,Electric City Kennel Club
51,Mount Bachelor Kennel Club
52,"Tampa Bay Kennel Club, Inc."
53,Marquette Kennel Club
54,"Egyptian Kennel Club, Inc."
55,"Logansport Kennel Club, Inc."
56,Southeast Arkansas Kennel Club
57,Salisbury North Carolina Kennel Club
58,Yosemite Kennel Club
59,Minnesota River Valley Kennel Club
60,Grand Rapids Kennel Club
61,"Virginia Kennel Club, Inc."
62,Dan Emmett Kennel Club
63,"American Kennel Club,inc."
64,"Medina Kennel Club, Inc."
65,Comal County Kennel Club
66,Greater Fort Myers Dog Club
67,"Fargo-moorhead Kennel Club, Inc."
68,Anoka County Minnesota Kennel Club
69,"Green Mountain Dog Club, Inc."
70,New River Valley Kennel Club
71,"Oakland County Kennel Club, Inc."
72,Warrenton Kennel Club
73,"Mesilla Valley Kennel Club, Inc."
74,Penobscot Valley Kennel Club
75,Fun-tier Kennel Club Of Greater Killeen
76,Rubber City Kennel Club
77,"Manatee Kennel Club, Inc."
78,"Birmingham Kennel Club, Inc."
79,Crawford County Kennel Club
80,Greater Kingsport Kennel Club
81,Mississippi Valley Kennel Club
82,"Agathon Kennel Club, Inc."
83,"Hutchinson Kennel Club, Inc."
84,Atlanta Terrier Club
85,"Fort Steuben Kennel Association, Inc."
86,Hendersonville Kennel Club
87,Saginaw Valley Kennel Club
88,"Corpus Christi Kennel Club, Inc."
89,"Kenosha Kennel Club, Inc."
90,"Golden Valley Kennel Club, Inc."
91,"Central Indiana Kennel Club, Inc."
92,"Western Pennsylvania Kennel Association, Inc."
93,Minnesota River Valley Kennel Club
94,Grand Rapids Kennel Club
95,"Moberly Missouri Kennel Club, Inc."
96,"Mattoon Kennel Club, Inc."
97,"Spartanburg Kennel Club, Inc."
98,"Talbot Kennel Club, Inc."
99,Group Iv Terrier Club Of Salt Lake
100,Douglasville Kennel Club Of Georgia
101,Griffin Georgia Kennel Club
102,Northlake Kennel Club Of Greater Covington
103,Olive Branch Mississippi Kennel Club
104,Owensboro's River City Kennel Club
105,"Bald Eagle Kennel Club Of Williamsport, Pa., Inc."
106,Conroe Kennel Club
107,"Lorain County Kennel Club, Inc."
108,"Concho Kennel Club, Inc."
109,"Intermountain Kennel Club, Inc."
110,Greater Fort Myers Dog Club
111,Conewango Valley Kennel Club
112,Electric City Kennel Club
113,"Green Mountain Dog Club, Inc."
114,Anderson Kennel Club
115,"Pocono Mountain Kennel Club, Inc."
116,Saline County Kennel Club Of Arkansas
117,"Greater Venice Florida Dog Club, Inc."
118,"Northwest Arkansas Kennel Club, Inc."
