id,title
0,Andrea Dilorenzo and David Matthew Brown
1,Guest: Andrea DiLorenzo
2,Guest: Sharon Kachel
3,"The Lion: Lara Oshon, ""Love Is The New Sexy"""
4,The LION: Scott Franklin Manning
5,The Lion: Diana Diaz
6,The Lion: The Mystery
7,The Lion Radio: Lisa Noland-Shalosky Medium/Trance Channel
8,The Lion Radio: Nick Fox
9,The Lion Radio: Guest Nadine Kijner
10,The Lion Radio: Gail Thackray
11,Wendy J. Vitalich and Liz Hanley Raci
12,The Lion: Alexis Petrin
13,THE LION: Abbi O'Neall Founder Nova Lumina Therapy Of Light
14,The Lion: Drorit Rudin
15,The Lion: Nicole Bowdler
16,"THE LION RADIO: Natalie Geld, Author, ""Sensual Intelligence"""
17,THE LION: AWAKE THE DOCUMENTARY on Yogananda
18,"THE LION: Kelly Sullivan Walden, Dream Expert"
19,The Lion: Talk on Courage with David Matthew Brown
20,"THE LION: Talk On Dealing with Stress, And Allowing Life"
21,"The Lion: Nicole Bowdler, Channel ArchAngel Metatron"
22,THE LION: Jim Phillips
23,The Lion David Matthew Brown
24,"THE LION: Billy Shank, The Forgiveness Story"
25,THE LION: Wendy J. Vitalich Author/Speaker
26,THE LION: Felice Hernandez Singer
27,The Lion: James Thomas Singer/Songwriter
28,THE LION: Annabeth Rickley
29,"The Lion: Liz Hanley, Author, ""Bank of America And Jeezus"""
30,"The Lion: John Murphy, Zentrepreneur"
31,"Inside Out: Drorit Rudin, Founder Agoura Power Of Yoga"
32,Inside Out: Rev. Maria Felipe
33,"Inside Out: Britta Raci, Artist, Singer ""Zebrah Smacks"""
34,Inside Out: Kelley Lopez KML Designs
35,"Inside Out: Michael Mirdad Spiritual Teacher, Healer, and Author"
36,Inside Out: Theresa Gallagher Writer/Producer/Actress
37,Inside Out: Claire Candy Hough
38,"Inside Out: Jamie Dew, Host of The Dew Over"
39,Inside Out: Vanessa Lamorte
40,INSIDE OUT: Deena Robertson
41,MODO Yogi Emily Morwen
42,Astrologer Rachel Lang
43,Mokshie Yoga Teacher Joe Komar
44,Alicia Richardson
45,Mokshie Yogi: Robiwan McKennobi
46,"INSIDE OUT: Victoria Reiki, Energy and more!"
47,Deborah Beauvais
48,"CJ Martes "" Angel Incarnate: One Birth"""
49,Claire Candy Hough
50,Samuel Kiwasz
51,Temple Hayes
52,Gary Renard on Love
53,Terri Crawford
54,"on ""Improvisation of Love"""
55,Kristin Hanggi
56,Regina Dawn Akers
57,"Dr. Niki Elliott, ""The Intuitive Mother"""
58,"Gary Renard, Course In Miracles Teacher"
59,"Author, William Whitecloud ""The Last Shaman"
60,"Author Peter Fairfield, ""DEEP HAPPY"""
61,"Author, Musician, Radio host Keith Blanchard"
62,INSIDE OUT: Dan Millman author of PEACEFUL WARRIOR
63,INSIDE OUT: Tears of Stone (A true Story) author Estherleon Schwartz
64,"INSIDE OUT: Barry Selby, Inspiration & Life Coach/Facilitator/Speaker"
65,World Peace MArch
66,INSIDE OUT: (REPEAT) KELLY SULLIVAN WALDEN from Dream Project
67,INSIDE OUT RADIO Dedicates an entire show to Peace by going Silent
68,Inside Out Radio: Deva Premal and Miten
69,INSIDE OUT RADIO: Authors of EMOTIONAL WISDOM
70,INSIDE OUT: Carlo Novoa www.novoasalon.com
71,"Inside Out: William Whitecloud #1 book in Australia ""THE MAGICIANS WAYS"""
72,INSIDE OUT: Founder TED.com Richard Saul Wurman
73,"INSIDE OUT: Jeff Foster, 'An Extraordinary Absence: Liberation in the Midst of a Very Ordinary Life'"
74,INSIDE OUT: Wellington Rodrigues
75,INSIDE OUT RADIO: Founder of www.pray-pal.com CORY TYLER
76,INSIDE OUT: Stahsha
77,INSIDE OUT RADIO: INTERVIEWS THE STARS ON THE DAY OF PEACE
78,David Matthew Brown speaks on WATER the next GOLD
79,INSIDE OUT: WELCOMES REV. Lynne Brown for DAY OF PRAYER
80,INSIDE OUT: Christian “Thaahum” Abrokwah
81,Special host Nicolette Vajtay interviews Mary LoVerde
82,"Inside Out: Janet Conner's new book, Writing Down Your Soul"
83,INSIDE OUT: Dr. David Walker Pastor of Los Angeles Religious Science
84,Raffi Interview
85,"INSIDE OUT: RON TROUTMAN ""Cheers to you..."" As seen on the Ellen Show"
86,INSIDE OUT: Cary Ellis
87,"INSIDE OUT: Thank God I...with Jason Mannino, Thomas Gates, Aaron Kleinermann"
88,INSIDE OUT RADIO: WELCOMES JOHN RAATZ
89,INSIDE OUT RADIO: MICHELE WALTERS
90,WNBA PROMO FOR JUNE 27th- BOOKWOMEN!!
91,"INSIDE OUT RADIO: Barbara Bullard MA, ""Hemi-sync Music"""
92,"INSIDE OUT RADIO: JUDE LUTTRELL author ""OVER 40 FIT AND FAB"""
93,INSIDE OUT RADIO: DR. DAVID HAWKINS Author HEALING AND RECOVERY
94,INSIDE OUT RADIO: WELCOMES HAPPY OASIS RAW FOOD QUEEEN
95,INSIDE OUT RADIO: STEVE ALLEN
96,INSIDE OUT RADIO: Melissa Michaels
97,INSIDE OUT RADIO: SKIP JENNINGS
98,INSIDE OUT RADIO: Mike Robbins
99,"INSIDE OUT RADIO: Lauren Mackler Author of ""SOLEMATE"""
100,"INSIDE OUT RADIO: Duane Elgin author of ""The Living Universe"""
101,INSIDE OUT RADIO: Boise Thomas
102,INSIDE OUT RADIO: Living from Within
103,Dr. Michael Beckwith as seen on OPRAH and THE SECRET
104,INSIDE OUT RADIO: interviews Elle Collier Rae
105,INSIDE OUT RADIO: Interviews Ali Grace
106,INSIDE OUT RADIO: INterview Lisa Sarasohn
107,INSIDE OUT RADIO: Interviews Gina Cloud
108,INSIDE OUT RADIO : INTERVIEWS Dr. Maisha Hazzard
109,INSIDE OUT RADIO: WELCOMES Gayle Etcheverry LIVE
110,INSIDE OUT RADIO: WELCOMES ANDREA MARCUM LIVE
111,INSIDE OUT RADIO: David interviews Erica Woods
112,INSIDE OUT RADIO: Welcomes Elizabeth Lambaer
113,INSIDE OUT RADIO: DAVID INTERVIEWS Elaine Starling LIVE
114,INSIDE OUT RADIO LIVE WITH MALIN
115,INSIDE OUT: David interviews Byron Katie
116,INSIDE OUT: David interviews Chellie Campbell
117,INSIDE OUT RADIO: David interviews Michele Meiche
118,INSIDE OUT RADIO: David interviews Margaret Wendt
119,INSIDE OUT: David interviews Lisa Sahakian
120,INSIDE OUT: David interviews Photographer Cynthia Smalley
121,INSIDE OUT: David interviews Dr. Anne Paris
122,INSIDE OUT: David interviews Kim Corbin
123,"INSIDE OUT: David interviews Deborah Koppel Mitchell ""Modern Polyanna"""
124,INSIDE OUT
125,test
126,INSIDE OUT
127,David interviews Het Heru Replay
128,INSIDE OUT
129,INSIDE OUT
130,Byron Katie on INSIDE OUT Radio
131,INSIDE OUT
132,INSIDE OUT
133,INSIDE OUT
134,INSIDE OUT Re-Broadcast of Rev. Cynthia James (whole Interview)
135,David Interviews abundance coach and queen Edwene Gaines
136,David talks with Dr. Eileen Borris www.dreileenborris.com/
137,INSIDE OUT: David interviews speaker and writer Azim Khamisa
138,INSIDE OUT
139,David Brown's INSIDE OUT
