id,title
0,"College Prowler ""No Essay"" Competition"
1,College Prowler Unigo Scholarship
2,"""Make Me Laugh"" Scholarship"
3,"""Shout it Out"" Scholarship"
4,Ancira All Stars Scholarship Contest
5,Wendy's High School Heisman Scholarship
6,AES Engineers Scholarship
7,College Jump Start Scholarship
8,Horatio Alger National Scholarship
9,The Dream Scholarship
10,Coca-Cola Scholars Program
11,"""Education Matters"" Scholarship"
12,Eugene McDermott Scholars Program
13,Ron Brown Scholar Program
14,Say No to Bullying Scholarship Contest
15,Women's Transportation Seminar-SAR Scholarship
16,Stokes Educational Scholarship Program
17,Rolling Oaks Dental Miss Smile Contest
18,Es El Momento Scholarship
19,"FIRE's ""Freedom in Academia"" Essay Scholarship Contest"
20,Zombie Apocalypse Scholarship
21,The University of Texas at Austin Scholarships
22,Texas A&M University Scholarships
23,Texas A&M University Corpus Christi
24,Boston University Trustee Scholarship
25,SM Education Foundation Scholarsihp
26,Facilitated Access to Scientific Training Scholarship
27,Texas State University
28,Hispanic Scholarship Fund
29,Birthday Mail Campaign Scholarship
30,San Antonio LSA Scholarship
31,Healthy Lifestyles Scholarship
32,Seton Hall University
33,Ronald McDonald House Charities Scholarship
34,"Clorox ""Suena Sin Limites"""
35,"Hispanic Heritage Foundation and Colgate-Palmolive ""HAZ LA U"" Scholarship"
36,Edgewood Lions Club Scholarship
37,Top Ten List Scholarship
38,Coca-Cola La Michoacana Scholarship
39,John F. Kennedy Profile in Courage Essay Contest
40,Burger King Scholars Program
41,Gates Millennium Scholarship
42,Texas Engineering Foundation
43,GE-Reagan Foundation Scholarship
44,Tuskagee Airmen Scholarship
45,Dell Scholars Program
46,Mensa Education and Research Foundation Scholarship
47,Washington Crossing Foundation Scholarship
48,Create A Greeting Card Scholarship Contest
49,Association for Women in Mathematics
50,Texas Student Housing Scholarship
51,Texas History Essay Contest
52,I Have a Dream Scholarship
53,UTSA Terry Scholarship
54,AXA Achievement Scholarship
55,Baumberger Endowment Scholarship
56,Jackie Robinson Scholarship
57,UTSA Presidential Honors Scholarship
58,UTSA Alumni Association Scholarship
59,Don't Be Trashy Scholarship
60,Pan American League Scholarship
61,Peanut Butter & Jam Slam Scholarship
62,Second Hand Smoke Scholarship
63,Lowe's Scholarship
64,Huggable Heroes Scholarship
65,Buick Achievers Scholarship
66,Phi Delta Kappa Scholarship
67,HSF Proctor & Gamble Company Scholarship
68,HSF Hacemos Scholarship
69,The Next Big Thing Scholarship
70,"""Easy College Money"" Scholarship"
71,"College Prowler ""No Essay"" Competition"
72,City of San Antonio Dr. Martin Luther King Jr. Scholarship
73,Church's Scholars Program
74,Rising Roadrunner Scholarship
75,Texas Retired Teachers Foundation Scholarship
76,Southwest NAHRO Scholarship
77,SA YES Foundation Scholarship
78,Blue CaresSan Antonio Police Officers' Association Scholarship
79,San Antonio Women's Hall of Fame Scholarship
80,Jodie W. McCarley Scholarship
81,Texas Nursery & Landscape Association Education and Research Foundation Scholarship
82,Through the Looking Glass Scholarship
83,Texas Telephone Association Foundation Scholarship
84,CTAT Scholarship Program
85,The Lela and Slough Foundation Scholarship
86,Project Cleanup Scholarship
87,Texas Trial Lawyers Association Scholarship
88,Gilbraitti Scholarship
89,James Bader Scholarship
90,Andy Mireles Charitable Foundation Scholarship
91,LULAC National Scholarship
92,Rey Feo Scholarship
93,American Fire Sprinkler Association Scholarship
94,Edgewood Education Foundation Scholarship
95,ETS San Antonio Scholarship Program
96,San Antonio Lighthouse for the Blind Emma Freeman Memorial Scholarship
97,Edgewood Council of PTA Scholarship
98,Southern Texas PGA Foundation Scholarship
99,Mexican American Bar Association Scholarship
100,Jose Antonio Navarro Distinguished Student Scholarship
101,Edgewood Class of 66 Scholarship
102,SARR John Delgado Memorial Scholarship
103,Youth Volunteer Scholarship Award
104,San Antonio Republican Women
105,San Antonio A&M Club Foundation Scholarship
106,Fabric of Society Scholarship
107,Insurance Women of San Antonio Scholarship
108,Compadres for Scholarships
109,Edgewood District Veteran's Scholarship
110,Psi Alpha Chapter Omega Psi Phi Scholarship
111,HAI Group STARS Scholarship
112,People Smart Scholarship Contest
113,Alamo Area Alliance of Black School Educators Scholarship
114,University of Texas at San Antonio Access College and Excel Scholar Program
115,Education Investment Foundation Scholarship
116,A Voice For Animals Contest
117,I'm First Scholarship
118,Texas Interscholastic League Foundation Scholarship
119,TADC Urban Scholarship Fund
120,San Antonio Education Partnership Incentive Scholarship
121,Creative Outlook Cover Contest
